bert/logs/ansor.log
{"i": [["[\"d6724e79abefacb51d070a2800c8d695\", [8, 128, 1024], [8, 128, 1], [8, 128, 1], [1024], [1024], [8, 128, 1024]]", "cuda -keys=cuda,gpu -arch=sm_86 -max_num_threads=1024 -thread_warp_size=32", [-1, 16, 64, 49152, 2147483647, 1024, 8, 32], "llvm -keys=cpu ", 0, []], [[], [["CI", 9], ["CI", 7], ["CI", 6], ["CI", 5], ["CI", 4], ["CI", 2], ["FU", 11, [0, 1, 2]], ["SP", 11, 0, 1048576, [4], 1], ["AN", 11, 0, 5], ["AN", 11, 1, 6]]]], "r": [[0.00018705, 0.00018705, 0.000187058], 0, 1.83804, 1675066859], "v": "v0.6"}
{"i": [["[\"d6724e79abefacb51d070a2800c8d695\", [8, 128, 1024], [8, 128, 1], [8, 128, 1], [1024], [1024], [8, 128, 1024]]", "cuda -keys=cuda,gpu -arch=sm_86 -max_num_threads=1024 -thread_warp_size=32", [-1, 16, 64, 49152, 2147483647, 1024, 8, 32], "llvm -keys=cpu ", 0, []], [[], [["CI", 9], ["CI", 7], ["CI", 6], ["CI", 5], ["CI", 4], ["CI", 2], ["FU", 11, [0, 1, 2]], ["SP", 11, 0, 1048576, [16], 1], ["AN", 11, 0, 5], ["AN", 11, 1, 6]]]], "r": [[5.25308e-05, 5.2525e-05, 5.2516e-05], 0, 1.8084, 1675066861], "v": "v0.6"}
{"i": [["[\"d6724e79abefacb51d070a2800c8d695\", [8, 128, 1024], [8, 128, 1], [8, 128, 1], [1024], [1024], [8, 128, 1024]]", "cuda -keys=cuda,gpu -arch=sm_86 -max_num_threads=1024 -thread_warp_size=32", [-1, 16, 64, 49152, 2147483647, 1024, 8, 32], "llvm -keys=cpu ", 0, []], [[], [["CI", 9], ["CI", 7], ["CI", 6], ["CI", 5], ["CI", 4], ["CI", 2], ["FU", 11, [0, 1, 2]], ["SP", 11, 0, 1048576, [8], 1], ["AN", 11, 0, 5], ["AN", 11, 1, 6]]]], "r": [[0.000104058, 0.000104052, 0.000104039], 0, 1.82779, 1675066862], "v": "v0.6"}
{"i": [["[\"d6724e79abefacb51d070a2800c8d695\", [8, 128, 1024], [8, 128, 1], [8, 128, 1], [1024], [1024], [8, 128, 1024]]", "cuda -keys=cuda,gpu -arch=sm_86 -max_num_threads=1024 -thread_warp_size=32", [-1, 16, 64, 49152, 2147483647, 1024, 8, 32], "llvm -keys=cpu ", 0, []], [[], [["CI", 9], ["CI", 7], ["CI", 6], ["CI", 5], ["CI", 4], ["CI", 2], ["FU", 11, [0, 1, 2]], ["SP", 11, 0, 1048576, [1], 1], ["AN", 11, 0, 5], ["AN", 11, 1, 6]]]], "r": [[0.00073915, 0.000739175, 0.000739236], 0, 1.25963, 1675066863], "v": "v0.6"}
{"i": [["[\"d6724e79abefacb51d070a2800c8d695\", [8, 128, 1024], [8, 128, 1], [8, 128, 1], [1024], [1024], [8, 128, 1024]]", "cuda -keys=cuda,gpu -arch=sm_86 -max_num_threads=1024 -thread_warp_size=32", [-1, 16, 64, 49152, 2147483647, 1024, 8, 32], "llvm -keys=cpu ", 0, []], [[], [["CI", 9], ["CI", 7], ["CI", 6], ["CI", 5], ["CI", 4], ["CI", 2], ["FU", 11, [0, 1, 2]], ["SP", 11, 0, 1048576, [64], 1], ["AN", 11, 0, 5], ["AN", 11, 1, 6]]]], "r": [[2.45331e-05, 2.45277e-05, 2.48274e-05], 0, 1.81431, 1675066865], "v": "v0.6"}
{"i": [["[\"d6724e79abefacb51d070a2800c8d695\", [8, 128, 1024], [8, 128, 1], [8, 128, 1], [1024], [1024], [8, 128, 1024]]", "cuda -keys=cuda,gpu -arch=sm_86 -max_num_threads=1024 -thread_warp_size=32", [-1, 16, 64, 49152, 2147483647, 1024, 8, 32], "llvm -keys=cpu ", 0, []], [[], [["CI", 9], ["CI", 7], ["CI", 6], ["CI", 5], ["CI", 4], ["CI", 2], ["FU", 11, [0, 1, 2]], ["SP", 11, 0, 1048576, [32], 1], ["AN", 11, 0, 5], ["AN", 11, 1, 6]]]], "r": [[3.26325e-05, 3.26345e-05, 3.30908e-05], 0, 1.81905, 1675066866], "v": "v0.6"}
{"i": [["[\"d6724e79abefacb51d070a2800c8d695\", [8, 128, 1024], [8, 128, 1], [8, 128, 1], [1024], [1024], [8, 128, 1024]]", "cuda -keys=cuda,gpu -arch=sm_86 -max_num_threads=1024 -thread_warp_size=32", [-1, 16, 64, 49152, 2147483647, 1024, 8, 32], "llvm -keys=cpu ", 0, []], [[], [["CI", 9], ["CI", 7], ["CI", 6], ["CI", 5], ["CI", 4], ["CI", 2], ["FU", 11, [0, 1, 2]], ["SP", 11, 0, 1048576, [2], 1], ["AN", 11, 0, 5], ["AN", 11, 1, 6]]]], "r": [[0.000370925, 0.000370921, 0.000370907], 0, 1.82646, 1675066868], "v": "v0.6"}
{"i": [["[\"653868ea1853936b9916ea8e64af13b6\", [8, 128, 1024], [8, 128, 1], [8, 128, 1], [1024], [1024], [8, 1024]]", "cuda -keys=cuda,gpu -arch=sm_86 -max_num_threads=1024 -thread_warp_size=32", [-1, 16, 64, 49152, 2147483647, 1024, 8, 32], "llvm -keys=cpu ", 0, []], [[], [["CI", 13], ["CI", 12], ["CI", 10], ["CI", 8], ["CI", 7], ["CI", 6], ["CI", 5], ["CI", 3], ["CI", 0], ["FU", 14, [0, 1]], ["SP", 14, 0, 8192, [8], 1], ["AN", 14, 0, 5], ["AN", 14, 1, 6]]]], "r": [[2.74346e-06, 2.7436e-06, 2.74351e-06], 0, 1.43134, 1675066929], "v": "v0.6"}
{"i": [["[\"653868ea1853936b9916ea8e64af13b6\", [8, 128, 1024], [8, 128, 1], [8, 128, 1], [1024], [1024], [8, 1024]]", "cuda -keys=cuda,gpu -arch=sm_86 -max_num_threads=1024 -thread_warp_size=32", [-1, 16, 64, 49152, 2147483647, 1024, 8, 32], "llvm -keys=cpu ", 0, []], [[], [["CI", 13], ["CI", 12], ["CI", 10], ["CI", 8], ["CI", 7], ["CI", 6], ["CI", 5], ["CI", 3], ["CI", 0], ["FU", 14, [0, 1]], ["SP", 14, 0, 8192, [1], 1], ["AN", 14, 0, 5], ["AN", 14, 1, 6]]]], "r": [[7.77066e-06, 7.77073e-06, 7.76993e-06], 0, 1.64671, 1675066931], "v": "v0.6"}
{"i": [["[\"653868ea1853936b9916ea8e64af13b6\", [8, 128, 1024], [8, 128, 1], [8, 128, 1], [1024], [1024], [8, 1024]]", "cuda -keys=cuda,gpu -arch=sm_86 -max_num_threads=1024 -thread_warp_size=32", [-1, 16, 64, 49152, 2147483647, 1024, 8, 32], "llvm -keys=cpu ", 0, []], [[], [["CI", 13], ["CI", 12], ["CI", 10], ["CI", 8], ["CI", 7], ["CI", 6], ["CI", 5], ["CI", 3], ["CI", 0], ["FU", 14, [0, 1]], ["SP", 14, 0, 8192, [64], 1], ["AN", 14, 0, 5], ["AN", 14, 1, 6]]]], "r": [[2.10341e-06, 2.10344e-06, 2.10341e-06], 0, 1.34136, 1675066932], "v": "v0.6"}
{"i": [["[\"653868ea1853936b9916ea8e64af13b6\", [8, 128, 1024], [8, 128, 1], [8, 128, 1], [1024], [1024], [8, 1024]]", "cuda -keys=cuda,gpu -arch=sm_86 -max_num_threads=1024 -thread_warp_size=32", [-1, 16, 64, 49152, 2147483647, 1024, 8, 32], "llvm -keys=cpu ", 0, []], [[], [["CI", 13], ["CI", 12], ["CI", 10], ["CI", 8], ["CI", 7], ["CI", 6], ["CI", 5], ["CI", 3], ["CI", 0], ["FU", 14, [0, 1]], ["SP", 14, 0, 8192, [4], 1], ["AN", 14, 0, 5], ["AN", 14, 1, 6]]]], "r": [[3.53803e-06, 3.53761e-06, 3.53838e-06], 0, 1.46605, 1675066933], "v": "v0.6"}
{"i": [["[\"653868ea1853936b9916ea8e64af13b6\", [8, 128, 1024], [8, 128, 1], [8, 128, 1], [1024], [1024], [8, 1024]]", "cuda -keys=cuda,gpu -arch=sm_86 -max_num_threads=1024 -thread_warp_size=32", [-1, 16, 64, 49152, 2147483647, 1024, 8, 32], "llvm -keys=cpu ", 0, []], [[], [["CI", 13], ["CI", 12], ["CI", 10], ["CI", 8], ["CI", 7], ["CI", 6], ["CI", 5], ["CI", 3], ["CI", 0], ["FU", 14, [0, 1]], ["SP", 14, 0, 8192, [2], 1], ["AN", 14, 0, 5], ["AN", 14, 1, 6]]]], "r": [[4.91805e-06, 4.91893e-06, 4.91517e-06], 0, 1.60077, 1675066934], "v": "v0.6"}
{"i": [["[\"653868ea1853936b9916ea8e64af13b6\", [8, 128, 1024], [8, 128, 1], [8, 128, 1], [1024], [1024], [8, 1024]]", "cuda -keys=cuda,gpu -arch=sm_86 -max_num_threads=1024 -thread_warp_size=32", [-1, 16, 64, 49152, 2147483647, 1024, 8, 32], "llvm -keys=cpu ", 0, []], [[], [["CI", 13], ["CI", 12], ["CI", 10], ["CI", 8], ["CI", 7], ["CI", 6], ["CI", 5], ["CI", 3], ["CI", 0], ["FU", 14, [0, 1]], ["SP", 14, 0, 8192, [16], 1], ["AN", 14, 0, 5], ["AN", 14, 1, 6]]]], "r": [[2.39952e-06, 2.39975e-06, 2.39979e-06], 0, 1.40394, 1675066935], "v": "v0.6"}
{"i": [["[\"653868ea1853936b9916ea8e64af13b6\", [8, 128, 1024], [8, 128, 1], [8, 128, 1], [1024], [1024], [8, 1024]]", "cuda -keys=cuda,gpu -arch=sm_86 -max_num_threads=1024 -thread_warp_size=32", [-1, 16, 64, 49152, 2147483647, 1024, 8, 32], "llvm -keys=cpu ", 0, []], [[], [["CI", 13], ["CI", 12], ["CI", 10], ["CI", 8], ["CI", 7], ["CI", 6], ["CI", 5], ["CI", 3], ["CI", 0], ["FU", 14, [0, 1]], ["SP", 14, 0, 8192, [32], 1], ["AN", 14, 0, 5], ["AN", 14, 1, 6]]]], "r": [[2.18297e-06, 2.18306e-06, 2.18295e-06], 0, 1.34674, 1675066936], "v": "v0.6"}
{"i": [["[\"d320fe41e200472e48316303a3461f84\", [8, 1024], [1024, 1024], [1, 1024], [8, 1024]]", "cuda -keys=cuda,gpu -arch=sm_86 -max_num_threads=1024 -thread_warp_size=32", [-1, 16, 64, 49152, 2147483647, 1024, 8, 32], "llvm -keys=cpu ", 0, []], [[], [["CI", 4], ["SP", 2, 0, 8, [8, 1, 1, 1], 1], ["SP", 2, 5, 1024, [1, 512, 1, 1], 1], ["SP", 2, 10, 1024, [2, 8], 1], ["RE", 2, [0, 5, 1, 6, 2, 7, 10, 11, 3, 8, 12, 4, 9]], ["FSP", 5, 0, 1, 3], ["FSP", 5, 4, 2, 3], ["RE", 5, [0, 4, 1, 5, 2, 6, 3, 7]], ["CA", 2, 5, 5], ["CHR", 1, "shared", [2]], ["CA", 2, 3, 6], ["CHR", 0, "shared", [3]], ["CA", 1, 4, 6], ["FU", 7, [0, 1]], ["AN", 7, 0, 5], ["FU", 7, [1, 2]], ["AN", 7, 1, 4], ["FU", 7, [2, 3]], ["AN", 7, 2, 6], ["FU", 3, [0, 1]], ["SP", 3, 0, 16, [1], 1], ["AN", 3, 1, 2], ["FFSP", 3, 0, [2, 1], 1, 1], ["AN", 3, 1, 6], ["FU", 1, [0, 1]], ["SP", 1, 0, 16, [4], 1], ["AN", 1, 1, 2], ["FFSP", 1, 0, [2, 1], 1, 1], ["AN", 1, 1, 6], ["PR", 4, 0, "auto_unroll_max_step$64"]]]], "r": [[0.0001036, 0.000103598, 0.000103602], 0, 1.91525, 1675067031], "v": "v0.6"}
{"i": [["[\"d320fe41e200472e48316303a3461f84\", [8, 1024], [1024, 1024], [1, 1024], [8, 1024]]", "cuda -keys=cuda,gpu -arch=sm_86 -max_num_threads=1024 -thread_warp_size=32", [-1, 16, 64, 49152, 2147483647, 1024, 8, 32], "llvm -keys=cpu ", 0, []], [[], [["CI", 4], ["SP", 2, 0, 8, [1, 1, 1, 1], 1], ["SP", 2, 5, 1024, [2, 128, 1, 2], 1], ["SP", 2, 10, 1024, [1, 16], 1], ["RE", 2, [0, 5, 1, 6, 2, 7, 10, 11, 3, 8, 12, 4, 9]], ["FSP", 5, 0, 1, 3], ["FSP", 5, 4, 2, 3], ["RE", 5, [0, 4, 1, 5, 2, 6, 3, 7]], ["CA", 2, 5, 5], ["CHR", 1, "shared", [2]], ["CA", 2, 3, 6], ["CHR", 0, "shared", [3]], ["CA", 1, 4, 6], ["FU", 7, [0, 1]], ["AN", 7, 0, 5], ["FU", 7, [1, 2]], ["AN", 7, 1, 4], ["FU", 7, [2, 3]], ["AN", 7, 2, 6], ["FU", 3, [0, 1]], ["SP", 3, 0, 32, [8], 1], ["AN", 3, 1, 2], ["FFSP", 3, 0, [2, 1], 1, 1], ["AN", 3, 1, 6], ["FU", 1, [0, 1]], ["SP", 1, 0, 16, [2], 1], ["AN", 1, 1, 2], ["FFSP", 1, 0, [2, 1], 1, 1], ["AN", 1, 1, 6], ["PR", 4, 0, "auto_unroll_max_step$1024"]]]], "r": [[8.84553e-05, 8.84525e-05, 8.84539e-05], 0, 1.86435, 1675067032], "v": "v0.6"}
{"i": [["[\"d320fe41e200472e48316303a3461f84\", [8, 1024], [1024, 1024], [1, 1024], [8, 1024]]", "cuda -keys=cuda,gpu -arch=sm_86 -max_num_threads=1024 -thread_warp_size=32", [-1, 16, 64, 49152, 2147483647, 1024, 8, 32], "llvm -keys=cpu ", 0, []], [[], [["CI", 4], ["SP", 2, 0, 8, [2, 4, 1, 1], 1], ["SP", 2, 5, 1024, [4, 8, 2, 16], 1], ["SP", 2, 10, 1024, [2, 1], 1], ["RE", 2, [0, 5, 1, 6, 2, 7, 10, 11, 3, 8, 12, 4, 9]], ["FSP", 5, 0, 1, 3], ["FSP", 5, 4, 2, 3], ["RE", 5, [0, 4, 1, 5, 2, 6, 3, 7]], ["CA", 2, 5, 5], ["CHR", 1, "shared", [2]], ["CA", 2, 3, 6], ["CHR", 0, "shared", [3]], ["CA", 1, 4, 6], ["FU", 7, [0, 1]], ["AN", 7, 0, 5], ["FU", 7, [1, 2]], ["AN", 7, 1, 4], ["FU", 7, [2, 3]], ["AN", 7, 2, 6], ["FU", 3, [0, 1]], ["SP", 3, 0, 128, [1], 1], ["AN", 3, 1, 2], ["FFSP", 3, 0, [2, 1], 1, 1], ["AN", 3, 1, 6], ["FU", 1, [0, 1]], ["SP", 1, 0, 4, [2], 1], ["AN", 1, 1, 2], ["FFSP", 1, 0, [2, 1], 1, 1], ["AN", 1, 1, 6], ["PR", 4, 0, "auto_unroll_max_step$1024"]]]], "r": [[0.00243357, 0.0024336, 0.00243361], 0, 2.63755, 1675067033], "v": "v0.6"}
{"i": [["[\"d320fe41e200472e48316303a3461f84\", [8, 1024], [1024, 1024], [1, 1024], [8, 1024]]", "cuda -keys=cuda,gpu -arch=sm_86 -max_num_threads=1024 -thread_warp_size=32", [-1, 16, 64, 49152, 2147483647, 1024, 8, 32], "llvm -keys=cpu ", 0, []], [[], [["CI", 4], ["SP", 2, 0, 8, [1, 1, 2, 1], 1], ["SP", 2, 5, 1024, [1, 128, 2, 1], 1], ["SP", 2, 10, 1024, [1, 16], 1], ["RE", 2, [0, 5, 1, 6, 2, 7, 10, 11, 3, 8, 12, 4, 9]], ["FSP", 5, 0, 1, 3], ["FSP", 5, 4, 2, 3], ["RE", 5, [0, 4, 1, 5, 2, 6, 3, 7]], ["CA", 2, 5, 5], ["CHR", 1, "shared", [2]], ["CA", 2, 3, 6], ["CHR", 0, "shared", [3]], ["CA", 1, 4, 6], ["FU", 7, [0, 1]], ["AN", 7, 0, 5], ["FU", 7, [1, 2]], ["AN", 7, 1, 4], ["FU", 7, [2, 3]], ["AN", 7, 2, 6], ["FU", 3, [0, 1]], ["SP", 3, 0, 32, [1], 1], ["AN", 3, 1, 2], ["FFSP", 3, 0, [2, 1], 1, 1], ["AN", 3, 1, 6], ["FU", 1, [0, 1]], ["SP", 1, 0, 16, [1], 1], ["AN", 1, 1, 2], ["FFSP", 1, 0, [2, 1], 1, 1], ["AN", 1, 1, 6], ["PR", 4, 0, "auto_unroll_max_step$1024"]]]], "r": [[6.15367e-05, 6.15354e-05, 6.15358e-05], 0, 1.86724, 1675067035], "v": "v0.6"}
{"i": [["[\"d320fe41e200472e48316303a3461f84\", [8, 1024], [1024, 1024], [1, 1024], [8, 1024]]", "cuda -keys=cuda,gpu -arch=sm_86 -max_num_threads=1024 -thread_warp_size=32", [-1, 16, 64, 49152, 2147483647, 1024, 8, 32], "llvm -keys=cpu ", 0, []], [[], [["CI", 4], ["SP", 2, 0, 8, [1, 1, 2, 4], 1], ["SP", 2, 5, 1024, [1, 32, 16, 1], 1], ["SP", 2, 10, 1024, [1, 2], 1], ["RE", 2, [0, 5, 1, 6, 2, 7, 10, 11, 3, 8, 12, 4, 9]], ["FSP", 5, 0, 1, 3], ["FSP", 5, 4, 2, 3], ["RE", 5, [0, 4, 1, 5, 2, 6, 3, 7]], ["CA", 2, 5, 5], ["CHR", 1, "shared", [2]], ["CA", 2, 3, 6], ["CHR", 0, "shared", [3]], ["CA", 1, 4, 6], ["FU", 7, [0, 1]], ["AN", 7, 0, 5], ["FU", 7, [1, 2]], ["AN", 7, 1, 4], ["FU", 7, [2, 3]], ["AN", 7, 2, 6], ["FU", 3, [0, 1]], ["SP", 3, 0, 32, [2], 1], ["AN", 3, 1, 2], ["FFSP", 3, 0, [2, 1], 1, 1], ["AN", 3, 1, 6], ["FU", 1, [0, 1]], ["SP", 1, 0, 8, [1], 1], ["AN", 1, 1, 2], ["FFSP", 1, 0, [2, 1], 1, 1], ["AN", 1, 1, 6], ["PR", 4, 0, "auto_unroll_max_step$512"]]]], "r": [[0.000436772, 0.000436826, 0.000436814], 0, 2.16571, 1675067036], "v": "v0.6"}
{"i": [["[\"d320fe41e200472e48316303a3461f84\", [8, 1024], [1024, 1024], [1, 1024], [8, 1024]]", "cuda -keys=cuda,gpu -arch=sm_86 -max_num_threads=1024 -thread_warp_size=32", [-1, 16, 64, 49152, 2147483647, 1024, 8, 32], "llvm -keys=cpu ", 0, []], [[], [["CI", 4], ["SP", 2, 0, 8, [1, 8, 1, 1], 1], ["SP", 2, 5, 1024, [2, 8, 2, 1], 1], ["SP", 2, 10, 1024, [4, 4], 1], ["RE", 2, [0, 5, 1, 6, 2, 7, 10, 11, 3, 8, 12, 4, 9]], ["FSP", 5, 0, 1, 3], ["FSP", 5, 4, 2, 3], ["RE", 5, [0, 4, 1, 5, 2, 6, 3, 7]], ["CA", 2, 5, 5], ["CHR", 1, "shared", [2]], ["CA", 2, 3, 6], ["CHR", 0, "shared", [3]], ["CA", 1, 4, 6], ["FU", 7, [0, 1]], ["AN", 7, 0, 5], ["FU", 7, [1, 2]], ["AN", 7, 1, 4], ["FU", 7, [2, 3]], ["AN", 7, 2, 6], ["FU", 3, [0, 1]], ["SP", 3, 0, 128, [1], 1], ["AN", 3, 1, 2], ["FFSP", 3, 0, [2, 1], 1, 1], ["AN", 3, 1, 6], ["FU", 1, [0, 1]], ["SP", 1, 0, 16, [1], 1], ["AN", 1, 1, 2], ["FFSP", 1, 0, [2, 1], 1, 1], ["AN", 1, 1, 6], ["PR", 4, 0, "auto_unroll_max_step$0"]]]], "r": [[2.91421e-05, 2.91408e-05, 2.91529e-05], 0, 1.78417, 1675067038], "v": "v0.6"}
{"i": [["[\"d320fe41e200472e48316303a3461f84\", [8, 1024], [1024, 1024], [1, 1024], [8, 1024]]", "cuda -keys=cuda,gpu -arch=sm_86 -max_num_threads=1024 -thread_warp_size=32", [-1, 16, 64, 49152, 2147483647, 1024, 8, 32], "llvm -keys=cpu ", 0, []], [[], [["CI", 4], ["SP", 2, 0, 8, [1, 2, 1, 4], 1], ["SP", 2, 5, 1024, [2, 16, 2, 2], 1], ["SP", 2, 10, 1024, [64, 2], 1], ["RE", 2, [0, 5, 1, 6, 2, 7, 10, 11, 3, 8, 12, 4, 9]], ["FSP", 5, 0, 1, 3], ["FSP", 5, 4, 2, 3], ["RE", 5, [0, 4, 1, 5, 2, 6, 3, 7]], ["CA", 2, 5, 5], ["CHR", 1, "shared", [2]], ["CA", 2, 3, 6], ["CHR", 0, "shared", [3]], ["CA", 1, 4, 6], ["FU", 7, [0, 1]], ["AN", 7, 0, 5], ["FU", 7, [1, 2]], ["AN", 7, 1, 4], ["FU", 7, [2, 3]], ["AN", 7, 2, 6], ["FU", 3, [0, 1]], ["SP", 3, 0, 512, [1], 1], ["AN", 3, 1, 2], ["FFSP", 3, 0, [2, 1], 1, 1], ["AN", 3, 1, 6], ["FU", 1, [0, 1]], ["SP", 1, 0, 512, [4], 1], ["AN", 1, 1, 2], ["FFSP", 1, 0, [2, 1], 1, 1], ["AN", 1, 1, 6], ["PR", 4, 0, "auto_unroll_max_step$16"]]]], "r": [[0.000142128, 0.000142128, 0.000142126], 0, 1.91447, 1675067039], "v": "v0.6"}
{"i": [["[\"d320fe41e200472e48316303a3461f84\", [8, 1024], [1024, 1024], [1, 1024], [8, 1024]]", "cuda -keys=cuda,gpu -arch=sm_86 -max_num_threads=1024 -thread_warp_size=32", [-1, 16, 64, 49152, 2147483647, 1024, 8, 32], "llvm -keys=cpu ", 0, []], [[], [["CI", 4], ["SP", 2, 0, 8, [1, 2, 2, 2], 1], ["SP", 2, 5, 1024, [4, 64, 4, 1], 1], ["SP", 2, 10, 1024, [2, 4], 1], ["RE", 2, [0, 5, 1, 6, 2, 7, 10, 11, 3, 8, 12, 4, 9]], ["FSP", 5, 0, 1, 3], ["FSP", 5, 4, 2, 3], ["RE", 5, [0, 4, 1, 5, 2, 6, 3, 7]], ["CA", 2, 5, 5], ["CHR", 1, "shared", [2]], ["CA", 2, 3, 6], ["CHR", 0, "shared", [3]], ["CA", 1, 4, 6], ["FU", 7, [0, 1]], ["AN", 7, 0, 5], ["FU", 7, [1, 2]], ["AN", 7, 1, 4], ["FU", 7, [2, 3]], ["AN", 7, 2, 6], ["FU", 3, [0, 1]], ["SP", 3, 0, 32, [8], 1], ["AN", 3, 1, 2], ["FFSP", 3, 0, [2, 1], 1, 1], ["AN", 3, 1, 6], ["FU", 1, [0, 1]], ["SP", 1, 0, 16, [16], 1], ["AN", 1, 1, 2], ["FFSP", 1, 0, [2, 1], 1, 1], ["AN", 1, 1, 6], ["PR", 4, 0, "auto_unroll_max_step$512"]]]], "r": [[0.000342863, 0.000342856, 0.000342855], 0, 2.66089, 1675067040], "v": "v0.6"}
{"i": [["[\"d320fe41e200472e48316303a3461f84\", [8, 1024], [1024, 1024], [1, 1024], [8, 1024]]", "cuda -keys=cuda,gpu -arch=sm_86 -max_num_threads=1024 -thread_warp_size=32", [-1, 16, 64, 49152, 2147483647, 1024, 8, 32], "llvm -keys=cpu ", 0, []], [[], [["CI", 4], ["SP", 2, 0, 8, [1, 1, 2, 1], 1], ["SP", 2, 5, 1024, [1, 128, 1, 2], 1], ["SP", 2, 10, 1024, [8, 2], 1], ["RE", 2, [0, 5, 1, 6, 2, 7, 10, 11, 3, 8, 12, 4, 9]], ["FSP", 5, 0, 1, 3], ["FSP", 5, 4, 2, 3], ["RE", 5, [0, 4, 1, 5, 2, 6, 3, 7]], ["CA", 2, 5, 5], ["CHR", 1, "shared", [2]], ["CA", 2, 3, 6], ["CHR", 0, "shared", [3]], ["CA", 1, 4, 6], ["FU", 7, [0, 1]], ["AN", 7, 0, 5], ["FU", 7, [1, 2]], ["AN", 7, 1, 4], ["FU", 7, [2, 3]], ["AN", 7, 2, 6], ["FU", 3, [0, 1]], ["SP", 3, 0, 32, [1], 1], ["AN", 3, 1, 2], ["FFSP", 3, 0, [2, 1], 1, 1], ["AN", 3, 1, 6], ["FU", 1, [0, 1]], ["SP", 1, 0, 16, [1], 1], ["AN", 1, 1, 2], ["FFSP", 1, 0, [2, 1], 1, 1], ["AN", 1, 1, 6], ["PR", 4, 0, "auto_unroll_max_step$0"]]]], "r": [[5.94736e-05, 5.94766e-05, 5.94764e-05], 0, 1.8177, 1675067042], "v": "v0.6"}
{"i": [["[\"d320fe41e200472e48316303a3461f84\", [8, 1024], [1024, 1024], [1, 1024], [8, 1024]]", "cuda -keys=cuda,gpu -arch=sm_86 -max_num_threads=1024 -thread_warp_size=32", [-1, 16, 64, 49152, 2147483647, 1024, 8, 32], "llvm -keys=cpu ", 0, []], [[], [["CI", 4], ["SP", 2, 0, 8, [2, 4, 1, 1], 1], ["SP", 2, 5, 1024, [4, 16, 1, 2], 1], ["SP", 2, 10, 1024, [1, 32], 1], ["RE", 2, [0, 5, 1, 6, 2, 7, 10, 11, 3, 8, 12, 4, 9]], ["FSP", 5, 0, 1, 3], ["FSP", 5, 4, 2, 3], ["RE", 5, [0, 4, 1, 5, 2, 6, 3, 7]], ["CA", 2, 5, 5], ["CHR", 1, "shared", [2]], ["CA", 2, 3, 6], ["CHR", 0, "shared", [3]], ["CA", 1, 4, 6], ["FU", 7, [0, 1]], ["AN", 7, 0, 5], ["FU", 7, [1, 2]], ["AN", 7, 1, 4], ["FU", 7, [2, 3]], ["AN", 7, 2, 6], ["FU", 3, [0, 1]], ["SP", 3, 0, 64, [1], 1], ["AN", 3, 1, 2], ["FFSP", 3, 0, [2, 1], 1, 1], ["AN", 3, 1, 6], ["FU", 1, [0, 1]], ["SP", 1, 0, 32, [2], 1], ["AN", 1, 1, 2], ["FFSP", 1, 0, [2, 1], 1, 1], ["AN", 1, 1, 6], ["PR", 4, 0, "auto_unroll_max_step$64"]]]], "r": [[9.95372e-05, 9.95366e-05, 9.95358e-05], 0, 2.02795, 1675067043], "v": "v0.6"}
{"i": [["[\"d320fe41e200472e48316303a3461f84\", [8, 1024], [1024, 1024], [1, 1024], [8, 1024]]", "cuda -keys=cuda,gpu -arch=sm_86 -max_num_threads=1024 -thread_warp_size=32", [-1, 16, 64, 49152, 2147483647, 1024, 8, 32], "llvm -keys=cpu ", 0, []], [[], [["CI", 4], ["SP", 2, 0, 8, [1, 2, 1, 1], 1], ["SP", 2, 5, 1024, [1, 128, 2, 2], 1], ["SP", 2, 10, 1024, [8, 4], 1], ["RE", 2, [0, 5, 1, 6, 2, 7, 10, 11, 3, 8, 12, 4, 9]], ["FSP", 5, 0, 1, 3], ["FSP", 5, 4, 2, 3], ["RE", 5, [0, 4, 1, 5, 2, 6, 3, 7]], ["CA", 2, 5, 5], ["CHR", 1, "shared", [2]], ["CA", 2, 3, 6], ["CHR", 0, "shared", [3]], ["CA", 1, 4, 6], ["FU", 7, [0, 1]], ["AN", 7, 0, 5], ["FU", 7, [1, 2]], ["AN", 7, 1, 4], ["FU", 7, [2, 3]], ["AN", 7, 2, 6], ["FU", 3, [0, 1]], ["SP", 3, 0, 128, [1], 1], ["AN", 3, 1, 2], ["FFSP", 3, 0, [2, 1], 1, 1], ["AN", 3, 1, 6], ["FU", 1, [0, 1]], ["SP", 1, 0, 32, [1], 1], ["AN", 1, 1, 2], ["FFSP", 1, 0, [2, 1], 1, 1], ["AN", 1, 1, 6], ["PR", 4, 0, "auto_unroll_max_step$1024"]]]], "r": [[0.000201891, 0.000201905, 0.00020191], 0, 2.04418, 1675067045], "v": "v0.6"}
{"i": [["[\"d320fe41e200472e48316303a3461f84\", [8, 1024], [1024, 1024], [1, 1024], [8, 1024]]", "cuda -keys=cuda,gpu -arch=sm_86 -max_num_threads=1024 -thread_warp_size=32", [-1, 16, 64, 49152, 2147483647, 1024, 8, 32], "llvm -keys=cpu ", 0, []], [[], [["CI", 4], ["SP", 2, 0, 8, [1, 1, 4, 1], 1], ["SP", 2, 5, 1024, [4, 32, 2, 1], 1], ["SP", 2, 10, 1024, [1, 32], 1], ["RE", 2, [0, 5, 1, 6, 2, 7, 10, 11, 3, 8, 12, 4, 9]], ["FSP", 5, 0, 1, 3], ["FSP", 5, 4, 2, 3], ["RE", 5, [0, 4, 1, 5, 2, 6, 3, 7]], ["CA", 2, 5, 5], ["CHR", 1, "shared", [2]], ["CA", 2, 3, 6], ["CHR", 0, "shared", [3]], ["CA", 1, 4, 6], ["FU", 7, [0, 1]], ["AN", 7, 0, 5], ["FU", 7, [1, 2]], ["AN", 7, 1, 4], ["FU", 7, [2, 3]], ["AN", 7, 2, 6], ["FU", 3, [0, 1]], ["SP", 3, 0, 64, [1], 1], ["AN", 3, 1, 2], ["FFSP", 3, 0, [2, 1], 1, 1], ["AN", 3, 1, 6], ["FU", 1, [0, 1]], ["SP", 1, 0, 256, [1], 1], ["AN", 1, 1, 2], ["FFSP", 1, 0, [2, 1], 1, 1], ["AN", 1, 1, 6], ["PR", 4, 0, "auto_unroll_max_step$0"]]]], "r": [[0.00039084, 0.000390831, 0.000390835], 0, 2.24847, 1675067046], "v": "v0.6"}
{"i": [["[\"d320fe41e200472e48316303a3461f84\", [8, 1024], [1024, 1024], [1, 1024], [8, 1024]]", "cuda -keys=cuda,gpu -arch=sm_86 -max_num_threads=1024 -thread_warp_size=32", [-1, 16, 64, 49152, 2147483647, 1024, 8, 32], "llvm -keys=cpu ", 0, []], [[], [["CI", 4], ["SP", 2, 0, 8, [2, 4, 1, 1], 1], ["SP", 2, 5, 1024, [1, 16, 4, 1], 1], ["SP", 2, 10, 1024, [1, 4], 1], ["RE", 2, [0, 5, 1, 6, 2, 7, 10, 11, 3, 8, 12, 4, 9]], ["FSP", 5, 0, 1, 3], ["FSP", 5, 4, 2, 3], ["RE", 5, [0, 4, 1, 5, 2, 6, 3, 7]], ["CA", 2, 5, 5], ["CHR", 1, "shared", [2]], ["CA", 2, 3, 6], ["CHR", 0, "shared", [3]], ["CA", 1, 4, 6], ["FU", 7, [0, 1]], ["AN", 7, 0, 5], ["FU", 7, [1, 2]], ["AN", 7, 1, 4], ["FU", 7, [2, 3]], ["AN", 7, 2, 6], ["FU", 3, [0, 1]], ["SP", 3, 0, 128, [1], 1], ["AN", 3, 1, 2], ["FFSP", 3, 0, [2, 1], 1, 1], ["AN", 3, 1, 6], ["FU", 1, [0, 1]], ["SP", 1, 0, 32, [1], 1], ["AN", 1, 1, 2], ["FFSP", 1, 0, [2, 1], 1, 1], ["AN", 1, 1, 6], ["PR", 4, 0, "auto_unroll_max_step$512"]]]], "r": [[4.75517e-05, 4.75522e-05, 4.75511e-05], 0, 1.80616, 1675067048], "v": "v0.6"}
{"i": [["[\"d320fe41e200472e48316303a3461f84\", [8, 1024], [1024, 1024], [1, 1024], [8, 1024]]", "cuda -keys=cuda,gpu -arch=sm_86 -max_num_threads=1024 -thread_warp_size=32", [-1, 16, 64, 49152, 2147483647, 1024, 8, 32], "llvm -keys=cpu ", 0, []], [[], [["CI", 4], ["SP", 2, 0, 8, [2, 2, 1, 1], 1], ["SP", 2, 5, 1024, [2, 64, 1, 1], 1], ["SP", 2, 10, 1024, [16, 4], 1], ["RE", 2, [0, 5, 1, 6, 2, 7, 10, 11, 3, 8, 12, 4, 9]], ["FSP", 5, 0, 1, 3], ["FSP", 5, 4, 2, 3], ["RE", 5, [0, 4, 1, 5, 2, 6, 3, 7]], ["CA", 2, 5, 5], ["CHR", 1, "shared", [2]], ["CA", 2, 3, 6], ["CHR", 0, "shared", [3]], ["CA", 1, 4, 6], ["FU", 7, [0, 1]], ["AN", 7, 0, 5], ["FU", 7, [1, 2]], ["AN", 7, 1, 4], ["FU", 7, [2, 3]], ["AN", 7, 2, 6], ["FU", 3, [0, 1]], ["SP", 3, 0, 16, [1], 1], ["AN", 3, 1, 2], ["FFSP", 3, 0, [2, 1], 1, 1], ["AN", 3, 1, 6], ["FU", 1, [0, 1]], ["SP", 1, 0, 16, [1], 1], ["AN", 1, 1, 2], ["FFSP", 1, 0, [2, 1], 1, 1], ["AN", 1, 1, 6], ["PR", 4, 0, "auto_unroll_max_step$16"]]]], "r": [[5.58704e-05, 5.58664e-05, 5.58707e-05], 0, 1.87138, 1675067049], "v": "v0.6"}
{"i": [["[\"d320fe41e200472e48316303a3461f84\", [8, 1024], [1024, 1024], [1, 1024], [8, 1024]]", "cuda -keys=cuda,gpu -arch=sm_86 -max_num_threads=1024 -thread_warp_size=32", [-1, 16, 64, 49152, 2147483647, 1024, 8, 32], "llvm -keys=cpu ", 0, []], [[], [["CI", 4], ["SP", 2, 0, 8, [1, 2, 2, 2], 1], ["SP", 2, 5, 1024, [2, 32, 8, 2], 1], ["SP", 2, 10, 1024, [1, 16], 1], ["RE", 2, [0, 5, 1, 6, 2, 7, 10, 11, 3, 8, 12, 4, 9]], ["FSP", 5, 0, 1, 3], ["FSP", 5, 4, 2, 3], ["RE", 5, [0, 4, 1, 5, 2, 6, 3, 7]], ["CA", 2, 5, 5], ["CHR", 1, "shared", [2]], ["CA", 2, 3, 6], ["CHR", 0, "shared", [3]], ["CA", 1, 4, 6], ["FU", 7, [0, 1]], ["AN", 7, 0, 5], ["FU", 7, [1, 2]], ["AN", 7, 1, 4], ["FU", 7, [2, 3]], ["AN", 7, 2, 6], ["FU", 3, [0, 1]], ["SP", 3, 0, 256, [1], 1], ["AN", 3, 1, 2], ["FFSP", 3, 0, [2, 1], 1, 1], ["AN", 3, 1, 6], ["FU", 1, [0, 1]], ["SP", 1, 0, 64, [1], 1], ["AN", 1, 1, 2], ["FFSP", 1, 0, [2, 1], 1, 1], ["AN", 1, 1, 6], ["PR", 4, 0, "auto_unroll_max_step$512"]]]], "r": [[0.000872406, 0.000872404, 0.000872407], 0, 2.76824, 1675067051], "v": "v0.6"}
{"i": [["[\"d320fe41e200472e48316303a3461f84\", [8, 1024], [1024, 1024], [1, 1024], [8, 1024]]", "cuda -keys=cuda,gpu -arch=sm_86 -max_num_threads=1024 -thread_warp_size=32", [-1, 16, 64, 49152, 2147483647, 1024, 8, 32], "llvm -keys=cpu ", 0, []], [[], [["CI", 4], ["SP", 2, 0, 8, [4, 1, 1, 2], 1], ["SP", 2, 5, 1024, [1, 1024, 1, 1], 1], ["SP", 2, 10, 1024, [1, 4], 1], ["RE", 2, [0, 5, 1, 6, 2, 7, 10, 11, 3, 8, 12, 4, 9]], ["FSP", 5, 0, 1, 3], ["FSP", 5, 4, 2, 3], ["RE", 5, [0, 4, 1, 5, 2, 6, 3, 7]], ["CA", 2, 5, 5], ["CHR", 1, "shared", [2]], ["CA", 2, 3, 6], ["CHR", 0, "shared", [3]], ["CA", 1, 4, 6], ["FU", 7, [0, 1]], ["AN", 7, 0, 5], ["FU", 7, [1, 2]], ["AN", 7, 1, 4], ["FU", 7, [2, 3]], ["AN", 7, 2, 6], ["FU", 3, [0, 1]], ["SP", 3, 0, 4, [1], 1], ["AN", 3, 1, 2], ["FFSP", 3, 0, [2, 1], 1, 1], ["AN", 3, 1, 6], ["FU", 1, [0, 1]], ["SP", 1, 0, 8, [1], 1], ["AN", 1, 1, 2], ["FFSP", 1, 0, [2, 1], 1, 1], ["AN", 1, 1, 6], ["PR", 4, 0, "auto_unroll_max_step$1024"]]]], "r": [[0.000338008, 0.000338015, 0.000338006], 0, 1.85338, 1675067052], "v": "v0.6"}
{"i": [["[\"d320fe41e200472e48316303a3461f84\", [8, 1024], [1024, 1024], [1, 1024], [8, 1024]]", "cuda -keys=cuda,gpu -arch=sm_86 -max_num_threads=1024 -thread_warp_size=32", [-1, 16, 64, 49152, 2147483647, 1024, 8, 32], "llvm -keys=cpu ", 0, []], [[], [["CI", 4], ["SP", 2, 0, 8, [1, 1, 1, 4], 1], ["SP", 2, 5, 1024, [2, 4, 1, 8], 1], ["SP", 2, 10, 1024, [16, 4], 1], ["RE", 2, [0, 5, 1, 6, 2, 7, 10, 11, 3, 8, 12, 4, 9]], ["FSP", 5, 0, 1, 3], ["FSP", 5, 4, 2, 3], ["RE", 5, [0, 4, 1, 5, 2, 6, 3, 7]], ["CA", 2, 5, 5], ["CHR", 1, "shared", [2]], ["CA", 2, 3, 6], ["CHR", 0, "shared", [3]], ["CA", 1, 4, 6], ["FU", 7, [0, 1]], ["AN", 7, 0, 5], ["FU", 7, [1, 2]], ["AN", 7, 1, 4], ["FU", 7, [2, 3]], ["AN", 7, 2, 6], ["FU", 3, [0, 1]], ["SP", 3, 0, 128, [1], 1], ["AN", 3, 1, 2], ["FFSP", 3, 0, [2, 1], 1, 1], ["AN", 3, 1, 6], ["FU", 1, [0, 1]], ["SP", 1, 0, 64, [4], 1], ["AN", 1, 1, 2], ["FFSP", 1, 0, [2, 1], 1, 1], ["AN", 1, 1, 6], ["PR", 4, 0, "auto_unroll_max_step$1024"]]]], "r": [[0.000190207, 0.000190206, 0.000190209], 0, 5.27111, 1675067054], "v": "v0.6"}
{"i": [["[\"d320fe41e200472e48316303a3461f84\", [8, 1024], [1024, 1024], [1, 1024], [8, 1024]]", "cuda -keys=cuda,gpu -arch=sm_86 -max_num_threads=1024 -thread_warp_size=32", [-1, 16, 64, 49152, 2147483647, 1024, 8, 32], "llvm -keys=cpu ", 0, []], [[], [["CI", 4], ["SP", 2, 0, 8, [1, 8, 1, 1], 1], ["SP", 2, 5, 1024, [1, 8, 4, 4], 1], ["SP", 2, 10, 1024, [1, 2], 1], ["RE", 2, [0, 5, 1, 6, 2, 7, 10, 11, 3, 8, 12, 4, 9]], ["FSP", 5, 0, 1, 3], ["FSP", 5, 4, 2, 3], ["RE", 5, [0, 4, 1, 5, 2, 6, 3, 7]], ["CA", 2, 5, 5], ["CHR", 1, "shared", [2]], ["CA", 2, 3, 6], ["CHR", 0, "shared", [3]], ["CA", 1, 4, 6], ["FU", 7, [0, 1]], ["AN", 7, 0, 5], ["FU", 7, [1, 2]], ["AN", 7, 1, 4], ["FU", 7, [2, 3]], ["AN", 7, 2, 6], ["FU", 3, [0, 1]], ["SP", 3, 0, 32, [1], 1], ["AN", 3, 1, 2], ["FFSP", 3, 0, [2, 1], 1, 1], ["AN", 3, 1, 6], ["FU", 1, [0, 1]], ["SP", 1, 0, 4, [4], 1], ["AN", 1, 1, 2], ["FFSP", 1, 0, [2, 1], 1, 1], ["AN", 1, 1, 6], ["PR", 4, 0, "auto_unroll_max_step$0"]]]], "r": [[0.000145597, 0.000145599, 0.000145597], 0, 1.86496, 1675067055], "v": "v0.6"}
{"i": [["[\"d320fe41e200472e48316303a3461f84\", [8, 1024], [1024, 1024], [1, 1024], [8, 1024]]", "cuda -keys=cuda,gpu -arch=sm_86 -max_num_threads=1024 -thread_warp_size=32", [-1, 16, 64, 49152, 2147483647, 1024, 8, 32], "llvm -keys=cpu ", 0, []], [[], [["CI", 4], ["SP", 2, 0, 8, [1, 4, 1, 1], 1], ["SP", 2, 5, 1024, [1, 32, 8, 1], 1], ["SP", 2, 10, 1024, [1, 1], 1], ["RE", 2, [0, 5, 1, 6, 2, 7, 10, 11, 3, 8, 12, 4, 9]], ["FSP", 5, 0, 1, 3], ["FSP", 5, 4, 2, 3], ["RE", 5, [0, 4, 1, 5, 2, 6, 3, 7]], ["CA", 2, 5, 5], ["CHR", 1, "shared", [2]], ["CA", 2, 3, 6], ["CHR", 0, "shared", [3]], ["CA", 1, 4, 6], ["FU", 7, [0, 1]], ["AN", 7, 0, 5], ["FU", 7, [1, 2]], ["AN", 7, 1, 4], ["FU", 7, [2, 3]], ["AN", 7, 2, 6], ["FU", 3, [0, 1]], ["SP", 3, 0, 8, [1], 1], ["AN", 3, 1, 2], ["FFSP", 3, 0, [2, 1], 1, 1], ["AN", 3, 1, 6], ["FU", 1, [0, 1]], ["SP", 1, 0, 1, [1], 1], ["AN", 1, 1, 2], ["FFSP", 1, 0, [2, 1], 1, 1], ["AN", 1, 1, 6], ["PR", 4, 0, "auto_unroll_max_step$0"]]]], "r": [[0.000252347, 0.000252352, 0.000252349], 0, 1.87188, 1675067057], "v": "v0.6"}
{"i": [["[\"d320fe41e200472e48316303a3461f84\", [8, 1024], [1024, 1024], [1, 1024], [8, 1024]]", "cuda -keys=cuda,gpu -arch=sm_86 -max_num_threads=1024 -thread_warp_size=32", [-1, 16, 64, 49152, 2147483647, 1024, 8, 32], "llvm -keys=cpu ", 0, []], [[], [["CI", 4], ["SP", 2, 0, 8, [8, 1, 1, 1], 1], ["SP", 2, 5, 1024, [1, 128, 1, 2], 1], ["SP", 2, 10, 1024, [1, 16], 1], ["RE", 2, [0, 5, 1, 6, 2, 7, 10, 11, 3, 8, 12, 4, 9]], ["FSP", 5, 0, 1, 3], ["FSP", 5, 4, 2, 3], ["RE", 5, [0, 4, 1, 5, 2, 6, 3, 7]], ["CA", 2, 5, 5], ["CHR", 1, "shared", [2]], ["CA", 2, 3, 6], ["CHR", 0, "shared", [3]], ["CA", 1, 4, 6], ["FU", 7, [0, 1]], ["AN", 7, 0, 5], ["FU", 7, [1, 2]], ["AN", 7, 1, 4], ["FU", 7, [2, 3]], ["AN", 7, 2, 6], ["FU", 3, [0, 1]], ["SP", 3, 0, 32, [1], 1], ["AN", 3, 1, 2], ["FFSP", 3, 0, [2, 1], 1, 1], ["AN", 3, 1, 6], ["FU", 1, [0, 1]], ["SP", 1, 0, 16, [1], 1], ["AN", 1, 1, 2], ["FFSP", 1, 0, [2, 1], 1, 1], ["AN", 1, 1, 6], ["PR", 4, 0, "auto_unroll_max_step$1024"]]]], "r": [[7.16739e-05, 7.16733e-05, 7.16745e-05], 0, 2.16797, 1675067058], "v": "v0.6"}
{"i": [["[\"d320fe41e200472e48316303a3461f84\", [8, 1024], [1024, 1024], [1, 1024], [8, 1024]]", "cuda -keys=cuda,gpu -arch=sm_86 -max_num_threads=1024 -thread_warp_size=32", [-1, 16, 64, 49152, 2147483647, 1024, 8, 32], "llvm -keys=cpu ", 0, []], [[], [["CI", 4], ["SP", 2, 0, 8, [1, 1, 2, 4], 1], ["SP", 2, 5, 1024, [4, 256, 1, 1], 1], ["SP", 2, 10, 1024, [16, 1], 1], ["RE", 2, [0, 5, 1, 6, 2, 7, 10, 11, 3, 8, 12, 4, 9]], ["FSP", 5, 0, 1, 3], ["FSP", 5, 4, 2, 3], ["RE", 5, [0, 4, 1, 5, 2, 6, 3, 7]], ["CA", 2, 5, 5], ["CHR", 1, "shared", [2]], ["CA", 2, 3, 6], ["CHR", 0, "shared", [3]], ["CA", 1, 4, 6], ["FU", 7, [0, 1]], ["AN", 7, 0, 5], ["FU", 7, [1, 2]], ["AN", 7, 1, 4], ["FU", 7, [2, 3]], ["AN", 7, 2, 6], ["FU", 3, [0, 1]], ["SP", 3, 0, 128, [1], 1], ["AN", 3, 1, 2], ["FFSP", 3, 0, [2, 1], 1, 1], ["AN", 3, 1, 6], ["FU", 1, [0, 1]], ["SP", 1, 0, 64, [1], 1], ["AN", 1, 1, 2], ["FFSP", 1, 0, [2, 1], 1, 1], ["AN", 1, 1, 6], ["PR", 4, 0, "auto_unroll_max_step$1024"]]]], "r": [[0.000160893, 0.00016089, 0.000160896], 0, 2.48665, 1675067060], "v": "v0.6"}
{"i": [["[\"d320fe41e200472e48316303a3461f84\", [8, 1024], [1024, 1024], [1, 1024], [8, 1024]]", "cuda -keys=cuda,gpu -arch=sm_86 -max_num_threads=1024 -thread_warp_size=32", [-1, 16, 64, 49152, 2147483647, 1024, 8, 32], "llvm -keys=cpu ", 0, []], [[], [["CI", 4], ["SP", 2, 0, 8, [4, 1, 1, 2], 1], ["SP", 2, 5, 1024, [2, 64, 1, 1], 1], ["SP", 2, 10, 1024, [8, 2], 1], ["RE", 2, [0, 5, 1, 6, 2, 7, 10, 11, 3, 8, 12, 4, 9]], ["FSP", 5, 0, 1, 3], ["FSP", 5, 4, 2, 3], ["RE", 5, [0, 4, 1, 5, 2, 6, 3, 7]], ["CA", 2, 5, 5], ["CHR", 1, "shared", [2]], ["CA", 2, 3, 6], ["CHR", 0, "shared", [3]], ["CA", 1, 4, 6], ["FU", 7, [0, 1]], ["AN", 7, 0, 5], ["FU", 7, [1, 2]], ["AN", 7, 1, 4], ["FU", 7, [2, 3]], ["AN", 7, 2, 6], ["FU", 3, [0, 1]], ["SP", 3, 0, 16, [4], 1], ["AN", 3, 1, 2], ["FFSP", 3, 0, [2, 1], 1, 1], ["AN", 3, 1, 6], ["FU", 1, [0, 1]], ["SP", 1, 0, 32, [8], 1], ["AN", 1, 1, 2], ["FFSP", 1, 0, [2, 1], 1, 1], ["AN", 1, 1, 6], ["PR", 4, 0, "auto_unroll_max_step$64"]]]], "r": [[3.74491e-05, 3.74471e-05, 3.74466e-05], 0, 1.94537, 1675067061], "v": "v0.6"}
{"i": [["[\"d320fe41e200472e48316303a3461f84\", [8, 1024], [1024, 1024], [1, 1024], [8, 1024]]", "cuda -keys=cuda,gpu -arch=sm_86 -max_num_threads=1024 -thread_warp_size=32", [-1, 16, 64, 49152, 2147483647, 1024, 8, 32], "llvm -keys=cpu ", 0, []], [[], [["CI", 4], ["SP", 2, 0, 8, [1, 4, 2, 1], 1], ["SP", 2, 5, 1024, [2, 32, 8, 1], 1], ["SP", 2, 10, 1024, [2, 8], 1], ["RE", 2, [0, 5, 1, 6, 2, 7, 10, 11, 3, 8, 12, 4, 9]], ["FSP", 5, 0, 1, 3], ["FSP", 5, 4, 2, 3], ["RE", 5, [0, 4, 1, 5, 2, 6, 3, 7]], ["CA", 2, 5, 5], ["CHR", 1, "shared", [2]], ["CA", 2, 3, 6], ["CHR", 0, "shared", [3]], ["CA", 1, 4, 6], ["FU", 7, [0, 1]], ["AN", 7, 0, 5], ["FU", 7, [1, 2]], ["AN", 7, 1, 4], ["FU", 7, [2, 3]], ["AN", 7, 2, 6], ["FU", 3, [0, 1]], ["SP", 3, 0, 128, [1], 1], ["AN", 3, 1, 2], ["FFSP", 3, 0, [2, 1], 1, 1], ["AN", 3, 1, 6], ["FU", 1, [0, 1]], ["SP", 1, 0, 32, [32], 1], ["AN", 1, 1, 2], ["FFSP", 1, 0, [2, 1], 1, 1], ["AN", 1, 1, 6], ["PR", 4, 0, "auto_unroll_max_step$0"]]]], "r": [[0.000386897, 0.000386888, 0.000386889], 0, 2.19893, 1675067062], "v": "v0.6"}
{"i": [["[\"d320fe41e200472e48316303a3461f84\", [8, 1024], [1024, 1024], [1, 1024], [8, 1024]]", "cuda -keys=cuda,gpu -arch=sm_86 -max_num_threads=1024 -thread_warp_size=32", [-1, 16, 64, 49152, 2147483647, 1024, 8, 32], "llvm -keys=cpu ", 0, []], [[], [["CI", 4], ["SP", 2, 0, 8, [1, 2, 4, 1], 1], ["SP", 2, 5, 1024, [1, 512, 1, 2], 1], ["SP", 2, 10, 1024, [4, 4], 1], ["RE", 2, [0, 5, 1, 6, 2, 7, 10, 11, 3, 8, 12, 4, 9]], ["FSP", 5, 0, 1, 3], ["FSP", 5, 4, 2, 3], ["RE", 5, [0, 4, 1, 5, 2, 6, 3, 7]], ["CA", 2, 5, 5], ["CHR", 1, "shared", [2]], ["CA", 2, 3, 6], ["CHR", 0, "shared", [3]], ["CA", 1, 4, 6], ["FU", 7, [0, 1]], ["AN", 7, 0, 5], ["FU", 7, [1, 2]], ["AN", 7, 1, 4], ["FU", 7, [2, 3]], ["AN", 7, 2, 6], ["FU", 3, [0, 1]], ["SP", 3, 0, 128, [1], 1], ["AN", 3, 1, 2], ["FFSP", 3, 0, [2, 1], 1, 1], ["AN", 3, 1, 6], ["FU", 1, [0, 1]], ["SP", 1, 0, 128, [1], 1], ["AN", 1, 1, 2], ["FFSP", 1, 0, [2, 1], 1, 1], ["AN", 1, 1, 6], ["PR", 4, 0, "auto_unroll_max_step$16"]]]], "r": [[0.000281689, 0.000281711, 0.000281697], 0, 1.91302, 1675067064], "v": "v0.6"}
{"i": [["[\"d320fe41e200472e48316303a3461f84\", [8, 1024], [1024, 1024], [1, 1024], [8, 1024]]", "cuda -keys=cuda,gpu -arch=sm_86 -max_num_threads=1024 -thread_warp_size=32", [-1, 16, 64, 49152, 2147483647, 1024, 8, 32], "llvm -keys=cpu ", 0, []], [[], [["CI", 4], ["SP", 2, 0, 8, [1, 1, 2, 4], 1], ["SP", 2, 5, 1024, [4, 64, 4, 1], 1], ["SP", 2, 10, 1024, [2, 4], 1], ["RE", 2, [0, 5, 1, 6, 2, 7, 10, 11, 3, 8, 12, 4, 9]], ["FSP", 5, 0, 1, 3], ["FSP", 5, 4, 2, 3], ["RE", 5, [0, 4, 1, 5, 2, 6, 3, 7]], ["CA", 2, 5, 5], ["CHR", 1, "shared", [2]], ["CA", 2, 3, 6], ["CHR", 0, "shared", [3]], ["CA", 1, 4, 6], ["FU", 7, [0, 1]], ["AN", 7, 0, 5], ["FU", 7, [1, 2]], ["AN", 7, 1, 4], ["FU", 7, [2, 3]], ["AN", 7, 2, 6], ["FU", 3, [0, 1]], ["SP", 3, 0, 32, [1], 1], ["AN", 3, 1, 2], ["FFSP", 3, 0, [2, 1], 1, 1], ["AN", 3, 1, 6], ["FU", 1, [0, 1]], ["SP", 1, 0, 16, [8], 1], ["AN", 1, 1, 2], ["FFSP", 1, 0, [2, 1], 1, 1], ["AN", 1, 1, 6], ["PR", 4, 0, "auto_unroll_max_step$512"]]]], "r": [[0.000368786, 0.000368784, 0.000368789], 0, 3.03069, 1675067065], "v": "v0.6"}
{"i": [["[\"d320fe41e200472e48316303a3461f84\", [8, 1024], [1024, 1024], [1, 1024], [8, 1024]]", "cuda -keys=cuda,gpu -arch=sm_86 -max_num_threads=1024 -thread_warp_size=32", [-1, 16, 64, 49152, 2147483647, 1024, 8, 32], "llvm -keys=cpu ", 0, []], [[], [["CI", 4], ["SP", 2, 0, 8, [1, 2, 2, 2], 1], ["SP", 2, 5, 1024, [2, 8, 4, 1], 1], ["SP", 2, 10, 1024, [2, 2], 1], ["RE", 2, [0, 5, 1, 6, 2, 7, 10, 11, 3, 8, 12, 4, 9]], ["FSP", 5, 0, 1, 3], ["FSP", 5, 4, 2, 3], ["RE", 5, [0, 4, 1, 5, 2, 6, 3, 7]], ["CA", 2, 5, 5], ["CHR", 1, "shared", [2]], ["CA", 2, 3, 6], ["CHR", 0, "shared", [3]], ["CA", 1, 4, 6], ["FU", 7, [0, 1]], ["AN", 7, 0, 5], ["FU", 7, [1, 2]], ["AN", 7, 1, 4], ["FU", 7, [2, 3]], ["AN", 7, 2, 6], ["FU", 3, [0, 1]], ["SP", 3, 0, 16, [1], 1], ["AN", 3, 1, 2], ["FFSP", 3, 0, [2, 1], 1, 1], ["AN", 3, 1, 6], ["FU", 1, [0, 1]], ["SP", 1, 0, 8, [1], 1], ["AN", 1, 1, 2], ["FFSP", 1, 0, [2, 1], 1, 1], ["AN", 1, 1, 6], ["PR", 4, 0, "auto_unroll_max_step$0"]]]], "r": [[8.75301e-05, 8.75301e-05, 8.75317e-05], 0, 1.94635, 1675067067], "v": "v0.6"}
{"i": [["[\"d320fe41e200472e48316303a3461f84\", [8, 1024], [1024, 1024], [1, 1024], [8, 1024]]", "cuda -keys=cuda,gpu -arch=sm_86 -max_num_threads=1024 -thread_warp_size=32", [-1, 16, 64, 49152, 2147483647, 1024, 8, 32], "llvm -keys=cpu ", 0, []], [[], [["CI", 4], ["SP", 2, 0, 8, [1, 8, 1, 1], 1], ["SP", 2, 5, 1024, [2, 4, 2, 2], 1], ["SP", 2, 10, 1024, [1, 2], 1], ["RE", 2, [0, 5, 1, 6, 2, 7, 10, 11, 3, 8, 12, 4, 9]], ["FSP", 5, 0, 1, 3], ["FSP", 5, 4, 2, 3], ["RE", 5, [0, 4, 1, 5, 2, 6, 3, 7]], ["CA", 2, 5, 5], ["CHR", 1, "shared", [2]], ["CA", 2, 3, 6], ["CHR", 0, "shared", [3]], ["CA", 1, 4, 6], ["FU", 7, [0, 1]], ["AN", 7, 0, 5], ["FU", 7, [1, 2]], ["AN", 7, 1, 4], ["FU", 7, [2, 3]], ["AN", 7, 2, 6], ["FU", 3, [0, 1]], ["SP", 3, 0, 8, [2], 1], ["AN", 3, 1, 2], ["FFSP", 3, 0, [2, 1], 1, 1], ["AN", 3, 1, 6], ["FU", 1, [0, 1]], ["SP", 1, 0, 2, [1], 1], ["AN", 1, 1, 2], ["FFSP", 1, 0, [2, 1], 1, 1], ["AN", 1, 1, 6], ["PR", 4, 0, "auto_unroll_max_step$16"]]]], "r": [[5.57785e-05, 5.57798e-05, 5.57765e-05], 0, 1.95, 1675067068], "v": "v0.6"}
{"i": [["[\"d320fe41e200472e48316303a3461f84\", [8, 1024], [1024, 1024], [1, 1024], [8, 1024]]", "cuda -keys=cuda,gpu -arch=sm_86 -max_num_threads=1024 -thread_warp_size=32", [-1, 16, 64, 49152, 2147483647, 1024, 8, 32], "llvm -keys=cpu ", 0, []], [[], [["CI", 4], ["SP", 2, 0, 8, [1, 2, 2, 2], 1], ["SP", 2, 5, 1024, [1, 16, 1, 64], 1], ["SP", 2, 10, 1024, [1, 4], 1], ["RE", 2, [0, 5, 1, 6, 2, 7, 10, 11, 3, 8, 12, 4, 9]], ["FSP", 5, 0, 1, 3], ["FSP", 5, 4, 2, 3], ["RE", 5, [0, 4, 1, 5, 2, 6, 3, 7]], ["CA", 2, 5, 5], ["CHR", 1, "shared", [2]], ["CA", 2, 3, 6], ["CHR", 0, "shared", [3]], ["CA", 1, 4, 6], ["FU", 7, [0, 1]], ["AN", 7, 0, 5], ["FU", 7, [1, 2]], ["AN", 7, 1, 4], ["FU", 7, [2, 3]], ["AN", 7, 2, 6], ["FU", 3, [0, 1]], ["SP", 3, 0, 256, [1], 1], ["AN", 3, 1, 2], ["FFSP", 3, 0, [2, 1], 1, 1], ["AN", 3, 1, 6], ["FU", 1, [0, 1]], ["SP", 1, 0, 16, [8], 1], ["AN", 1, 1, 2], ["FFSP", 1, 0, [2, 1], 1, 1], ["AN", 1, 1, 6], ["PR", 4, 0, "auto_unroll_max_step$16"]]]], "r": [[0.00315559, 0.00315558, 0.0031556], 0, 1.95538, 1675067069], "v": "v0.6"}
{"i": [["[\"d320fe41e200472e48316303a3461f84\", [8, 1024], [1024, 1024], [1, 1024], [8, 1024]]", "cuda -keys=cuda,gpu -arch=sm_86 -max_num_threads=1024 -thread_warp_size=32", [-1, 16, 64, 49152, 2147483647, 1024, 8, 32], "llvm -keys=cpu ", 0, []], [[], [["CI", 4], ["SP", 2, 0, 8, [1, 4, 1, 1], 1], ["SP", 2, 5, 1024, [1, 64, 4, 4], 1], ["SP", 2, 10, 1024, [16, 1], 1], ["RE", 2, [0, 5, 1, 6, 2, 7, 10, 11, 3, 8, 12, 4, 9]], ["FSP", 5, 0, 1, 3], ["FSP", 5, 4, 2, 3], ["RE", 5, [0, 4, 1, 5, 2, 6, 3, 7]], ["CA", 2, 5, 5], ["CHR", 1, "shared", [2]], ["CA", 2, 3, 6], ["CHR", 0, "shared", [3]], ["CA", 1, 4, 6], ["FU", 7, [0, 1]], ["AN", 7, 0, 5], ["FU", 7, [1, 2]], ["AN", 7, 1, 4], ["FU", 7, [2, 3]], ["AN", 7, 2, 6], ["FU", 3, [0, 1]], ["SP", 3, 0, 256, [8], 1], ["AN", 3, 1, 2], ["FFSP", 3, 0, [2, 1], 1, 1], ["AN", 3, 1, 6], ["FU", 1, [0, 1]], ["SP", 1, 0, 16, [8], 1], ["AN", 1, 1, 2], ["FFSP", 1, 0, [2, 1], 1, 1], ["AN", 1, 1, 6], ["PR", 4, 0, "auto_unroll_max_step$64"]]]], "r": [[0.00255732, 0.00255732, 0.00255731], 0, 1.39099, 1675067070], "v": "v0.6"}
{"i": [["[\"d320fe41e200472e48316303a3461f84\", [8, 1024], [1024, 1024], [1, 1024], [8, 1024]]", "cuda -keys=cuda,gpu -arch=sm_86 -max_num_threads=1024 -thread_warp_size=32", [-1, 16, 64, 49152, 2147483647, 1024, 8, 32], "llvm -keys=cpu ", 0, []], [[], [["CI", 4], ["SP", 2, 0, 8, [1, 4, 1, 1], 1], ["SP", 2, 5, 1024, [2, 8, 2, 1], 1], ["SP", 2, 10, 1024, [2, 1], 1], ["RE", 2, [0, 5, 1, 6, 2, 7, 10, 11, 3, 8, 12, 4, 9]], ["FSP", 5, 0, 1, 3], ["FSP", 5, 4, 2, 3], ["RE", 5, [0, 4, 1, 5, 2, 6, 3, 7]], ["CA", 2, 5, 5], ["CHR", 1, "shared", [2]], ["CA", 2, 3, 6], ["CHR", 0, "shared", [3]], ["CA", 1, 4, 6], ["FU", 7, [0, 1]], ["AN", 7, 0, 5], ["FU", 7, [1, 2]], ["AN", 7, 1, 4], ["FU", 7, [2, 3]], ["AN", 7, 2, 6], ["FU", 3, [0, 1]], ["SP", 3, 0, 256, [1], 1], ["AN", 3, 1, 2], ["FFSP", 3, 0, [2, 1], 1, 1], ["AN", 3, 1, 6], ["FU", 1, [0, 1]], ["SP", 1, 0, 128, [1], 1], ["AN", 1, 1, 2], ["FFSP", 1, 0, [2, 1], 1, 1], ["AN", 1, 1, 6], ["PR", 4, 0, "auto_unroll_max_step$16"]]]], "r": [[5.21865e-05, 5.21859e-05, 5.21889e-05], 0, 1.91105, 1675067072], "v": "v0.6"}
{"i": [["[\"d320fe41e200472e48316303a3461f84\", [8, 1024], [1024, 1024], [1, 1024], [8, 1024]]", "cuda -keys=cuda,gpu -arch=sm_86 -max_num_threads=1024 -thread_warp_size=32", [-1, 16, 64, 49152, 2147483647, 1024, 8, 32], "llvm -keys=cpu ", 0, []], [[], [["CI", 4], ["SP", 2, 0, 8, [2, 1, 1, 1], 1], ["SP", 2, 5, 1024, [1, 16, 2, 1], 1], ["SP", 2, 10, 1024, [1, 1], 1], ["RE", 2, [0, 5, 1, 6, 2, 7, 10, 11, 3, 8, 12, 4, 9]], ["FSP", 5, 0, 1, 3], ["FSP", 5, 4, 2, 3], ["RE", 5, [0, 4, 1, 5, 2, 6, 3, 7]], ["CA", 2, 5, 5], ["CHR", 1, "shared", [2]], ["CA", 2, 3, 6], ["CHR", 0, "shared", [3]], ["CA", 1, 4, 6], ["FU", 7, [0, 1]], ["AN", 7, 0, 5], ["FU", 7, [1, 2]], ["AN", 7, 1, 4], ["FU", 7, [2, 3]], ["AN", 7, 2, 6], ["FU", 3, [0, 1]], ["SP", 3, 0, 2, [2], 1], ["AN", 3, 1, 2], ["FFSP", 3, 0, [2, 1], 1, 1], ["AN", 3, 1, 6], ["FU", 1, [0, 1]], ["SP", 1, 0, 1, [1], 1], ["AN", 1, 1, 2], ["FFSP", 1, 0, [2, 1], 1, 1], ["AN", 1, 1, 6], ["PR", 4, 0, "auto_unroll_max_step$0"]]]], "r": [[0.000101354, 0.000101353, 0.000101351], 0, 1.91601, 1675067073], "v": "v0.6"}
{"i": [["[\"d320fe41e200472e48316303a3461f84\", [8, 1024], [1024, 1024], [1, 1024], [8, 1024]]", "cuda -keys=cuda,gpu -arch=sm_86 -max_num_threads=1024 -thread_warp_size=32", [-1, 16, 64, 49152, 2147483647, 1024, 8, 32], "llvm -keys=cpu ", 0, []], [[], [["CI", 4], ["SP", 2, 0, 8, [2, 4, 1, 1], 1], ["SP", 2, 5, 1024, [1, 16, 4, 1], 1], ["SP", 2, 10, 1024, [4, 8], 1], ["RE", 2, [0, 5, 1, 6, 2, 7, 10, 11, 3, 8, 12, 4, 9]], ["FSP", 5, 0, 1, 3], ["FSP", 5, 4, 2, 3], ["RE", 5, [0, 4, 1, 5, 2, 6, 3, 7]], ["CA", 2, 5, 5], ["CHR", 1, "shared", [2]], ["CA", 2, 3, 6], ["CHR", 0, "shared", [3]], ["CA", 1, 4, 6], ["FU", 7, [0, 1]], ["AN", 7, 0, 5], ["FU", 7, [1, 2]], ["AN", 7, 1, 4], ["FU", 7, [2, 3]], ["AN", 7, 2, 6], ["FU", 3, [0, 1]], ["SP", 3, 0, 128, [4], 1], ["AN", 3, 1, 2], ["FFSP", 3, 0, [2, 1], 1, 1], ["AN", 3, 1, 6], ["FU", 1, [0, 1]], ["SP", 1, 0, 32, [8], 1], ["AN", 1, 1, 2], ["FFSP", 1, 0, [2, 1], 1, 1], ["AN", 1, 1, 6], ["PR", 4, 0, "auto_unroll_max_step$512"]]]], "r": [[5.22653e-05, 5.22705e-05, 5.22684e-05], 0, 2.148, 1675067075], "v": "v0.6"}
{"i": [["[\"d320fe41e200472e48316303a3461f84\", [8, 1024], [1024, 1024], [1, 1024], [8, 1024]]", "cuda -keys=cuda,gpu -arch=sm_86 -max_num_threads=1024 -thread_warp_size=32", [-1, 16, 64, 49152, 2147483647, 1024, 8, 32], "llvm -keys=cpu ", 0, []], [[], [["CI", 4], ["SP", 2, 0, 8, [1, 2, 2, 2], 1], ["SP", 2, 5, 1024, [4, 4, 4, 16], 1], ["SP", 2, 10, 1024, [1, 4], 1], ["RE", 2, [0, 5, 1, 6, 2, 7, 10, 11, 3, 8, 12, 4, 9]], ["FSP", 5, 0, 1, 3], ["FSP", 5, 4, 2, 3], ["RE", 5, [0, 4, 1, 5, 2, 6, 3, 7]], ["CA", 2, 5, 5], ["CHR", 1, "shared", [2]], ["CA", 2, 3, 6], ["CHR", 0, "shared", [3]], ["CA", 1, 4, 6], ["FU", 7, [0, 1]], ["AN", 7, 0, 5], ["FU", 7, [1, 2]], ["AN", 7, 1, 4], ["FU", 7, [2, 3]], ["AN", 7, 2, 6], ["FU", 3, [0, 1]], ["SP", 3, 0, 256, [4], 1], ["AN", 3, 1, 2], ["FFSP", 3, 0, [2, 1], 1, 1], ["AN", 3, 1, 6], ["FU", 1, [0, 1]], ["SP", 1, 0, 16, [1], 1], ["AN", 1, 1, 2], ["FFSP", 1, 0, [2, 1], 1, 1], ["AN", 1, 1, 6], ["PR", 4, 0, "auto_unroll_max_step$16"]]]], "r": [[0.0098718, 0.00987134, 0.00987195], 0, 2.48025, 1675067076], "v": "v0.6"}
{"i": [["[\"d320fe41e200472e48316303a3461f84\", [8, 1024], [1024, 1024], [1, 1024], [8, 1024]]", "cuda -keys=cuda,gpu -arch=sm_86 -max_num_threads=1024 -thread_warp_size=32", [-1, 16, 64, 49152, 2147483647, 1024, 8, 32], "llvm -keys=cpu ", 0, []], [[], [["CI", 4], ["SP", 2, 0, 8, [4, 1, 1, 2], 1], ["SP", 2, 5, 1024, [1, 64, 1, 1], 1], ["SP", 2, 10, 1024, [16, 1], 1], ["RE", 2, [0, 5, 1, 6, 2, 7, 10, 11, 3, 8, 12, 4, 9]], ["FSP", 5, 0, 1, 3], ["FSP", 5, 4, 2, 3], ["RE", 5, [0, 4, 1, 5, 2, 6, 3, 7]], ["CA", 2, 5, 5], ["CHR", 1, "shared", [2]], ["CA", 2, 3, 6], ["CHR", 0, "shared", [3]], ["CA", 1, 4, 6], ["FU", 7, [0, 1]], ["AN", 7, 0, 5], ["FU", 7, [1, 2]], ["AN", 7, 1, 4], ["FU", 7, [2, 3]], ["AN", 7, 2, 6], ["FU", 3, [0, 1]], ["SP", 3, 0, 2, [1], 1], ["AN", 3, 1, 2], ["FFSP", 3, 0, [2, 1], 1, 1], ["AN", 3, 1, 6], ["FU", 1, [0, 1]], ["SP", 1, 0, 4, [1], 1], ["AN", 1, 1, 2], ["FFSP", 1, 0, [2, 1], 1, 1], ["AN", 1, 1, 6], ["PR", 4, 0, "auto_unroll_max_step$64"]]]], "r": [[2.88002e-05, 2.88e-05, 2.88038e-05], 0, 1.94273, 1675067077], "v": "v0.6"}
{"i": [["[\"d320fe41e200472e48316303a3461f84\", [8, 1024], [1024, 1024], [1, 1024], [8, 1024]]", "cuda -keys=cuda,gpu -arch=sm_86 -max_num_threads=1024 -thread_warp_size=32", [-1, 16, 64, 49152, 2147483647, 1024, 8, 32], "llvm -keys=cpu ", 0, []], [[], [["CI", 4], ["SP", 2, 0, 8, [4, 1, 2, 1], 1], ["SP", 2, 5, 1024, [1, 128, 2, 2], 1], ["SP", 2, 10, 1024, [16, 2], 1], ["RE", 2, [0, 5, 1, 6, 2, 7, 10, 11, 3, 8, 12, 4, 9]], ["FSP", 5, 0, 1, 3], ["FSP", 5, 4, 2, 3], ["RE", 5, [0, 4, 1, 5, 2, 6, 3, 7]], ["CA", 2, 5, 5], ["CHR", 1, "shared", [2]], ["CA", 2, 3, 6], ["CHR", 0, "shared", [3]], ["CA", 1, 4, 6], ["FU", 7, [0, 1]], ["AN", 7, 0, 5], ["FU", 7, [1, 2]], ["AN", 7, 1, 4], ["FU", 7, [2, 3]], ["AN", 7, 2, 6], ["FU", 3, [0, 1]], ["SP", 3, 0, 128, [1], 1], ["AN", 3, 1, 2], ["FFSP", 3, 0, [2, 1], 1, 1], ["AN", 3, 1, 6], ["FU", 1, [0, 1]], ["SP", 1, 0, 32, [1], 1], ["AN", 1, 1, 2], ["FFSP", 1, 0, [2, 1], 1, 1], ["AN", 1, 1, 6], ["PR", 4, 0, "auto_unroll_max_step$512"]]]], "r": [[0.000139896, 0.000139896, 0.000139895], 0, 2.29443, 1675067078], "v": "v0.6"}
{"i": [["[\"d320fe41e200472e48316303a3461f84\", [8, 1024], [1024, 1024], [1, 1024], [8, 1024]]", "cuda -keys=cuda,gpu -arch=sm_86 -max_num_threads=1024 -thread_warp_size=32", [-1, 16, 64, 49152, 2147483647, 1024, 8, 32], "llvm -keys=cpu ", 0, []], [[], [["CI", 4], ["SP", 2, 0, 8, [1, 4, 1, 2], 1], ["SP", 2, 5, 1024, [2, 2, 128, 1], 1], ["SP", 2, 10, 1024, [2, 8], 1], ["RE", 2, [0, 5, 1, 6, 2, 7, 10, 11, 3, 8, 12, 4, 9]], ["FSP", 5, 0, 1, 3], ["FSP", 5, 4, 2, 3], ["RE", 5, [0, 4, 1, 5, 2, 6, 3, 7]], ["CA", 2, 5, 5], ["CHR", 1, "shared", [2]], ["CA", 2, 3, 6], ["CHR", 0, "shared", [3]], ["CA", 1, 4, 6], ["FU", 7, [0, 1]], ["AN", 7, 0, 5], ["FU", 7, [1, 2]], ["AN", 7, 1, 4], ["FU", 7, [2, 3]], ["AN", 7, 2, 6], ["FU", 3, [0, 1]], ["SP", 3, 0, 128, [8], 1], ["AN", 3, 1, 2], ["FFSP", 3, 0, [2, 1], 1, 1], ["AN", 3, 1, 6], ["FU", 1, [0, 1]], ["SP", 1, 0, 32, [8], 1], ["AN", 1, 1, 2], ["FFSP", 1, 0, [2, 1], 1, 1], ["AN", 1, 1, 6], ["PR", 4, 0, "auto_unroll_max_step$0"]]]], "r": [[0.00258503, 0.00258489, 0.00258525], 0, 1.56035, 1675067079], "v": "v0.6"}
{"i": [["[\"d320fe41e200472e48316303a3461f84\", [8, 1024], [1024, 1024], [1, 1024], [8, 1024]]", "cuda -keys=cuda,gpu -arch=sm_86 -max_num_threads=1024 -thread_warp_size=32", [-1, 16, 64, 49152, 2147483647, 1024, 8, 32], "llvm -keys=cpu ", 0, []], [[], [["CI", 4], ["SP", 2, 0, 8, [4, 1, 1, 1], 1], ["SP", 2, 5, 1024, [1, 64, 4, 2], 1], ["SP", 2, 10, 1024, [4, 2], 1], ["RE", 2, [0, 5, 1, 6, 2, 7, 10, 11, 3, 8, 12, 4, 9]], ["FSP", 5, 0, 1, 3], ["FSP", 5, 4, 2, 3], ["RE", 5, [0, 4, 1, 5, 2, 6, 3, 7]], ["CA", 2, 5, 5], ["CHR", 1, "shared", [2]], ["CA", 2, 3, 6], ["CHR", 0, "shared", [3]], ["CA", 1, 4, 6], ["FU", 7, [0, 1]], ["AN", 7, 0, 5], ["FU", 7, [1, 2]], ["AN", 7, 1, 4], ["FU", 7, [2, 3]], ["AN", 7, 2, 6], ["FU", 3, [0, 1]], ["SP", 3, 0, 32, [8], 1], ["AN", 3, 1, 2], ["FFSP", 3, 0, [2, 1], 1, 1], ["AN", 3, 1, 6], ["FU", 1, [0, 1]], ["SP", 1, 0, 8, [1], 1], ["AN", 1, 1, 2], ["FFSP", 1, 0, [2, 1], 1, 1], ["AN", 1, 1, 6], ["PR", 4, 0, "auto_unroll_max_step$64"]]]], "r": [[0.000177451, 0.000177453, 0.000177454], 0, 2.05839, 1675067081], "v": "v0.6"}
{"i": [["[\"d320fe41e200472e48316303a3461f84\", [8, 1024], [1024, 1024], [1, 1024], [8, 1024]]", "cuda -keys=cuda,gpu -arch=sm_86 -max_num_threads=1024 -thread_warp_size=32", [-1, 16, 64, 49152, 2147483647, 1024, 8, 32], "llvm -keys=cpu ", 0, []], [[], [["CI", 4], ["SP", 2, 0, 8, [2, 1, 4, 1], 1], ["SP", 2, 5, 1024, [2, 64, 2, 1], 1], ["SP", 2, 10, 1024, [1, 1], 1], ["RE", 2, [0, 5, 1, 6, 2, 7, 10, 11, 3, 8, 12, 4, 9]], ["FSP", 5, 0, 1, 3], ["FSP", 5, 4, 2, 3], ["RE", 5, [0, 4, 1, 5, 2, 6, 3, 7]], ["CA", 2, 5, 5], ["CHR", 1, "shared", [2]], ["CA", 2, 3, 6], ["CHR", 0, "shared", [3]], ["CA", 1, 4, 6], ["FU", 7, [0, 1]], ["AN", 7, 0, 5], ["FU", 7, [1, 2]], ["AN", 7, 1, 4], ["FU", 7, [2, 3]], ["AN", 7, 2, 6], ["FU", 3, [0, 1]], ["SP", 3, 0, 2, [2], 1], ["AN", 3, 1, 2], ["FFSP", 3, 0, [2, 1], 1, 1], ["AN", 3, 1, 6], ["FU", 1, [0, 1]], ["SP", 1, 0, 1, [1], 1], ["AN", 1, 1, 2], ["FFSP", 1, 0, [2, 1], 1, 1], ["AN", 1, 1, 6], ["PR", 4, 0, "auto_unroll_max_step$0"]]]], "r": [[0.000318804, 0.000318807, 0.0003188], 0, 1.99412, 1675067082], "v": "v0.6"}
{"i": [["[\"d320fe41e200472e48316303a3461f84\", [8, 1024], [1024, 1024], [1, 1024], [8, 1024]]", "cuda -keys=cuda,gpu -arch=sm_86 -max_num_threads=1024 -thread_warp_size=32", [-1, 16, 64, 49152, 2147483647, 1024, 8, 32], "llvm -keys=cpu ", 0, []], [[], [["CI", 4], ["SP", 2, 0, 8, [2, 1, 1, 4], 1], ["SP", 2, 5, 1024, [1, 32, 8, 2], 1], ["SP", 2, 10, 1024, [1, 8], 1], ["RE", 2, [0, 5, 1, 6, 2, 7, 10, 11, 3, 8, 12, 4, 9]], ["FSP", 5, 0, 1, 3], ["FSP", 5, 4, 2, 3], ["RE", 5, [0, 4, 1, 5, 2, 6, 3, 7]], ["CA", 2, 5, 5], ["CHR", 1, "shared", [2]], ["CA", 2, 3, 6], ["CHR", 0, "shared", [3]], ["CA", 1, 4, 6], ["FU", 7, [0, 1]], ["AN", 7, 0, 5], ["FU", 7, [1, 2]], ["AN", 7, 1, 4], ["FU", 7, [2, 3]], ["AN", 7, 2, 6], ["FU", 3, [0, 1]], ["SP", 3, 0, 32, [1], 1], ["AN", 3, 1, 2], ["FFSP", 3, 0, [2, 1], 1, 1], ["AN", 3, 1, 6], ["FU", 1, [0, 1]], ["SP", 1, 0, 8, [1], 1], ["AN", 1, 1, 2], ["FFSP", 1, 0, [2, 1], 1, 1], ["AN", 1, 1, 6], ["PR", 4, 0, "auto_unroll_max_step$512"]]]], "r": [[0.00036227, 0.000362273, 0.000362271], 0, 2.9294, 1675067084], "v": "v0.6"}
{"i": [["[\"d320fe41e200472e48316303a3461f84\", [8, 1024], [1024, 1024], [1, 1024], [8, 1024]]", "cuda -keys=cuda,gpu -arch=sm_86 -max_num_threads=1024 -thread_warp_size=32", [-1, 16, 64, 49152, 2147483647, 1024, 8, 32], "llvm -keys=cpu ", 0, []], [[], [["CI", 4], ["SP", 2, 0, 8, [1, 4, 1, 1], 1], ["SP", 2, 5, 1024, [1, 32, 2, 4], 1], ["SP", 2, 10, 1024, [1, 8], 1], ["RE", 2, [0, 5, 1, 6, 2, 7, 10, 11, 3, 8, 12, 4, 9]], ["FSP", 5, 0, 1, 3], ["FSP", 5, 4, 2, 3], ["RE", 5, [0, 4, 1, 5, 2, 6, 3, 7]], ["CA", 2, 5, 5], ["CHR", 1, "shared", [2]], ["CA", 2, 3, 6], ["CHR", 0, "shared", [3]], ["CA", 1, 4, 6], ["FU", 7, [0, 1]], ["AN", 7, 0, 5], ["FU", 7, [1, 2]], ["AN", 7, 1, 4], ["FU", 7, [2, 3]], ["AN", 7, 2, 6], ["FU", 3, [0, 1]], ["SP", 3, 0, 64, [64], 1], ["AN", 3, 1, 2], ["FFSP", 3, 0, [2, 1], 1, 1], ["AN", 3, 1, 6], ["FU", 1, [0, 1]], ["SP", 1, 0, 8, [4], 1], ["AN", 1, 1, 2], ["FFSP", 1, 0, [2, 1], 1, 1], ["AN", 1, 1, 6], ["PR", 4, 0, "auto_unroll_max_step$0"]]]], "r": [[0.000474123, 0.000474134, 0.000474142], 0, 1.42807, 1675067085], "v": "v0.6"}
{"i": [["[\"d320fe41e200472e48316303a3461f84\", [8, 1024], [1024, 1024], [1, 1024], [8, 1024]]", "cuda -keys=cuda,gpu -arch=sm_86 -max_num_threads=1024 -thread_warp_size=32", [-1, 16, 64, 49152, 2147483647, 1024, 8, 32], "llvm -keys=cpu ", 0, []], [[], [["CI", 4], ["SP", 2, 0, 8, [1, 4, 1, 1], 1], ["SP", 2, 5, 1024, [1, 16, 2, 1], 1], ["SP", 2, 10, 1024, [1, 1], 1], ["RE", 2, [0, 5, 1, 6, 2, 7, 10, 11, 3, 8, 12, 4, 9]], ["FSP", 5, 0, 1, 3], ["FSP", 5, 4, 2, 3], ["RE", 5, [0, 4, 1, 5, 2, 6, 3, 7]], ["CA", 2, 5, 5], ["CHR", 1, "shared", [2]], ["CA", 2, 3, 6], ["CHR", 0, "shared", [3]], ["CA", 1, 4, 6], ["FU", 7, [0, 1]], ["AN", 7, 0, 5], ["FU", 7, [1, 2]], ["AN", 7, 1, 4], ["FU", 7, [2, 3]], ["AN", 7, 2, 6], ["FU", 3, [0, 1]], ["SP", 3, 0, 2, [1], 1], ["AN", 3, 1, 2], ["FFSP", 3, 0, [2, 1], 1, 1], ["AN", 3, 1, 6], ["FU", 1, [0, 1]], ["SP", 1, 0, 1, [1], 1], ["AN", 1, 1, 2], ["FFSP", 1, 0, [2, 1], 1, 1], ["AN", 1, 1, 6], ["PR", 4, 0, "auto_unroll_max_step$0"]]]], "r": [[8.78931e-05, 8.78929e-05, 8.78927e-05], 0, 1.88195, 1675067086], "v": "v0.6"}
{"i": [["[\"d320fe41e200472e48316303a3461f84\", [8, 1024], [1024, 1024], [1, 1024], [8, 1024]]", "cuda -keys=cuda,gpu -arch=sm_86 -max_num_threads=1024 -thread_warp_size=32", [-1, 16, 64, 49152, 2147483647, 1024, 8, 32], "llvm -keys=cpu ", 0, []], [[], [["CI", 4], ["SP", 2, 0, 8, [1, 8, 1, 1], 1], ["SP", 2, 5, 1024, [1, 16, 2, 2], 1], ["SP", 2, 10, 1024, [64, 4], 1], ["RE", 2, [0, 5, 1, 6, 2, 7, 10, 11, 3, 8, 12, 4, 9]], ["FSP", 5, 0, 1, 3], ["FSP", 5, 4, 2, 3], ["RE", 5, [0, 4, 1, 5, 2, 6, 3, 7]], ["CA", 2, 5, 5], ["CHR", 1, "shared", [2]], ["CA", 2, 3, 6], ["CHR", 0, "shared", [3]], ["CA", 1, 4, 6], ["FU", 7, [0, 1]], ["AN", 7, 0, 5], ["FU", 7, [1, 2]], ["AN", 7, 1, 4], ["FU", 7, [2, 3]], ["AN", 7, 2, 6], ["FU", 3, [0, 1]], ["SP", 3, 0, 1024, [1], 1], ["AN", 3, 1, 2], ["FFSP", 3, 0, [2, 1], 1, 1], ["AN", 3, 1, 6], ["FU", 1, [0, 1]], ["SP", 1, 0, 256, [2], 1], ["AN", 1, 1, 2], ["FFSP", 1, 0, [2, 1], 1, 1], ["AN", 1, 1, 6], ["PR", 4, 0, "auto_unroll_max_step$512"]]]], "r": [[8.68217e-05, 8.68237e-05, 8.68224e-05], 0, 2.21303, 1675067088], "v": "v0.6"}
{"i": [["[\"d320fe41e200472e48316303a3461f84\", [8, 1024], [1024, 1024], [1, 1024], [8, 1024]]", "cuda -keys=cuda,gpu -arch=sm_86 -max_num_threads=1024 -thread_warp_size=32", [-1, 16, 64, 49152, 2147483647, 1024, 8, 32], "llvm -keys=cpu ", 0, []], [[], [["CI", 4], ["SP", 2, 0, 8, [1, 4, 1, 1], 1], ["SP", 2, 5, 1024, [2, 8, 2, 1], 1], ["SP", 2, 10, 1024, [2, 1], 1], ["RE", 2, [0, 5, 1, 6, 2, 7, 10, 11, 3, 8, 12, 4, 9]], ["FSP", 5, 0, 1, 3], ["FSP", 5, 4, 2, 3], ["RE", 5, [0, 4, 1, 5, 2, 6, 3, 7]], ["CA", 2, 5, 5], ["CHR", 1, "shared", [2]], ["CA", 2, 3, 6], ["CHR", 0, "shared", [3]], ["CA", 1, 4, 6], ["FU", 7, [0, 1]], ["AN", 7, 0, 5], ["FU", 7, [1, 2]], ["AN", 7, 1, 4], ["FU", 7, [2, 3]], ["AN", 7, 2, 6], ["FU", 3, [0, 1]], ["SP", 3, 0, 256, [1], 1], ["AN", 3, 1, 2], ["FFSP", 3, 0, [2, 1], 1, 1], ["AN", 3, 1, 6], ["FU", 1, [0, 1]], ["SP", 1, 0, 128, [16], 1], ["AN", 1, 1, 2], ["FFSP", 1, 0, [2, 1], 1, 1], ["AN", 1, 1, 6], ["PR", 4, 0, "auto_unroll_max_step$16"]]]], "r": [[6.91945e-05, 6.91944e-05, 6.91925e-05], 0, 1.91632, 1675067089], "v": "v0.6"}
{"i": [["[\"d320fe41e200472e48316303a3461f84\", [8, 1024], [1024, 1024], [1, 1024], [8, 1024]]", "cuda -keys=cuda,gpu -arch=sm_86 -max_num_threads=1024 -thread_warp_size=32", [-1, 16, 64, 49152, 2147483647, 1024, 8, 32], "llvm -keys=cpu ", 0, []], [[], [["CI", 4], ["SP", 2, 0, 8, [2, 2, 1, 2], 1], ["SP", 2, 5, 1024, [2, 64, 2, 2], 1], ["SP", 2, 10, 1024, [1, 2], 1], ["RE", 2, [0, 5, 1, 6, 2, 7, 10, 11, 3, 8, 12, 4, 9]], ["FSP", 5, 0, 1, 3], ["FSP", 5, 4, 2, 3], ["RE", 5, [0, 4, 1, 5, 2, 6, 3, 7]], ["CA", 2, 5, 5], ["CHR", 1, "shared", [2]], ["CA", 2, 3, 6], ["CHR", 0, "shared", [3]], ["CA", 1, 4, 6], ["FU", 7, [0, 1]], ["AN", 7, 0, 5], ["FU", 7, [1, 2]], ["AN", 7, 1, 4], ["FU", 7, [2, 3]], ["AN", 7, 2, 6], ["FU", 3, [0, 1]], ["SP", 3, 0, 8, [1], 1], ["AN", 3, 1, 2], ["FFSP", 3, 0, [2, 1], 1, 1], ["AN", 3, 1, 6], ["FU", 1, [0, 1]], ["SP", 1, 0, 4, [2], 1], ["AN", 1, 1, 2], ["FFSP", 1, 0, [2, 1], 1, 1], ["AN", 1, 1, 6], ["PR", 4, 0, "auto_unroll_max_step$0"]]]], "r": [[0.0003257, 0.00032569, 0.000325714], 0, 1.97401, 1675067091], "v": "v0.6"}
{"i": [["[\"d320fe41e200472e48316303a3461f84\", [8, 1024], [1024, 1024], [1, 1024], [8, 1024]]", "cuda -keys=cuda,gpu -arch=sm_86 -max_num_threads=1024 -thread_warp_size=32", [-1, 16, 64, 49152, 2147483647, 1024, 8, 32], "llvm -keys=cpu ", 0, []], [[], [["CI", 4], ["SP", 2, 0, 8, [2, 1, 1, 1], 1], ["SP", 2, 5, 1024, [1, 1, 1024, 1], 1], ["SP", 2, 10, 1024, [1, 8], 1], ["RE", 2, [0, 5, 1, 6, 2, 7, 10, 11, 3, 8, 12, 4, 9]], ["FSP", 5, 0, 1, 3], ["FSP", 5, 4, 2, 3], ["RE", 5, [0, 4, 1, 5, 2, 6, 3, 7]], ["CA", 2, 5, 5], ["CHR", 1, "shared", [2]], ["CA", 2, 3, 6], ["CHR", 0, "shared", [3]], ["CA", 1, 4, 6], ["FU", 7, [0, 1]], ["AN", 7, 0, 5], ["FU", 7, [1, 2]], ["AN", 7, 1, 4], ["FU", 7, [2, 3]], ["AN", 7, 2, 6], ["FU", 3, [0, 1]], ["SP", 3, 0, 64, [1], 1], ["AN", 3, 1, 2], ["FFSP", 3, 0, [2, 1], 1, 1], ["AN", 3, 1, 6], ["FU", 1, [0, 1]], ["SP", 1, 0, 8, [1], 1], ["AN", 1, 1, 2], ["FFSP", 1, 0, [2, 1], 1, 1], ["AN", 1, 1, 6], ["PR", 4, 0, "auto_unroll_max_step$16"]]]], "r": [[0.0156271, 0.0156291, 0.0156256], 0, 1.47457, 1675067092], "v": "v0.6"}
{"i": [["[\"d320fe41e200472e48316303a3461f84\", [8, 1024], [1024, 1024], [1, 1024], [8, 1024]]", "cuda -keys=cuda,gpu -arch=sm_86 -max_num_threads=1024 -thread_warp_size=32", [-1, 16, 64, 49152, 2147483647, 1024, 8, 32], "llvm -keys=cpu ", 0, []], [[], [["CI", 4], ["SP", 2, 0, 8, [2, 1, 1, 4], 1], ["SP", 2, 5, 1024, [4, 64, 4, 1], 1], ["SP", 2, 10, 1024, [2, 4], 1], ["RE", 2, [0, 5, 1, 6, 2, 7, 10, 11, 3, 8, 12, 4, 9]], ["FSP", 5, 0, 1, 3], ["FSP", 5, 4, 2, 3], ["RE", 5, [0, 4, 1, 5, 2, 6, 3, 7]], ["CA", 2, 5, 5], ["CHR", 1, "shared", [2]], ["CA", 2, 3, 6], ["CHR", 0, "shared", [3]], ["CA", 1, 4, 6], ["FU", 7, [0, 1]], ["AN", 7, 0, 5], ["FU", 7, [1, 2]], ["AN", 7, 1, 4], ["FU", 7, [2, 3]], ["AN", 7, 2, 6], ["FU", 3, [0, 1]], ["SP", 3, 0, 32, [1], 1], ["AN", 3, 1, 2], ["FFSP", 3, 0, [2, 1], 1, 1], ["AN", 3, 1, 6], ["FU", 1, [0, 1]], ["SP", 1, 0, 16, [1], 1], ["AN", 1, 1, 2], ["FFSP", 1, 0, [2, 1], 1, 1], ["AN", 1, 1, 6], ["PR", 4, 0, "auto_unroll_max_step$512"]]]], "r": [[0.000303369, 0.000303376, 0.000303378], 0, 3.32453, 1675067093], "v": "v0.6"}
{"i": [["[\"d320fe41e200472e48316303a3461f84\", [8, 1024], [1024, 1024], [1, 1024], [8, 1024]]", "cuda -keys=cuda,gpu -arch=sm_86 -max_num_threads=1024 -thread_warp_size=32", [-1, 16, 64, 49152, 2147483647, 1024, 8, 32], "llvm -keys=cpu ", 0, []], [[], [["CI", 4], ["SP", 2, 0, 8, [1, 1, 2, 2], 1], ["SP", 2, 5, 1024, [2, 128, 2, 2], 1], ["SP", 2, 10, 1024, [4, 4], 1], ["RE", 2, [0, 5, 1, 6, 2, 7, 10, 11, 3, 8, 12, 4, 9]], ["FSP", 5, 0, 1, 3], ["FSP", 5, 4, 2, 3], ["RE", 5, [0, 4, 1, 5, 2, 6, 3, 7]], ["CA", 2, 5, 5], ["CHR", 1, "shared", [2]], ["CA", 2, 3, 6], ["CHR", 0, "shared", [3]], ["CA", 1, 4, 6], ["FU", 7, [0, 1]], ["AN", 7, 0, 5], ["FU", 7, [1, 2]], ["AN", 7, 1, 4], ["FU", 7, [2, 3]], ["AN", 7, 2, 6], ["FU", 3, [0, 1]], ["SP", 3, 0, 64, [4], 1], ["AN", 3, 1, 2], ["FFSP", 3, 0, [2, 1], 1, 1], ["AN", 3, 1, 6], ["FU", 1, [0, 1]], ["SP", 1, 0, 32, [1], 1], ["AN", 1, 1, 2], ["FFSP", 1, 0, [2, 1], 1, 1], ["AN", 1, 1, 6], ["PR", 4, 0, "auto_unroll_max_step$64"]]]], "r": [[0.000243532, 0.000243533, 0.00024354], 0, 2.19374, 1675067095], "v": "v0.6"}
{"i": [["[\"d320fe41e200472e48316303a3461f84\", [8, 1024], [1024, 1024], [1, 1024], [8, 1024]]", "cuda -keys=cuda,gpu -arch=sm_86 -max_num_threads=1024 -thread_warp_size=32", [-1, 16, 64, 49152, 2147483647, 1024, 8, 32], "llvm -keys=cpu ", 0, []], [[], [["CI", 4], ["SP", 2, 0, 8, [2, 2, 1, 1], 1], ["SP", 2, 5, 1024, [2, 128, 2, 2], 1], ["SP", 2, 10, 1024, [4, 4], 1], ["RE", 2, [0, 5, 1, 6, 2, 7, 10, 11, 3, 8, 12, 4, 9]], ["FSP", 5, 0, 1, 3], ["FSP", 5, 4, 2, 3], ["RE", 5, [0, 4, 1, 5, 2, 6, 3, 7]], ["CA", 2, 5, 5], ["CHR", 1, "shared", [2]], ["CA", 2, 3, 6], ["CHR", 0, "shared", [3]], ["CA", 1, 4, 6], ["FU", 7, [0, 1]], ["AN", 7, 0, 5], ["FU", 7, [1, 2]], ["AN", 7, 1, 4], ["FU", 7, [2, 3]], ["AN", 7, 2, 6], ["FU", 3, [0, 1]], ["SP", 3, 0, 64, [1], 1], ["AN", 3, 1, 2], ["FFSP", 3, 0, [2, 1], 1, 1], ["AN", 3, 1, 6], ["FU", 1, [0, 1]], ["SP", 1, 0, 32, [1], 1], ["AN", 1, 1, 2], ["FFSP", 1, 0, [2, 1], 1, 1], ["AN", 1, 1, 6], ["PR", 4, 0, "auto_unroll_max_step$1024"]]]], "r": [[0.000414071, 0.000414072, 0.000414105], 0, 2.24685, 1675067096], "v": "v0.6"}
{"i": [["[\"d320fe41e200472e48316303a3461f84\", [8, 1024], [1024, 1024], [1, 1024], [8, 1024]]", "cuda -keys=cuda,gpu -arch=sm_86 -max_num_threads=1024 -thread_warp_size=32", [-1, 16, 64, 49152, 2147483647, 1024, 8, 32], "llvm -keys=cpu ", 0, []], [[], [["CI", 4], ["SP", 2, 0, 8, [1, 2, 4, 1], 1], ["SP", 2, 5, 1024, [1, 4, 128, 1], 1], ["SP", 2, 10, 1024, [4, 8], 1], ["RE", 2, [0, 5, 1, 6, 2, 7, 10, 11, 3, 8, 12, 4, 9]], ["FSP", 5, 0, 1, 3], ["FSP", 5, 4, 2, 3], ["RE", 5, [0, 4, 1, 5, 2, 6, 3, 7]], ["CA", 2, 5, 5], ["CHR", 1, "shared", [2]], ["CA", 2, 3, 6], ["CHR", 0, "shared", [3]], ["CA", 1, 4, 6], ["FU", 7, [0, 1]], ["AN", 7, 0, 5], ["FU", 7, [1, 2]], ["AN", 7, 1, 4], ["FU", 7, [2, 3]], ["AN", 7, 2, 6], ["FU", 3, [0, 1]], ["SP", 3, 0, 512, [1], 1], ["AN", 3, 1, 2], ["FFSP", 3, 0, [2, 1], 1, 1], ["AN", 3, 1, 6], ["FU", 1, [0, 1]], ["SP", 1, 0, 32, [1], 1], ["AN", 1, 1, 2], ["FFSP", 1, 0, [2, 1], 1, 1], ["AN", 1, 1, 6], ["PR", 4, 0, "auto_unroll_max_step$16"]]]], "r": [[0.00372095, 0.00372362, 0.00372133], 0, 1.63449, 1675067097], "v": "v0.6"}
{"i": [["[\"d320fe41e200472e48316303a3461f84\", [8, 1024], [1024, 1024], [1, 1024], [8, 1024]]", "cuda -keys=cuda,gpu -arch=sm_86 -max_num_threads=1024 -thread_warp_size=32", [-1, 16, 64, 49152, 2147483647, 1024, 8, 32], "llvm -keys=cpu ", 0, []], [[], [["CI", 4], ["SP", 2, 0, 8, [1, 8, 1, 1], 1], ["SP", 2, 5, 1024, [1, 8, 2, 4], 1], ["SP", 2, 10, 1024, [4, 2], 1], ["RE", 2, [0, 5, 1, 6, 2, 7, 10, 11, 3, 8, 12, 4, 9]], ["FSP", 5, 0, 1, 3], ["FSP", 5, 4, 2, 3], ["RE", 5, [0, 4, 1, 5, 2, 6, 3, 7]], ["CA", 2, 5, 5], ["CHR", 1, "shared", [2]], ["CA", 2, 3, 6], ["CHR", 0, "shared", [3]], ["CA", 1, 4, 6], ["FU", 7, [0, 1]], ["AN", 7, 0, 5], ["FU", 7, [1, 2]], ["AN", 7, 1, 4], ["FU", 7, [2, 3]], ["AN", 7, 2, 6], ["FU", 3, [0, 1]], ["SP", 3, 0, 128, [1], 1], ["AN", 3, 1, 2], ["FFSP", 3, 0, [2, 1], 1, 1], ["AN", 3, 1, 6], ["FU", 1, [0, 1]], ["SP", 1, 0, 16, [1], 1], ["AN", 1, 1, 2], ["FFSP", 1, 0, [2, 1], 1, 1], ["AN", 1, 1, 6], ["PR", 4, 0, "auto_unroll_max_step$0"]]]], "r": [[6.96088e-05, 6.96126e-05, 6.96157e-05], 0, 1.9046, 1675067098], "v": "v0.6"}
{"i": [["[\"d320fe41e200472e48316303a3461f84\", [8, 1024], [1024, 1024], [1, 1024], [8, 1024]]", "cuda -keys=cuda,gpu -arch=sm_86 -max_num_threads=1024 -thread_warp_size=32", [-1, 16, 64, 49152, 2147483647, 1024, 8, 32], "llvm -keys=cpu ", 0, []], [[], [["CI", 4], ["SP", 2, 0, 8, [1, 2, 4, 1], 1], ["SP", 2, 5, 1024, [1, 32, 4, 2], 1], ["SP", 2, 10, 1024, [16, 1], 1], ["RE", 2, [0, 5, 1, 6, 2, 7, 10, 11, 3, 8, 12, 4, 9]], ["FSP", 5, 0, 1, 3], ["FSP", 5, 4, 2, 3], ["RE", 5, [0, 4, 1, 5, 2, 6, 3, 7]], ["CA", 2, 5, 5], ["CHR", 1, "shared", [2]], ["CA", 2, 3, 6], ["CHR", 0, "shared", [3]], ["CA", 1, 4, 6], ["FU", 7, [0, 1]], ["AN", 7, 0, 5], ["FU", 7, [1, 2]], ["AN", 7, 1, 4], ["FU", 7, [2, 3]], ["AN", 7, 2, 6], ["FU", 3, [0, 1]], ["SP", 3, 0, 128, [1], 1], ["AN", 3, 1, 2], ["FFSP", 3, 0, [2, 1], 1, 1], ["AN", 3, 1, 6], ["FU", 1, [0, 1]], ["SP", 1, 0, 64, [64], 1], ["AN", 1, 1, 2], ["FFSP", 1, 0, [2, 1], 1, 1], ["AN", 1, 1, 6], ["PR", 4, 0, "auto_unroll_max_step$64"]]]], "r": [[0.00025448, 0.000254485, 0.000254482], 0, 2.12398, 1675067100], "v": "v0.6"}
{"i": [["[\"d320fe41e200472e48316303a3461f84\", [8, 1024], [1024, 1024], [1, 1024], [8, 1024]]", "cuda -keys=cuda,gpu -arch=sm_86 -max_num_threads=1024 -thread_warp_size=32", [-1, 16, 64, 49152, 2147483647, 1024, 8, 32], "llvm -keys=cpu ", 0, []], [[], [["CI", 4], ["SP", 2, 0, 8, [1, 2, 2, 1], 1], ["SP", 2, 5, 1024, [8, 32, 1, 1], 1], ["SP", 2, 10, 1024, [1, 4], 1], ["RE", 2, [0, 5, 1, 6, 2, 7, 10, 11, 3, 8, 12, 4, 9]], ["FSP", 5, 0, 1, 3], ["FSP", 5, 4, 2, 3], ["RE", 5, [0, 4, 1, 5, 2, 6, 3, 7]], ["CA", 2, 5, 5], ["CHR", 1, "shared", [2]], ["CA", 2, 3, 6], ["CHR", 0, "shared", [3]], ["CA", 1, 4, 6], ["FU", 7, [0, 1]], ["AN", 7, 0, 5], ["FU", 7, [1, 2]], ["AN", 7, 1, 4], ["FU", 7, [2, 3]], ["AN", 7, 2, 6], ["FU", 3, [0, 1]], ["SP", 3, 0, 4, [1], 1], ["AN", 3, 1, 2], ["FFSP", 3, 0, [2, 1], 1, 1], ["AN", 3, 1, 6], ["FU", 1, [0, 1]], ["SP", 1, 0, 8, [1], 1], ["AN", 1, 1, 2], ["FFSP", 1, 0, [2, 1], 1, 1], ["AN", 1, 1, 6], ["PR", 4, 0, "auto_unroll_max_step$512"]]]], "r": [[9.45366e-05, 9.45389e-05, 9.45395e-05], 0, 1.97257, 1675067101], "v": "v0.6"}
{"i": [["[\"d320fe41e200472e48316303a3461f84\", [8, 1024], [1024, 1024], [1, 1024], [8, 1024]]", "cuda -keys=cuda,gpu -arch=sm_86 -max_num_threads=1024 -thread_warp_size=32", [-1, 16, 64, 49152, 2147483647, 1024, 8, 32], "llvm -keys=cpu ", 0, []], [[], [["CI", 4], ["SP", 2, 0, 8, [1, 2, 2, 2], 1], ["SP", 2, 5, 1024, [1, 16, 1, 64], 1], ["SP", 2, 10, 1024, [1, 4], 1], ["RE", 2, [0, 5, 1, 6, 2, 7, 10, 11, 3, 8, 12, 4, 9]], ["FSP", 5, 0, 1, 3], ["FSP", 5, 4, 2, 3], ["RE", 5, [0, 4, 1, 5, 2, 6, 3, 7]], ["CA", 2, 5, 5], ["CHR", 1, "shared", [2]], ["CA", 2, 3, 6], ["CHR", 0, "shared", [3]], ["CA", 1, 4, 6], ["FU", 7, [0, 1]], ["AN", 7, 0, 5], ["FU", 7, [1, 2]], ["AN", 7, 1, 4], ["FU", 7, [2, 3]], ["AN", 7, 2, 6], ["FU", 3, [0, 1]], ["SP", 3, 0, 256, [1], 1], ["AN", 3, 1, 2], ["FFSP", 3, 0, [2, 1], 1, 1], ["AN", 3, 1, 6], ["FU", 1, [0, 1]], ["SP", 1, 0, 16, [1], 1], ["AN", 1, 1, 2], ["FFSP", 1, 0, [2, 1], 1, 1], ["AN", 1, 1, 6], ["PR", 4, 0, "auto_unroll_max_step$16"]]]], "r": [[0.00314461, 0.00314462, 0.00314464], 0, 1.9264, 1675067102], "v": "v0.6"}
