bert/logs/cutlass_ansor.log
{"i": [["[\"653868ea1853936b9916ea8e64af13b6\", [8, 128, 1024], [8, 128, 1], [8, 128, 1], [1024], [1024], [8, 1024]]", "cuda -keys=cuda,gpu -arch=sm_86 -max_num_threads=1024 -thread_warp_size=32", [-1, 16, 64, 49152, 2147483647, 1024, 8, 32], "llvm -keys=cpu ", 0, []], [[], [["CI", 13], ["CI", 12], ["CI", 10], ["CI", 8], ["CI", 7], ["CI", 6], ["CI", 5], ["CI", 3], ["CI", 0], ["FU", 14, [0, 1]], ["SP", 14, 0, 8192, [8], 1], ["AN", 14, 0, 5], ["AN", 14, 1, 6]]]], "r": [[2.82751e-06, 2.8275e-06, 2.82759e-06], 0, 1.52073, 1674960716], "v": "v0.6"}
{"i": [["[\"653868ea1853936b9916ea8e64af13b6\", [8, 128, 1024], [8, 128, 1], [8, 128, 1], [1024], [1024], [8, 1024]]", "cuda -keys=cuda,gpu -arch=sm_86 -max_num_threads=1024 -thread_warp_size=32", [-1, 16, 64, 49152, 2147483647, 1024, 8, 32], "llvm -keys=cpu ", 0, []], [[], [["CI", 13], ["CI", 12], ["CI", 10], ["CI", 8], ["CI", 7], ["CI", 6], ["CI", 5], ["CI", 3], ["CI", 0], ["FU", 14, [0, 1]], ["SP", 14, 0, 8192, [1], 1], ["AN", 14, 0, 5], ["AN", 14, 1, 6]]]], "r": [[7.77378e-06, 7.77318e-06, 7.79354e-06], 0, 1.66372, 1674960717], "v": "v0.6"}
{"i": [["[\"653868ea1853936b9916ea8e64af13b6\", [8, 128, 1024], [8, 128, 1], [8, 128, 1], [1024], [1024], [8, 1024]]", "cuda -keys=cuda,gpu -arch=sm_86 -max_num_threads=1024 -thread_warp_size=32", [-1, 16, 64, 49152, 2147483647, 1024, 8, 32], "llvm -keys=cpu ", 0, []], [[], [["CI", 13], ["CI", 12], ["CI", 10], ["CI", 8], ["CI", 7], ["CI", 6], ["CI", 5], ["CI", 3], ["CI", 0], ["FU", 14, [0, 1]], ["SP", 14, 0, 8192, [2], 1], ["AN", 14, 0, 5], ["AN", 14, 1, 6]]]], "r": [[4.91184e-06, 4.91169e-06, 4.91227e-06], 0, 1.58634, 1674960719], "v": "v0.6"}
{"i": [["[\"653868ea1853936b9916ea8e64af13b6\", [8, 128, 1024], [8, 128, 1], [8, 128, 1], [1024], [1024], [8, 1024]]", "cuda -keys=cuda,gpu -arch=sm_86 -max_num_threads=1024 -thread_warp_size=32", [-1, 16, 64, 49152, 2147483647, 1024, 8, 32], "llvm -keys=cpu ", 0, []], [[], [["CI", 13], ["CI", 12], ["CI", 10], ["CI", 8], ["CI", 7], ["CI", 6], ["CI", 5], ["CI", 3], ["CI", 0], ["FU", 14, [0, 1]], ["SP", 14, 0, 8192, [4], 1], ["AN", 14, 0, 5], ["AN", 14, 1, 6]]]], "r": [[3.5201e-06, 3.51979e-06, 3.52008e-06], 0, 1.46023, 1674960720], "v": "v0.6"}
{"i": [["[\"653868ea1853936b9916ea8e64af13b6\", [8, 128, 1024], [8, 128, 1], [8, 128, 1], [1024], [1024], [8, 1024]]", "cuda -keys=cuda,gpu -arch=sm_86 -max_num_threads=1024 -thread_warp_size=32", [-1, 16, 64, 49152, 2147483647, 1024, 8, 32], "llvm -keys=cpu ", 0, []], [[], [["CI", 13], ["CI", 12], ["CI", 10], ["CI", 8], ["CI", 7], ["CI", 6], ["CI", 5], ["CI", 3], ["CI", 0], ["FU", 14, [0, 1]], ["SP", 14, 0, 8192, [16], 1], ["AN", 14, 0, 5], ["AN", 14, 1, 6]]]], "r": [[2.37017e-06, 2.37014e-06, 2.37004e-06], 0, 1.35438, 1674960721], "v": "v0.6"}
{"i": [["[\"653868ea1853936b9916ea8e64af13b6\", [8, 128, 1024], [8, 128, 1], [8, 128, 1], [1024], [1024], [8, 1024]]", "cuda -keys=cuda,gpu -arch=sm_86 -max_num_threads=1024 -thread_warp_size=32", [-1, 16, 64, 49152, 2147483647, 1024, 8, 32], "llvm -keys=cpu ", 0, []], [[], [["CI", 13], ["CI", 12], ["CI", 10], ["CI", 8], ["CI", 7], ["CI", 6], ["CI", 5], ["CI", 3], ["CI", 0], ["FU", 14, [0, 1]], ["SP", 14, 0, 8192, [32], 1], ["AN", 14, 0, 5], ["AN", 14, 1, 6]]]], "r": [[2.23047e-06, 2.23047e-06, 2.23038e-06], 0, 1.36885, 1674960722], "v": "v0.6"}
{"i": [["[\"653868ea1853936b9916ea8e64af13b6\", [8, 128, 1024], [8, 128, 1], [8, 128, 1], [1024], [1024], [8, 1024]]", "cuda -keys=cuda,gpu -arch=sm_86 -max_num_threads=1024 -thread_warp_size=32", [-1, 16, 64, 49152, 2147483647, 1024, 8, 32], "llvm -keys=cpu ", 0, []], [[], [["CI", 13], ["CI", 12], ["CI", 10], ["CI", 8], ["CI", 7], ["CI", 6], ["CI", 5], ["CI", 3], ["CI", 0], ["FU", 14, [0, 1]], ["SP", 14, 0, 8192, [64], 1], ["AN", 14, 0, 5], ["AN", 14, 1, 6]]]], "r": [[2.09576e-06, 2.09416e-06, 2.09435e-06], 0, 1.33518, 1674960723], "v": "v0.6"}
{"i": [["[\"a7baec9424d5d4a119f705704cdabb95\", [8, 16, 128, 128], [128, 128, 128]]", "cuda -keys=cuda,gpu -arch=sm_86 -max_num_threads=1024 -thread_warp_size=32", [-1, 16, 64, 49152, 2147483647, 1024, 8, 32], "llvm -keys=cpu ", 0, []], [[], [["CI", 1], ["FU", 2, [0, 1, 2]], ["SP", 2, 0, 2097152, [64], 1], ["AN", 2, 0, 5], ["AN", 2, 1, 6]]]], "r": [[2.78511e-05, 2.78517e-05, 2.8979e-05], 0, 2.01492, 1674960763], "v": "v0.6"}
{"i": [["[\"a7baec9424d5d4a119f705704cdabb95\", [8, 16, 128, 128], [128, 128, 128]]", "cuda -keys=cuda,gpu -arch=sm_86 -max_num_threads=1024 -thread_warp_size=32", [-1, 16, 64, 49152, 2147483647, 1024, 8, 32], "llvm -keys=cpu ", 0, []], [[], [["CI", 1], ["FU", 2, [0, 1, 2]], ["SP", 2, 0, 2097152, [2], 1], ["AN", 2, 0, 5], ["AN", 2, 1, 6]]]], "r": [[0.000738262, 0.000738237, 0.000738267], 0, 1.4748, 1674960764], "v": "v0.6"}
{"i": [["[\"a7baec9424d5d4a119f705704cdabb95\", [8, 16, 128, 128], [128, 128, 128]]", "cuda -keys=cuda,gpu -arch=sm_86 -max_num_threads=1024 -thread_warp_size=32", [-1, 16, 64, 49152, 2147483647, 1024, 8, 32], "llvm -keys=cpu ", 0, []], [[], [["CI", 1], ["FU", 2, [0, 1, 2]], ["SP", 2, 0, 2097152, [4], 1], ["AN", 2, 0, 5], ["AN", 2, 1, 6]]]], "r": [[0.000370305, 0.000370318, 0.000370318], 0, 2.03365, 1674960766], "v": "v0.6"}
{"i": [["[\"a7baec9424d5d4a119f705704cdabb95\", [8, 16, 128, 128], [128, 128, 128]]", "cuda -keys=cuda,gpu -arch=sm_86 -max_num_threads=1024 -thread_warp_size=32", [-1, 16, 64, 49152, 2147483647, 1024, 8, 32], "llvm -keys=cpu ", 0, []], [[], [["CI", 1], ["FU", 2, [0, 1, 2]], ["SP", 2, 0, 2097152, [1], 1], ["AN", 2, 0, 5], ["AN", 2, 1, 6]]]], "r": [[0.00147416, 0.00147423, 0.00147416], 0, 1.45906, 1674960767], "v": "v0.6"}
{"i": [["[\"a7baec9424d5d4a119f705704cdabb95\", [8, 16, 128, 128], [128, 128, 128]]", "cuda -keys=cuda,gpu -arch=sm_86 -max_num_threads=1024 -thread_warp_size=32", [-1, 16, 64, 49152, 2147483647, 1024, 8, 32], "llvm -keys=cpu ", 0, []], [[], [["CI", 1], ["FU", 2, [0, 1, 2]], ["SP", 2, 0, 2097152, [32], 1], ["AN", 2, 0, 5], ["AN", 2, 1, 6]]]], "r": [[4.84393e-05, 4.84584e-05, 4.84574e-05], 0, 1.99455, 1674960769], "v": "v0.6"}
{"i": [["[\"a7baec9424d5d4a119f705704cdabb95\", [8, 16, 128, 128], [128, 128, 128]]", "cuda -keys=cuda,gpu -arch=sm_86 -max_num_threads=1024 -thread_warp_size=32", [-1, 16, 64, 49152, 2147483647, 1024, 8, 32], "llvm -keys=cpu ", 0, []], [[], [["CI", 1], ["FU", 2, [0, 1, 2]], ["SP", 2, 0, 2097152, [8], 1], ["AN", 2, 0, 5], ["AN", 2, 1, 6]]]], "r": [[0.00018645, 0.000186436, 0.000186439], 0, 2.02994, 1674960771], "v": "v0.6"}
{"i": [["[\"a7baec9424d5d4a119f705704cdabb95\", [8, 16, 128, 128], [128, 128, 128]]", "cuda -keys=cuda,gpu -arch=sm_86 -max_num_threads=1024 -thread_warp_size=32", [-1, 16, 64, 49152, 2147483647, 1024, 8, 32], "llvm -keys=cpu ", 0, []], [[], [["CI", 1], ["FU", 2, [0, 1, 2]], ["SP", 2, 0, 2097152, [16], 1], ["AN", 2, 0, 5], ["AN", 2, 1, 6]]]], "r": [[9.43884e-05, 9.43922e-05, 9.43897e-05], 0, 2.01707, 1674960773], "v": "v0.6"}
{"i": [["[\"3b1cab58e60c42027a44b3bc6ccd1768\", [8, 128, 1024], [1024, 1024]]", "cuda -keys=cuda,gpu -arch=sm_86 -max_num_threads=1024 -thread_warp_size=32", [-1, 16, 64, 49152, 2147483647, 1024, 8, 32], "llvm -keys=cpu ", 0, []], [[], [["CI", 1], ["FU", 2, [0, 1]], ["SP", 2, 0, 1048576, [1], 1], ["AN", 2, 0, 5], ["AN", 2, 1, 6]]]], "r": [[0.000738041, 0.000738036, 0.000738048], 0, 1.27533, 1674960805], "v": "v0.6"}
{"i": [["[\"3b1cab58e60c42027a44b3bc6ccd1768\", [8, 128, 1024], [1024, 1024]]", "cuda -keys=cuda,gpu -arch=sm_86 -max_num_threads=1024 -thread_warp_size=32", [-1, 16, 64, 49152, 2147483647, 1024, 8, 32], "llvm -keys=cpu ", 0, []], [[], [["CI", 1], ["FU", 2, [0, 1]], ["SP", 2, 0, 1048576, [32], 1], ["AN", 2, 0, 5], ["AN", 2, 1, 6]]]], "r": [[2.50605e-05, 2.50571e-05, 2.50765e-05], 0, 1.79528, 1674960806], "v": "v0.6"}
{"i": [["[\"3b1cab58e60c42027a44b3bc6ccd1768\", [8, 128, 1024], [1024, 1024]]", "cuda -keys=cuda,gpu -arch=sm_86 -max_num_threads=1024 -thread_warp_size=32", [-1, 16, 64, 49152, 2147483647, 1024, 8, 32], "llvm -keys=cpu ", 0, []], [[], [["CI", 1], ["FU", 2, [0, 1]], ["SP", 2, 0, 1048576, [64], 1], ["AN", 2, 0, 5], ["AN", 2, 1, 6]]]], "r": [[1.35562e-05, 1.35573e-05, 1.3556e-05], 0, 1.76216, 1674960808], "v": "v0.6"}
{"i": [["[\"3b1cab58e60c42027a44b3bc6ccd1768\", [8, 128, 1024], [1024, 1024]]", "cuda -keys=cuda,gpu -arch=sm_86 -max_num_threads=1024 -thread_warp_size=32", [-1, 16, 64, 49152, 2147483647, 1024, 8, 32], "llvm -keys=cpu ", 0, []], [[], [["CI", 1], ["FU", 2, [0, 1]], ["SP", 2, 0, 1048576, [4], 1], ["AN", 2, 0, 5], ["AN", 2, 1, 6]]]], "r": [[0.000186245, 0.000186253, 0.000186248], 0, 1.8552, 1674960810], "v": "v0.6"}
{"i": [["[\"3b1cab58e60c42027a44b3bc6ccd1768\", [8, 128, 1024], [1024, 1024]]", "cuda -keys=cuda,gpu -arch=sm_86 -max_num_threads=1024 -thread_warp_size=32", [-1, 16, 64, 49152, 2147483647, 1024, 8, 32], "llvm -keys=cpu ", 0, []], [[], [["CI", 1], ["FU", 2, [0, 1]], ["SP", 2, 0, 1048576, [2], 1], ["AN", 2, 0, 5], ["AN", 2, 1, 6]]]], "r": [[0.00037016, 0.000370169, 0.00037015], 0, 1.85737, 1674960811], "v": "v0.6"}
{"i": [["[\"3b1cab58e60c42027a44b3bc6ccd1768\", [8, 128, 1024], [1024, 1024]]", "cuda -keys=cuda,gpu -arch=sm_86 -max_num_threads=1024 -thread_warp_size=32", [-1, 16, 64, 49152, 2147483647, 1024, 8, 32], "llvm -keys=cpu ", 0, []], [[], [["CI", 1], ["FU", 2, [0, 1]], ["SP", 2, 0, 1048576, [16], 1], ["AN", 2, 0, 5], ["AN", 2, 1, 6]]]], "r": [[4.82013e-05, 4.82059e-05, 4.82152e-05], 0, 1.81336, 1674960813], "v": "v0.6"}
{"i": [["[\"3b1cab58e60c42027a44b3bc6ccd1768\", [8, 128, 1024], [1024, 1024]]", "cuda -keys=cuda,gpu -arch=sm_86 -max_num_threads=1024 -thread_warp_size=32", [-1, 16, 64, 49152, 2147483647, 1024, 8, 32], "llvm -keys=cpu ", 0, []], [[], [["CI", 1], ["FU", 2, [0, 1]], ["SP", 2, 0, 1048576, [8], 1], ["AN", 2, 0, 5], ["AN", 2, 1, 6]]]], "r": [[9.42639e-05, 9.4263e-05, 9.42626e-05], 0, 1.84213, 1674960814], "v": "v0.6"}
{"i": [["[\"75ed1f5e5423e4a4b19531a791605713\", [8, 128], [8, 1, 1, 128]]", "cuda -keys=cuda,gpu -arch=sm_86 -max_num_threads=1024 -thread_warp_size=32", [-1, 16, 64, 49152, 2147483647, 1024, 8, 32], "llvm -keys=cpu ", 0, []], [[], [["CI", 6], ["CI", 5], ["CI", 4], ["CI", 3], ["CI", 2], ["CI", 0], ["FU", 7, [0, 1, 2, 3]], ["SP", 7, 0, 1024, [1], 1], ["AN", 7, 0, 5], ["AN", 7, 1, 6]]]], "r": [[2.52971e-06, 2.52978e-06, 2.52996e-06], 0, 1.30569, 1674960850], "v": "v0.6"}
{"i": [["[\"75ed1f5e5423e4a4b19531a791605713\", [8, 128], [8, 1, 1, 128]]", "cuda -keys=cuda,gpu -arch=sm_86 -max_num_threads=1024 -thread_warp_size=32", [-1, 16, 64, 49152, 2147483647, 1024, 8, 32], "llvm -keys=cpu ", 0, []], [[], [["CI", 6], ["CI", 5], ["CI", 4], ["CI", 3], ["CI", 2], ["CI", 0], ["FU", 7, [0, 1, 2, 3]], ["SP", 7, 0, 1024, [2], 1], ["AN", 7, 0, 5], ["AN", 7, 1, 6]]]], "r": [[2.12539e-06, 2.12603e-06, 2.12555e-06], 0, 1.24794, 1674960851], "v": "v0.6"}
{"i": [["[\"75ed1f5e5423e4a4b19531a791605713\", [8, 128], [8, 1, 1, 128]]", "cuda -keys=cuda,gpu -arch=sm_86 -max_num_threads=1024 -thread_warp_size=32", [-1, 16, 64, 49152, 2147483647, 1024, 8, 32], "llvm -keys=cpu ", 0, []], [[], [["CI", 6], ["CI", 5], ["CI", 4], ["CI", 3], ["CI", 2], ["CI", 0], ["FU", 7, [0, 1, 2, 3]], ["SP", 7, 0, 1024, [32], 1], ["AN", 7, 0, 5], ["AN", 7, 1, 6]]]], "r": [[1.99352e-06, 2.01042e-06, 2.0303e-06], 0, 1.74284, 1674960853], "v": "v0.6"}
{"i": [["[\"75ed1f5e5423e4a4b19531a791605713\", [8, 128], [8, 1, 1, 128]]", "cuda -keys=cuda,gpu -arch=sm_86 -max_num_threads=1024 -thread_warp_size=32", [-1, 16, 64, 49152, 2147483647, 1024, 8, 32], "llvm -keys=cpu ", 0, []], [[], [["CI", 6], ["CI", 5], ["CI", 4], ["CI", 3], ["CI", 2], ["CI", 0], ["FU", 7, [0, 1, 2, 3]], ["SP", 7, 0, 1024, [8], 1], ["AN", 7, 0, 5], ["AN", 7, 1, 6]]]], "r": [[2.03691e-06, 2.04104e-06, 2.07399e-06], 0, 1.74475, 1674960854], "v": "v0.6"}
{"i": [["[\"75ed1f5e5423e4a4b19531a791605713\", [8, 128], [8, 1, 1, 128]]", "cuda -keys=cuda,gpu -arch=sm_86 -max_num_threads=1024 -thread_warp_size=32", [-1, 16, 64, 49152, 2147483647, 1024, 8, 32], "llvm -keys=cpu ", 0, []], [[], [["CI", 6], ["CI", 5], ["CI", 4], ["CI", 3], ["CI", 2], ["CI", 0], ["FU", 7, [0, 1, 2, 3]], ["SP", 7, 0, 1024, [4], 1], ["AN", 7, 0, 5], ["AN", 7, 1, 6]]]], "r": [[2.01146e-06, 2.00938e-06, 2.03875e-06], 0, 1.73927, 1674960856], "v": "v0.6"}
{"i": [["[\"75ed1f5e5423e4a4b19531a791605713\", [8, 128], [8, 1, 1, 128]]", "cuda -keys=cuda,gpu -arch=sm_86 -max_num_threads=1024 -thread_warp_size=32", [-1, 16, 64, 49152, 2147483647, 1024, 8, 32], "llvm -keys=cpu ", 0, []], [[], [["CI", 6], ["CI", 5], ["CI", 4], ["CI", 3], ["CI", 2], ["CI", 0], ["FU", 7, [0, 1, 2, 3]], ["SP", 7, 0, 1024, [64], 1], ["AN", 7, 0, 5], ["AN", 7, 1, 6]]]], "r": [[2.05362e-06, 2.03202e-06, 2.0426e-06], 0, 1.63697, 1674960857], "v": "v0.6"}
{"i": [["[\"75ed1f5e5423e4a4b19531a791605713\", [8, 128], [8, 1, 1, 128]]", "cuda -keys=cuda,gpu -arch=sm_86 -max_num_threads=1024 -thread_warp_size=32", [-1, 16, 64, 49152, 2147483647, 1024, 8, 32], "llvm -keys=cpu ", 0, []], [[], [["CI", 6], ["CI", 5], ["CI", 4], ["CI", 3], ["CI", 2], ["CI", 0], ["FU", 7, [0, 1, 2, 3]], ["SP", 7, 0, 1024, [16], 1], ["AN", 7, 0, 5], ["AN", 7, 1, 6]]]], "r": [[2.04112e-06, 2.04195e-06, 2.03704e-06], 0, 1.72923, 1674960859], "v": "v0.6"}
{"i": [["[\"21e5ddedea0fedf71d0c8d816af8d608\", [1024, 1024], [1024], [128, 128, 64]]", "cuda -keys=cuda,gpu -arch=sm_86 -max_num_threads=1024 -thread_warp_size=32", [-1, 16, 64, 49152, 2147483647, 1024, 8, 32], "llvm -keys=cpu ", 0, []], [[], [["CI", 5], ["CI", 4], ["CI", 3], ["CI", 1], ["FU", 6, [0, 1, 2]], ["SP", 6, 0, 1048576, [4], 1], ["AN", 6, 0, 5], ["AN", 6, 1, 6]]]], "r": [[0.000185759, 0.000185769, 0.000185766], 0, 1.85561, 1674961034], "v": "v0.6"}
{"i": [["[\"21e5ddedea0fedf71d0c8d816af8d608\", [1024, 1024], [1024], [128, 128, 64]]", "cuda -keys=cuda,gpu -arch=sm_86 -max_num_threads=1024 -thread_warp_size=32", [-1, 16, 64, 49152, 2147483647, 1024, 8, 32], "llvm -keys=cpu ", 0, []], [[], [["CI", 5], ["CI", 4], ["CI", 3], ["CI", 1], ["FU", 6, [0, 1, 2]], ["SP", 6, 0, 1048576, [8], 1], ["AN", 6, 0, 5], ["AN", 6, 1, 6]]]], "r": [[9.38071e-05, 9.38056e-05, 9.38032e-05], 0, 1.85776, 1674961035], "v": "v0.6"}
{"i": [["[\"21e5ddedea0fedf71d0c8d816af8d608\", [1024, 1024], [1024], [128, 128, 64]]", "cuda -keys=cuda,gpu -arch=sm_86 -max_num_threads=1024 -thread_warp_size=32", [-1, 16, 64, 49152, 2147483647, 1024, 8, 32], "llvm -keys=cpu ", 0, []], [[], [["CI", 5], ["CI", 4], ["CI", 3], ["CI", 1], ["FU", 6, [0, 1, 2]], ["SP", 6, 0, 1048576, [16], 1], ["AN", 6, 0, 5], ["AN", 6, 1, 6]]]], "r": [[4.77381e-05, 4.77375e-05, 4.77358e-05], 0, 1.82706, 1674961037], "v": "v0.6"}
{"i": [["[\"21e5ddedea0fedf71d0c8d816af8d608\", [1024, 1024], [1024], [128, 128, 64]]", "cuda -keys=cuda,gpu -arch=sm_86 -max_num_threads=1024 -thread_warp_size=32", [-1, 16, 64, 49152, 2147483647, 1024, 8, 32], "llvm -keys=cpu ", 0, []], [[], [["CI", 5], ["CI", 4], ["CI", 3], ["CI", 1], ["FU", 6, [0, 1, 2]], ["SP", 6, 0, 1048576, [32], 1], ["AN", 6, 0, 5], ["AN", 6, 1, 6]]]], "r": [[2.48853e-05, 2.48861e-05, 2.48876e-05], 0, 1.81112, 1674961039], "v": "v0.6"}
{"i": [["[\"21e5ddedea0fedf71d0c8d816af8d608\", [1024, 1024], [1024], [128, 128, 64]]", "cuda -keys=cuda,gpu -arch=sm_86 -max_num_threads=1024 -thread_warp_size=32", [-1, 16, 64, 49152, 2147483647, 1024, 8, 32], "llvm -keys=cpu ", 0, []], [[], [["CI", 5], ["CI", 4], ["CI", 3], ["CI", 1], ["FU", 6, [0, 1, 2]], ["SP", 6, 0, 1048576, [2], 1], ["AN", 6, 0, 5], ["AN", 6, 1, 6]]]], "r": [[0.000369725, 0.000369726, 0.000369725], 0, 1.86594, 1674961040], "v": "v0.6"}
{"i": [["[\"21e5ddedea0fedf71d0c8d816af8d608\", [1024, 1024], [1024], [128, 128, 64]]", "cuda -keys=cuda,gpu -arch=sm_86 -max_num_threads=1024 -thread_warp_size=32", [-1, 16, 64, 49152, 2147483647, 1024, 8, 32], "llvm -keys=cpu ", 0, []], [[], [["CI", 5], ["CI", 4], ["CI", 3], ["CI", 1], ["FU", 6, [0, 1, 2]], ["SP", 6, 0, 1048576, [64], 1], ["AN", 6, 0, 5], ["AN", 6, 1, 6]]]], "r": [[1.34396e-05, 1.34463e-05, 1.34472e-05], 0, 1.74853, 1674961042], "v": "v0.6"}
{"i": [["[\"21e5ddedea0fedf71d0c8d816af8d608\", [1024, 1024], [1024], [128, 128, 64]]", "cuda -keys=cuda,gpu -arch=sm_86 -max_num_threads=1024 -thread_warp_size=32", [-1, 16, 64, 49152, 2147483647, 1024, 8, 32], "llvm -keys=cpu ", 0, []], [[], [["CI", 5], ["CI", 4], ["CI", 3], ["CI", 1], ["FU", 6, [0, 1, 2]], ["SP", 6, 0, 1048576, [1], 1], ["AN", 6, 0, 5], ["AN", 6, 1, 6]]]], "r": [[0.000737667, 0.000737677, 0.000737687], 0, 1.86255, 1674961043], "v": "v0.6"}
{"i": [["[\"703f3dd209108294904e338b51be9e21\", [1024, 1024], [1024], [8, 128, 1024], [8, 128, 1024]]", "cuda -keys=cuda,gpu -arch=sm_86 -max_num_threads=1024 -thread_warp_size=32", [-1, 16, 64, 49152, 2147483647, 1024, 8, 32], "llvm -keys=cpu ", 0, []], [[], [["CI", 4], ["CI", 3], ["CI", 1], ["FU", 6, [0, 1, 2]], ["SP", 6, 0, 1048576, [1], 1], ["AN", 6, 0, 5], ["AN", 6, 1, 6]]]], "r": [[0.000738356, 0.000738375, 0.000738394], 0, 1.3805, 1674961086], "v": "v0.6"}
{"i": [["[\"703f3dd209108294904e338b51be9e21\", [1024, 1024], [1024], [8, 128, 1024], [8, 128, 1024]]", "cuda -keys=cuda,gpu -arch=sm_86 -max_num_threads=1024 -thread_warp_size=32", [-1, 16, 64, 49152, 2147483647, 1024, 8, 32], "llvm -keys=cpu ", 0, []], [[], [["CI", 4], ["CI", 3], ["CI", 1], ["FU", 6, [0, 1, 2]], ["SP", 6, 0, 1048576, [4], 1], ["AN", 6, 0, 5], ["AN", 6, 1, 6]]]], "r": [[0.000186464, 0.00018647, 0.000186471], 0, 1.93301, 1674961088], "v": "v0.6"}
{"i": [["[\"703f3dd209108294904e338b51be9e21\", [1024, 1024], [1024], [8, 128, 1024], [8, 128, 1024]]", "cuda -keys=cuda,gpu -arch=sm_86 -max_num_threads=1024 -thread_warp_size=32", [-1, 16, 64, 49152, 2147483647, 1024, 8, 32], "llvm -keys=cpu ", 0, []], [[], [["CI", 4], ["CI", 3], ["CI", 1], ["FU", 6, [0, 1, 2]], ["SP", 6, 0, 1048576, [16], 1], ["AN", 6, 0, 5], ["AN", 6, 1, 6]]]], "r": [[4.85529e-05, 4.85736e-05, 4.85685e-05], 0, 1.93847, 1674961089], "v": "v0.6"}
{"i": [["[\"703f3dd209108294904e338b51be9e21\", [1024, 1024], [1024], [8, 128, 1024], [8, 128, 1024]]", "cuda -keys=cuda,gpu -arch=sm_86 -max_num_threads=1024 -thread_warp_size=32", [-1, 16, 64, 49152, 2147483647, 1024, 8, 32], "llvm -keys=cpu ", 0, []], [[], [["CI", 4], ["CI", 3], ["CI", 1], ["FU", 6, [0, 1, 2]], ["SP", 6, 0, 1048576, [64], 1], ["AN", 6, 0, 5], ["AN", 6, 1, 6]]]], "r": [[2.26194e-05, 2.2619e-05, 2.28485e-05], 0, 1.93446, 1674961091], "v": "v0.6"}
{"i": [["[\"703f3dd209108294904e338b51be9e21\", [1024, 1024], [1024], [8, 128, 1024], [8, 128, 1024]]", "cuda -keys=cuda,gpu -arch=sm_86 -max_num_threads=1024 -thread_warp_size=32", [-1, 16, 64, 49152, 2147483647, 1024, 8, 32], "llvm -keys=cpu ", 0, []], [[], [["CI", 4], ["CI", 3], ["CI", 1], ["FU", 6, [0, 1, 2]], ["SP", 6, 0, 1048576, [8], 1], ["AN", 6, 0, 5], ["AN", 6, 1, 6]]]], "r": [[9.44738e-05, 9.44798e-05, 9.4473e-05], 0, 1.92766, 1674961093], "v": "v0.6"}
{"i": [["[\"703f3dd209108294904e338b51be9e21\", [1024, 1024], [1024], [8, 128, 1024], [8, 128, 1024]]", "cuda -keys=cuda,gpu -arch=sm_86 -max_num_threads=1024 -thread_warp_size=32", [-1, 16, 64, 49152, 2147483647, 1024, 8, 32], "llvm -keys=cpu ", 0, []], [[], [["CI", 4], ["CI", 3], ["CI", 1], ["FU", 6, [0, 1, 2]], ["SP", 6, 0, 1048576, [32], 1], ["AN", 6, 0, 5], ["AN", 6, 1, 6]]]], "r": [[2.70853e-05, 2.70813e-05, 2.77633e-05], 0, 1.95849, 1674961094], "v": "v0.6"}
{"i": [["[\"703f3dd209108294904e338b51be9e21\", [1024, 1024], [1024], [8, 128, 1024], [8, 128, 1024]]", "cuda -keys=cuda,gpu -arch=sm_86 -max_num_threads=1024 -thread_warp_size=32", [-1, 16, 64, 49152, 2147483647, 1024, 8, 32], "llvm -keys=cpu ", 0, []], [[], [["CI", 4], ["CI", 3], ["CI", 1], ["FU", 6, [0, 1, 2]], ["SP", 6, 0, 1048576, [2], 1], ["AN", 6, 0, 5], ["AN", 6, 1, 6]]]], "r": [[0.000370448, 0.000370457, 0.000370436], 0, 1.94579, 1674961096], "v": "v0.6"}
{"i": [["[\"47ccd493546f535917d51ad62fac0180\", [8, 1024], [8, 1024]]", "cuda -keys=cuda,gpu -arch=sm_86 -max_num_threads=1024 -thread_warp_size=32", [-1, 16, 64, 49152, 2147483647, 1024, 8, 32], "llvm -keys=cpu ", 0, []], [[], [["FU", 1, [0, 1]], ["SP", 1, 0, 8192, [2], 1], ["AN", 1, 0, 5], ["AN", 1, 1, 6]]]], "r": [[4.67157e-06, 4.67224e-06, 4.67229e-06], 0, 1.46035, 1674961125], "v": "v0.6"}
{"i": [["[\"47ccd493546f535917d51ad62fac0180\", [8, 1024], [8, 1024]]", "cuda -keys=cuda,gpu -arch=sm_86 -max_num_threads=1024 -thread_warp_size=32", [-1, 16, 64, 49152, 2147483647, 1024, 8, 32], "llvm -keys=cpu ", 0, []], [[], [["FU", 1, [0, 1]], ["SP", 1, 0, 8192, [32], 1], ["AN", 1, 0, 5], ["AN", 1, 1, 6]]]], "r": [[1.99832e-06, 1.99842e-06, 1.99845e-06], 0, 1.26833, 1674961126], "v": "v0.6"}
{"i": [["[\"47ccd493546f535917d51ad62fac0180\", [8, 1024], [8, 1024]]", "cuda -keys=cuda,gpu -arch=sm_86 -max_num_threads=1024 -thread_warp_size=32", [-1, 16, 64, 49152, 2147483647, 1024, 8, 32], "llvm -keys=cpu ", 0, []], [[], [["FU", 1, [0, 1]], ["SP", 1, 0, 8192, [4], 1], ["AN", 1, 0, 5], ["AN", 1, 1, 6]]]], "r": [[3.32769e-06, 3.32765e-06, 3.32771e-06], 0, 1.4374, 1674961127], "v": "v0.6"}
{"i": [["[\"47ccd493546f535917d51ad62fac0180\", [8, 1024], [8, 1024]]", "cuda -keys=cuda,gpu -arch=sm_86 -max_num_threads=1024 -thread_warp_size=32", [-1, 16, 64, 49152, 2147483647, 1024, 8, 32], "llvm -keys=cpu ", 0, []], [[], [["FU", 1, [0, 1]], ["SP", 1, 0, 8192, [16], 1], ["AN", 1, 0, 5], ["AN", 1, 1, 6]]]], "r": [[2.16589e-06, 2.16564e-06, 2.16569e-06], 0, 1.28932, 1674961128], "v": "v0.6"}
{"i": [["[\"47ccd493546f535917d51ad62fac0180\", [8, 1024], [8, 1024]]", "cuda -keys=cuda,gpu -arch=sm_86 -max_num_threads=1024 -thread_warp_size=32", [-1, 16, 64, 49152, 2147483647, 1024, 8, 32], "llvm -keys=cpu ", 0, []], [[], [["FU", 1, [0, 1]], ["SP", 1, 0, 8192, [64], 1], ["AN", 1, 0, 5], ["AN", 1, 1, 6]]]], "r": [[2.00048e-06, 2.00051e-06, 2.0006e-06], 0, 1.20853, 1674961129], "v": "v0.6"}
{"i": [["[\"47ccd493546f535917d51ad62fac0180\", [8, 1024], [8, 1024]]", "cuda -keys=cuda,gpu -arch=sm_86 -max_num_threads=1024 -thread_warp_size=32", [-1, 16, 64, 49152, 2147483647, 1024, 8, 32], "llvm -keys=cpu ", 0, []], [[], [["FU", 1, [0, 1]], ["SP", 1, 0, 8192, [8], 1], ["AN", 1, 0, 5], ["AN", 1, 1, 6]]]], "r": [[2.53619e-06, 2.53615e-06, 2.53622e-06], 0, 1.34797, 1674961130], "v": "v0.6"}
{"i": [["[\"47ccd493546f535917d51ad62fac0180\", [8, 1024], [8, 1024]]", "cuda -keys=cuda,gpu -arch=sm_86 -max_num_threads=1024 -thread_warp_size=32", [-1, 16, 64, 49152, 2147483647, 1024, 8, 32], "llvm -keys=cpu ", 0, []], [[], [["FU", 1, [0, 1]], ["SP", 1, 0, 8192, [1], 1], ["AN", 1, 0, 5], ["AN", 1, 1, 6]]]], "r": [[7.55341e-06, 7.55373e-06, 7.55405e-06], 0, 1.54878, 1674961131], "v": "v0.6"}
{"i": [["[\"05ea4bc9dd6b49bd09addb0a73f992ce\", [8, 16, 128, 128], [8, 16, 128, 128]]", "cuda -keys=cuda,gpu -arch=sm_86 -max_num_threads=1024 -thread_warp_size=32", [-1, 16, 64, 49152, 2147483647, 1024, 8, 32], "llvm -keys=cpu ", 0, []], [[], [["SP", 4, 3, 128, [64], 1], ["AN", 4, 4, 6], ["FSP", 3, 3, 0, 1], ["AN", 3, 4, 6], ["CA", 3, 4, 2], ["CI", 2], ["FU", 4, [0, 1, 2]], ["AN", 4, 0, 5], ["FU", 1, [0, 1, 2]], ["SP", 1, 0, 16384, [16], 1], ["AN", 1, 0, 5], ["AN", 1, 1, 6], ["PR", 1, 0, "auto_unroll_max_step$512"], ["PR", 3, 0, "auto_unroll_max_step$64"]]]], "r": [[5.88791e-05, 5.9255e-05, 5.92503e-05], 0, 1.46148, 1674961183], "v": "v0.6"}
{"i": [["[\"05ea4bc9dd6b49bd09addb0a73f992ce\", [8, 16, 128, 128], [8, 16, 128, 128]]", "cuda -keys=cuda,gpu -arch=sm_86 -max_num_threads=1024 -thread_warp_size=32", [-1, 16, 64, 49152, 2147483647, 1024, 8, 32], "llvm -keys=cpu ", 0, []], [[], [["CI", 2], ["FU", 4, [0, 1, 2, 3]], ["SP", 4, 0, 2097152, [1], 1], ["AN", 4, 0, 5], ["AN", 4, 1, 6], ["FU", 3, [0, 1, 2]], ["SP", 3, 0, 16384, [32], 1], ["AN", 3, 0, 5], ["AN", 3, 1, 6], ["FU", 1, [0, 1, 2]], ["SP", 1, 0, 16384, [32], 1], ["AN", 1, 0, 5], ["AN", 1, 1, 6], ["PR", 1, 0, "auto_unroll_max_step$16"], ["PR", 3, 0, "auto_unroll_max_step$16"]]]], "r": [[0.00152915, 0.0015292, 0.00152921], 0, 1.48827, 1674961185], "v": "v0.6"}
{"i": [["[\"05ea4bc9dd6b49bd09addb0a73f992ce\", [8, 16, 128, 128], [8, 16, 128, 128]]", "cuda -keys=cuda,gpu -arch=sm_86 -max_num_threads=1024 -thread_warp_size=32", [-1, 16, 64, 49152, 2147483647, 1024, 8, 32], "llvm -keys=cpu ", 0, []], [[], [["SP", 4, 3, 128, [8], 1], ["AN", 4, 4, 6], ["FSP", 3, 3, 0, 1], ["AN", 3, 4, 6], ["CA", 3, 4, 2], ["CI", 2], ["FSP", 1, 3, 0, 1], ["AN", 1, 4, 6], ["CA", 1, 4, 2], ["FU", 4, [0, 1, 2]], ["AN", 4, 0, 5], ["PR", 1, 0, "auto_unroll_max_step$512"], ["PR", 3, 0, "auto_unroll_max_step$512"]]]], "r": [[4.27016e-05, 4.37362e-05, 4.37391e-05], 0, 1.53774, 1674961186], "v": "v0.6"}
{"i": [["[\"05ea4bc9dd6b49bd09addb0a73f992ce\", [8, 16, 128, 128], [8, 16, 128, 128]]", "cuda -keys=cuda,gpu -arch=sm_86 -max_num_threads=1024 -thread_warp_size=32", [-1, 16, 64, 49152, 2147483647, 1024, 8, 32], "llvm -keys=cpu ", 0, []], [[], [["SP", 4, 3, 128, [1], 1], ["AN", 4, 4, 6], ["FSP", 3, 3, 0, 1], ["AN", 3, 4, 6], ["CA", 3, 4, 2], ["CI", 2], ["FU", 4, [0, 1, 2]], ["AN", 4, 0, 5], ["FU", 1, [0, 1, 2]], ["SP", 1, 0, 16384, [32], 1], ["AN", 1, 0, 5], ["AN", 1, 1, 6], ["PR", 1, 0, "auto_unroll_max_step$0"], ["PR", 3, 0, "auto_unroll_max_step$1024"]]]], "r": [[0.00026363, 0.000268942, 0.000269521], 0, 1.72434, 1674961187], "v": "v0.6"}
{"i": [["[\"05ea4bc9dd6b49bd09addb0a73f992ce\", [8, 16, 128, 128], [8, 16, 128, 128]]", "cuda -keys=cuda,gpu -arch=sm_86 -max_num_threads=1024 -thread_warp_size=32", [-1, 16, 64, 49152, 2147483647, 1024, 8, 32], "llvm -keys=cpu ", 0, []], [[], [["CI", 2], ["SP", 1, 3, 128, [1], 1], ["AN", 1, 4, 6], ["FU", 4, [0, 1, 2, 3]], ["SP", 4, 0, 2097152, [8], 1], ["AN", 4, 0, 5], ["AN", 4, 1, 6], ["FU", 3, [0, 1, 2]], ["SP", 3, 0, 16384, [32], 1], ["AN", 3, 0, 5], ["AN", 3, 1, 6], ["FU", 1, [0, 1, 2]], ["AN", 1, 0, 5], ["PR", 1, 0, "auto_unroll_max_step$1024"], ["PR", 3, 0, "auto_unroll_max_step$1024"]]]], "r": [[0.000281156, 0.000281098, 0.000281124], 0, 2.02767, 1674961189], "v": "v0.6"}
{"i": [["[\"05ea4bc9dd6b49bd09addb0a73f992ce\", [8, 16, 128, 128], [8, 16, 128, 128]]", "cuda -keys=cuda,gpu -arch=sm_86 -max_num_threads=1024 -thread_warp_size=32", [-1, 16, 64, 49152, 2147483647, 1024, 8, 32], "llvm -keys=cpu ", 0, []], [[], [["CI", 2], ["SP", 1, 3, 128, [32], 1], ["AN", 1, 4, 6], ["FU", 4, [0, 1, 2, 3]], ["SP", 4, 0, 2097152, [1], 1], ["AN", 4, 0, 5], ["AN", 4, 1, 6], ["FU", 3, [0, 1, 2]], ["SP", 3, 0, 16384, [1], 1], ["AN", 3, 0, 5], ["AN", 3, 1, 6], ["FU", 1, [0, 1, 2]], ["AN", 1, 0, 5], ["PR", 1, 0, "auto_unroll_max_step$16"], ["PR", 3, 0, "auto_unroll_max_step$1024"]]]], "r": [[0.00156945, 0.00156944, 0.00156943], 0, 1.47865, 1674961190], "v": "v0.6"}
{"i": [["[\"05ea4bc9dd6b49bd09addb0a73f992ce\", [8, 16, 128, 128], [8, 16, 128, 128]]", "cuda -keys=cuda,gpu -arch=sm_86 -max_num_threads=1024 -thread_warp_size=32", [-1, 16, 64, 49152, 2147483647, 1024, 8, 32], "llvm -keys=cpu ", 0, []], [[], [["SP", 4, 3, 128, [8], 1], ["AN", 4, 4, 6], ["FSP", 3, 3, 0, 1], ["AN", 3, 4, 6], ["CA", 3, 4, 2], ["CI", 2], ["FSP", 1, 3, 0, 1], ["AN", 1, 4, 6], ["CA", 1, 4, 2], ["FU", 4, [0, 1, 2]], ["AN", 4, 0, 5], ["PR", 1, 0, "auto_unroll_max_step$16"], ["PR", 3, 0, "auto_unroll_max_step$64"]]]], "r": [[4.29373e-05, 4.37215e-05, 4.37252e-05], 0, 1.54408, 1674961191], "v": "v0.6"}
{"i": [["[\"05ea4bc9dd6b49bd09addb0a73f992ce\", [8, 16, 128, 128], [8, 16, 128, 128]]", "cuda -keys=cuda,gpu -arch=sm_86 -max_num_threads=1024 -thread_warp_size=32", [-1, 16, 64, 49152, 2147483647, 1024, 8, 32], "llvm -keys=cpu ", 0, []], [[], [["SP", 4, 3, 128, [32], 1], ["AN", 4, 4, 6], ["FSP", 3, 3, 0, 1], ["AN", 3, 4, 6], ["CA", 3, 4, 2], ["CI", 2], ["FU", 4, [0, 1, 2]], ["AN", 4, 0, 5], ["FU", 1, [0, 1, 2]], ["SP", 1, 0, 16384, [32], 1], ["AN", 1, 0, 5], ["AN", 1, 1, 6], ["PR", 1, 0, "auto_unroll_max_step$64"], ["PR", 3, 0, "auto_unroll_max_step$64"]]]], "r": [[6.03812e-05, 6.0382e-05, 6.09776e-05], 0, 2.03582, 1674961193], "v": "v0.6"}
{"i": [["[\"05ea4bc9dd6b49bd09addb0a73f992ce\", [8, 16, 128, 128], [8, 16, 128, 128]]", "cuda -keys=cuda,gpu -arch=sm_86 -max_num_threads=1024 -thread_warp_size=32", [-1, 16, 64, 49152, 2147483647, 1024, 8, 32], "llvm -keys=cpu ", 0, []], [[], [["CI", 2], ["FU", 4, [0, 1, 2, 3]], ["SP", 4, 0, 2097152, [8], 1], ["AN", 4, 0, 5], ["AN", 4, 1, 6], ["FU", 3, [0, 1, 2]], ["SP", 3, 0, 16384, [32], 1], ["AN", 3, 0, 5], ["AN", 3, 1, 6], ["FU", 1, [0, 1, 2]], ["SP", 1, 0, 16384, [32], 1], ["AN", 1, 0, 5], ["AN", 1, 1, 6], ["PR", 1, 0, "auto_unroll_max_step$64"], ["PR", 3, 0, "auto_unroll_max_step$64"]]]], "r": [[0.000270987, 0.000270964, 0.000270934], 0, 2.03419, 1674961195], "v": "v0.6"}
{"i": [["[\"05ea4bc9dd6b49bd09addb0a73f992ce\", [8, 16, 128, 128], [8, 16, 128, 128]]", "cuda -keys=cuda,gpu -arch=sm_86 -max_num_threads=1024 -thread_warp_size=32", [-1, 16, 64, 49152, 2147483647, 1024, 8, 32], "llvm -keys=cpu ", 0, []], [[], [["SP", 4, 3, 128, [16], 1], ["AN", 4, 4, 6], ["FSP", 3, 3, 0, 1], ["AN", 3, 4, 6], ["CA", 3, 4, 2], ["CI", 2], ["FU", 4, [0, 1, 2]], ["AN", 4, 0, 5], ["FU", 1, [0, 1, 2]], ["SP", 1, 0, 16384, [64], 1], ["AN", 1, 0, 5], ["AN", 1, 1, 6], ["PR", 1, 0, "auto_unroll_max_step$64"], ["PR", 3, 0, "auto_unroll_max_step$64"]]]], "r": [[6.15683e-05, 6.21091e-05, 6.19159e-05], 0, 1.52687, 1674961196], "v": "v0.6"}
{"i": [["[\"05ea4bc9dd6b49bd09addb0a73f992ce\", [8, 16, 128, 128], [8, 16, 128, 128]]", "cuda -keys=cuda,gpu -arch=sm_86 -max_num_threads=1024 -thread_warp_size=32", [-1, 16, 64, 49152, 2147483647, 1024, 8, 32], "llvm -keys=cpu ", 0, []], [[], [["SP", 4, 3, 128, [32], 1], ["AN", 4, 4, 6], ["FSP", 3, 3, 0, 1], ["AN", 3, 4, 6], ["CA", 3, 4, 2], ["CI", 2], ["FU", 4, [0, 1, 2]], ["AN", 4, 0, 5], ["FU", 1, [0, 1, 2]], ["SP", 1, 0, 16384, [64], 1], ["AN", 1, 0, 5], ["AN", 1, 1, 6], ["PR", 1, 0, "auto_unroll_max_step$512"], ["PR", 3, 0, "auto_unroll_max_step$64"]]]], "r": [[6.17449e-05, 6.17542e-05, 6.24534e-05], 0, 2.07251, 1674961197], "v": "v0.6"}
{"i": [["[\"05ea4bc9dd6b49bd09addb0a73f992ce\", [8, 16, 128, 128], [8, 16, 128, 128]]", "cuda -keys=cuda,gpu -arch=sm_86 -max_num_threads=1024 -thread_warp_size=32", [-1, 16, 64, 49152, 2147483647, 1024, 8, 32], "llvm -keys=cpu ", 0, []], [[], [["SP", 4, 3, 128, [8], 1], ["AN", 4, 4, 6], ["FSP", 3, 3, 0, 1], ["AN", 3, 4, 6], ["CA", 3, 4, 2], ["CI", 2], ["FU", 4, [0, 1, 2]], ["AN", 4, 0, 5], ["FU", 1, [0, 1, 2]], ["SP", 1, 0, 16384, [32], 1], ["AN", 1, 0, 5], ["AN", 1, 1, 6], ["PR", 1, 0, "auto_unroll_max_step$16"], ["PR", 3, 0, "auto_unroll_max_step$512"]]]], "r": [[6.5144e-05, 6.58688e-05, 6.56781e-05], 0, 1.4954, 1674961199], "v": "v0.6"}
{"i": [["[\"05ea4bc9dd6b49bd09addb0a73f992ce\", [8, 16, 128, 128], [8, 16, 128, 128]]", "cuda -keys=cuda,gpu -arch=sm_86 -max_num_threads=1024 -thread_warp_size=32", [-1, 16, 64, 49152, 2147483647, 1024, 8, 32], "llvm -keys=cpu ", 0, []], [[], [["CI", 2], ["SP", 1, 3, 128, [32], 1], ["AN", 1, 4, 6], ["FU", 4, [0, 1, 2, 3]], ["SP", 4, 0, 2097152, [32], 1], ["AN", 4, 0, 5], ["AN", 4, 1, 6], ["FU", 3, [0, 1, 2]], ["SP", 3, 0, 16384, [32], 1], ["AN", 3, 0, 5], ["AN", 3, 1, 6], ["FU", 1, [0, 1, 2]], ["AN", 1, 0, 5], ["PR", 1, 0, "auto_unroll_max_step$0"], ["PR", 3, 0, "auto_unroll_max_step$64"]]]], "r": [[0.000103018, 0.000103468, 0.000103432], 0, 1.46849, 1674961200], "v": "v0.6"}
{"i": [["[\"05ea4bc9dd6b49bd09addb0a73f992ce\", [8, 16, 128, 128], [8, 16, 128, 128]]", "cuda -keys=cuda,gpu -arch=sm_86 -max_num_threads=1024 -thread_warp_size=32", [-1, 16, 64, 49152, 2147483647, 1024, 8, 32], "llvm -keys=cpu ", 0, []], [[], [["CI", 2], ["SP", 1, 3, 128, [32], 1], ["AN", 1, 4, 6], ["FU", 4, [0, 1, 2, 3]], ["SP", 4, 0, 2097152, [1], 1], ["AN", 4, 0, 5], ["AN", 4, 1, 6], ["FU", 3, [0, 1, 2]], ["SP", 3, 0, 16384, [32], 1], ["AN", 3, 0, 5], ["AN", 3, 1, 6], ["FU", 1, [0, 1, 2]], ["AN", 1, 0, 5], ["PR", 1, 0, "auto_unroll_max_step$512"], ["PR", 3, 0, "auto_unroll_max_step$0"]]]], "r": [[0.00151871, 0.00151875, 0.00151871], 0, 1.46813, 1674961201], "v": "v0.6"}
{"i": [["[\"05ea4bc9dd6b49bd09addb0a73f992ce\", [8, 16, 128, 128], [8, 16, 128, 128]]", "cuda -keys=cuda,gpu -arch=sm_86 -max_num_threads=1024 -thread_warp_size=32", [-1, 16, 64, 49152, 2147483647, 1024, 8, 32], "llvm -keys=cpu ", 0, []], [[], [["CI", 2], ["SP", 1, 3, 128, [8], 1], ["AN", 1, 4, 6], ["FU", 4, [0, 1, 2, 3]], ["SP", 4, 0, 2097152, [32], 1], ["AN", 4, 0, 5], ["AN", 4, 1, 6], ["FU", 3, [0, 1, 2]], ["SP", 3, 0, 16384, [8], 1], ["AN", 3, 0, 5], ["AN", 3, 1, 6], ["FU", 1, [0, 1, 2]], ["AN", 1, 0, 5], ["PR", 1, 0, "auto_unroll_max_step$16"], ["PR", 3, 0, "auto_unroll_max_step$1024"]]]], "r": [[0.000106044, 0.000106653, 0.000106655], 0, 1.46856, 1674961202], "v": "v0.6"}
{"i": [["[\"05ea4bc9dd6b49bd09addb0a73f992ce\", [8, 16, 128, 128], [8, 16, 128, 128]]", "cuda -keys=cuda,gpu -arch=sm_86 -max_num_threads=1024 -thread_warp_size=32", [-1, 16, 64, 49152, 2147483647, 1024, 8, 32], "llvm -keys=cpu ", 0, []], [[], [["CI", 2], ["FU", 4, [0, 1, 2, 3]], ["SP", 4, 0, 2097152, [2], 1], ["AN", 4, 0, 5], ["AN", 4, 1, 6], ["FU", 3, [0, 1, 2]], ["SP", 3, 0, 16384, [32], 1], ["AN", 3, 0, 5], ["AN", 3, 1, 6], ["FU", 1, [0, 1, 2]], ["SP", 1, 0, 16384, [64], 1], ["AN", 1, 0, 5], ["AN", 1, 1, 6], ["PR", 1, 0, "auto_unroll_max_step$64"], ["PR", 3, 0, "auto_unroll_max_step$64"]]]], "r": [[0.000794531, 0.000794571, 0.000794549], 0, 1.47095, 1674961203], "v": "v0.6"}
{"i": [["[\"05ea4bc9dd6b49bd09addb0a73f992ce\", [8, 16, 128, 128], [8, 16, 128, 128]]", "cuda -keys=cuda,gpu -arch=sm_86 -max_num_threads=1024 -thread_warp_size=32", [-1, 16, 64, 49152, 2147483647, 1024, 8, 32], "llvm -keys=cpu ", 0, []], [[], [["SP", 4, 3, 128, [32], 1], ["AN", 4, 4, 6], ["FSP", 3, 3, 0, 1], ["AN", 3, 4, 6], ["CA", 3, 4, 2], ["CI", 2], ["FU", 4, [0, 1, 2]], ["AN", 4, 0, 5], ["FU", 1, [0, 1, 2]], ["SP", 1, 0, 16384, [64], 1], ["AN", 1, 0, 5], ["AN", 1, 1, 6], ["PR", 1, 0, "auto_unroll_max_step$0"], ["PR", 3, 0, "auto_unroll_max_step$512"]]]], "r": [[6.17606e-05, 6.17593e-05, 6.28941e-05], 0, 2.09286, 1674961205], "v": "v0.6"}
{"i": [["[\"05ea4bc9dd6b49bd09addb0a73f992ce\", [8, 16, 128, 128], [8, 16, 128, 128]]", "cuda -keys=cuda,gpu -arch=sm_86 -max_num_threads=1024 -thread_warp_size=32", [-1, 16, 64, 49152, 2147483647, 1024, 8, 32], "llvm -keys=cpu ", 0, []], [[], [["CI", 2], ["FU", 4, [0, 1, 2, 3]], ["SP", 4, 0, 2097152, [64], 1], ["AN", 4, 0, 5], ["AN", 4, 1, 6], ["FU", 3, [0, 1, 2]], ["SP", 3, 0, 16384, [64], 1], ["AN", 3, 0, 5], ["AN", 3, 1, 6], ["FU", 1, [0, 1, 2]], ["SP", 1, 0, 16384, [8], 1], ["AN", 1, 0, 5], ["AN", 1, 1, 6], ["PR", 1, 0, "auto_unroll_max_step$512"], ["PR", 3, 0, "auto_unroll_max_step$1024"]]]], "r": [[8.71077e-05, 8.80946e-05, 8.77872e-05], 0, 1.498, 1674961206], "v": "v0.6"}
{"i": [["[\"05ea4bc9dd6b49bd09addb0a73f992ce\", [8, 16, 128, 128], [8, 16, 128, 128]]", "cuda -keys=cuda,gpu -arch=sm_86 -max_num_threads=1024 -thread_warp_size=32", [-1, 16, 64, 49152, 2147483647, 1024, 8, 32], "llvm -keys=cpu ", 0, []], [[], [["SP", 4, 3, 128, [32], 1], ["AN", 4, 4, 6], ["FSP", 3, 3, 0, 1], ["AN", 3, 4, 6], ["CA", 3, 4, 2], ["CI", 2], ["FSP", 1, 3, 0, 1], ["AN", 1, 4, 6], ["CA", 1, 4, 2], ["FU", 4, [0, 1, 2]], ["AN", 4, 0, 5], ["PR", 1, 0, "auto_unroll_max_step$64"], ["PR", 3, 0, "auto_unroll_max_step$512"]]]], "r": [[3.7556e-05, 3.75535e-05, 3.6726e-05], 0, 1.99181, 1674961208], "v": "v0.6"}
{"i": [["[\"05ea4bc9dd6b49bd09addb0a73f992ce\", [8, 16, 128, 128], [8, 16, 128, 128]]", "cuda -keys=cuda,gpu -arch=sm_86 -max_num_threads=1024 -thread_warp_size=32", [-1, 16, 64, 49152, 2147483647, 1024, 8, 32], "llvm -keys=cpu ", 0, []], [[], [["CI", 2], ["SP", 1, 3, 128, [64], 1], ["AN", 1, 4, 6], ["FU", 4, [0, 1, 2, 3]], ["SP", 4, 0, 2097152, [32], 1], ["AN", 4, 0, 5], ["AN", 4, 1, 6], ["FU", 3, [0, 1, 2]], ["SP", 3, 0, 16384, [32], 1], ["AN", 3, 0, 5], ["AN", 3, 1, 6], ["FU", 1, [0, 1, 2]], ["AN", 1, 0, 5], ["PR", 1, 0, "auto_unroll_max_step$16"], ["PR", 3, 0, "auto_unroll_max_step$1024"]]]], "r": [[0.000104078, 0.000104793, 0.000104781], 0, 1.48315, 1674961209], "v": "v0.6"}
{"i": [["[\"05ea4bc9dd6b49bd09addb0a73f992ce\", [8, 16, 128, 128], [8, 16, 128, 128]]", "cuda -keys=cuda,gpu -arch=sm_86 -max_num_threads=1024 -thread_warp_size=32", [-1, 16, 64, 49152, 2147483647, 1024, 8, 32], "llvm -keys=cpu ", 0, []], [[], [["SP", 4, 3, 128, [64], 1], ["AN", 4, 4, 6], ["FSP", 3, 3, 0, 1], ["AN", 3, 4, 6], ["CA", 3, 4, 2], ["CI", 2], ["FU", 4, [0, 1, 2]], ["AN", 4, 0, 5], ["FU", 1, [0, 1, 2]], ["SP", 1, 0, 16384, [64], 1], ["AN", 1, 0, 5], ["AN", 1, 1, 6], ["PR", 1, 0, "auto_unroll_max_step$0"], ["PR", 3, 0, "auto_unroll_max_step$1024"]]]], "r": [[6.22703e-05, 6.27729e-05, 6.27814e-05], 0, 1.4789, 1674961210], "v": "v0.6"}
{"i": [["[\"05ea4bc9dd6b49bd09addb0a73f992ce\", [8, 16, 128, 128], [8, 16, 128, 128]]", "cuda -keys=cuda,gpu -arch=sm_86 -max_num_threads=1024 -thread_warp_size=32", [-1, 16, 64, 49152, 2147483647, 1024, 8, 32], "llvm -keys=cpu ", 0, []], [[], [["CI", 2], ["SP", 1, 3, 128, [32], 1], ["AN", 1, 4, 6], ["FU", 4, [0, 1, 2, 3]], ["SP", 4, 0, 2097152, [2], 1], ["AN", 4, 0, 5], ["AN", 4, 1, 6], ["FU", 3, [0, 1, 2]], ["SP", 3, 0, 16384, [32], 1], ["AN", 3, 0, 5], ["AN", 3, 1, 6], ["FU", 1, [0, 1, 2]], ["AN", 1, 0, 5], ["PR", 1, 0, "auto_unroll_max_step$1024"], ["PR", 3, 0, "auto_unroll_max_step$512"]]]], "r": [[0.000782778, 0.000782762, 0.000782773], 0, 1.51348, 1674961211], "v": "v0.6"}
{"i": [["[\"05ea4bc9dd6b49bd09addb0a73f992ce\", [8, 16, 128, 128], [8, 16, 128, 128]]", "cuda -keys=cuda,gpu -arch=sm_86 -max_num_threads=1024 -thread_warp_size=32", [-1, 16, 64, 49152, 2147483647, 1024, 8, 32], "llvm -keys=cpu ", 0, []], [[], [["SP", 4, 3, 128, [8], 1], ["AN", 4, 4, 6], ["FSP", 3, 3, 0, 1], ["AN", 3, 4, 6], ["CA", 3, 4, 2], ["CI", 2], ["FU", 4, [0, 1, 2]], ["AN", 4, 0, 5], ["FU", 1, [0, 1, 2]], ["SP", 1, 0, 16384, [1], 1], ["AN", 1, 0, 5], ["AN", 1, 1, 6], ["PR", 1, 0, "auto_unroll_max_step$0"], ["PR", 3, 0, "auto_unroll_max_step$1024"]]]], "r": [[8.31902e-05, 8.49323e-05, 8.50072e-05], 0, 1.54944, 1674961213], "v": "v0.6"}
{"i": [["[\"05ea4bc9dd6b49bd09addb0a73f992ce\", [8, 16, 128, 128], [8, 16, 128, 128]]", "cuda -keys=cuda,gpu -arch=sm_86 -max_num_threads=1024 -thread_warp_size=32", [-1, 16, 64, 49152, 2147483647, 1024, 8, 32], "llvm -keys=cpu ", 0, []], [[], [["CI", 2], ["SP", 1, 3, 128, [8], 1], ["AN", 1, 4, 6], ["FU", 4, [0, 1, 2, 3]], ["SP", 4, 0, 2097152, [32], 1], ["AN", 4, 0, 5], ["AN", 4, 1, 6], ["FU", 3, [0, 1, 2]], ["SP", 3, 0, 16384, [32], 1], ["AN", 3, 0, 5], ["AN", 3, 1, 6], ["FU", 1, [0, 1, 2]], ["AN", 1, 0, 5], ["PR", 1, 0, "auto_unroll_max_step$16"], ["PR", 3, 0, "auto_unroll_max_step$512"]]]], "r": [[0.000104071, 0.000104815, 0.000104742], 0, 1.51368, 1674961214], "v": "v0.6"}
{"i": [["[\"05ea4bc9dd6b49bd09addb0a73f992ce\", [8, 16, 128, 128], [8, 16, 128, 128]]", "cuda -keys=cuda,gpu -arch=sm_86 -max_num_threads=1024 -thread_warp_size=32", [-1, 16, 64, 49152, 2147483647, 1024, 8, 32], "llvm -keys=cpu ", 0, []], [[], [["CI", 2], ["SP", 1, 3, 128, [64], 1], ["AN", 1, 4, 6], ["FU", 4, [0, 1, 2, 3]], ["SP", 4, 0, 2097152, [32], 1], ["AN", 4, 0, 5], ["AN", 4, 1, 6], ["FU", 3, [0, 1, 2]], ["SP", 3, 0, 16384, [8], 1], ["AN", 3, 0, 5], ["AN", 3, 1, 6], ["FU", 1, [0, 1, 2]], ["AN", 1, 0, 5], ["PR", 1, 0, "auto_unroll_max_step$0"], ["PR", 3, 0, "auto_unroll_max_step$64"]]]], "r": [[0.000106706, 0.000107449, 0.000107469], 0, 1.53442, 1674961215], "v": "v0.6"}
{"i": [["[\"05ea4bc9dd6b49bd09addb0a73f992ce\", [8, 16, 128, 128], [8, 16, 128, 128]]", "cuda -keys=cuda,gpu -arch=sm_86 -max_num_threads=1024 -thread_warp_size=32", [-1, 16, 64, 49152, 2147483647, 1024, 8, 32], "llvm -keys=cpu ", 0, []], [[], [["SP", 4, 3, 128, [64], 1], ["AN", 4, 4, 6], ["FSP", 3, 3, 0, 1], ["AN", 3, 4, 6], ["CA", 3, 4, 2], ["CI", 2], ["FU", 4, [0, 1, 2]], ["AN", 4, 0, 5], ["FU", 1, [0, 1, 2]], ["SP", 1, 0, 16384, [4], 1], ["AN", 1, 0, 5], ["AN", 1, 1, 6], ["PR", 1, 0, "auto_unroll_max_step$0"], ["PR", 3, 0, "auto_unroll_max_step$1024"]]]], "r": [[5.69732e-05, 5.74047e-05, 5.7274e-05], 0, 1.5328, 1674961216], "v": "v0.6"}
{"i": [["[\"05ea4bc9dd6b49bd09addb0a73f992ce\", [8, 16, 128, 128], [8, 16, 128, 128]]", "cuda -keys=cuda,gpu -arch=sm_86 -max_num_threads=1024 -thread_warp_size=32", [-1, 16, 64, 49152, 2147483647, 1024, 8, 32], "llvm -keys=cpu ", 0, []], [[], [["SP", 4, 3, 128, [64], 1], ["AN", 4, 4, 6], ["FSP", 3, 3, 0, 1], ["AN", 3, 4, 6], ["CA", 3, 4, 2], ["CI", 2], ["FU", 4, [0, 1, 2]], ["AN", 4, 0, 5], ["FU", 1, [0, 1, 2]], ["SP", 1, 0, 16384, [64], 1], ["AN", 1, 0, 5], ["AN", 1, 1, 6], ["PR", 1, 0, "auto_unroll_max_step$64"], ["PR", 3, 0, "auto_unroll_max_step$512"]]]], "r": [[6.23284e-05, 6.28045e-05, 6.28237e-05], 0, 1.49798, 1674961217], "v": "v0.6"}
{"i": [["[\"05ea4bc9dd6b49bd09addb0a73f992ce\", [8, 16, 128, 128], [8, 16, 128, 128]]", "cuda -keys=cuda,gpu -arch=sm_86 -max_num_threads=1024 -thread_warp_size=32", [-1, 16, 64, 49152, 2147483647, 1024, 8, 32], "llvm -keys=cpu ", 0, []], [[], [["SP", 4, 3, 128, [4], 1], ["AN", 4, 4, 6], ["FSP", 3, 3, 0, 1], ["AN", 3, 4, 6], ["CA", 3, 4, 2], ["CI", 2], ["FU", 4, [0, 1, 2]], ["AN", 4, 0, 5], ["FU", 1, [0, 1, 2]], ["SP", 1, 0, 16384, [32], 1], ["AN", 1, 0, 5], ["AN", 1, 1, 6], ["PR", 1, 0, "auto_unroll_max_step$512"], ["PR", 3, 0, "auto_unroll_max_step$1024"]]]], "r": [[7.95772e-05, 8.15764e-05, 8.16562e-05], 0, 1.6095, 1674961218], "v": "v0.6"}
{"i": [["[\"05ea4bc9dd6b49bd09addb0a73f992ce\", [8, 16, 128, 128], [8, 16, 128, 128]]", "cuda -keys=cuda,gpu -arch=sm_86 -max_num_threads=1024 -thread_warp_size=32", [-1, 16, 64, 49152, 2147483647, 1024, 8, 32], "llvm -keys=cpu ", 0, []], [[], [["CI", 2], ["FU", 4, [0, 1, 2, 3]], ["SP", 4, 0, 2097152, [32], 1], ["AN", 4, 0, 5], ["AN", 4, 1, 6], ["FU", 3, [0, 1, 2]], ["SP", 3, 0, 16384, [32], 1], ["AN", 3, 0, 5], ["AN", 3, 1, 6], ["FU", 1, [0, 1, 2]], ["SP", 1, 0, 16384, [1], 1], ["AN", 1, 0, 5], ["AN", 1, 1, 6], ["PR", 1, 0, "auto_unroll_max_step$512"], ["PR", 3, 0, "auto_unroll_max_step$64"]]]], "r": [[0.000127598, 0.000129179, 0.000129176], 0, 1.55624, 1674961220], "v": "v0.6"}
{"i": [["[\"05ea4bc9dd6b49bd09addb0a73f992ce\", [8, 16, 128, 128], [8, 16, 128, 128]]", "cuda -keys=cuda,gpu -arch=sm_86 -max_num_threads=1024 -thread_warp_size=32", [-1, 16, 64, 49152, 2147483647, 1024, 8, 32], "llvm -keys=cpu ", 0, []], [[], [["CI", 2], ["SP", 1, 3, 128, [8], 1], ["AN", 1, 4, 6], ["FU", 4, [0, 1, 2, 3]], ["SP", 4, 0, 2097152, [32], 1], ["AN", 4, 0, 5], ["AN", 4, 1, 6], ["FU", 3, [0, 1, 2]], ["SP", 3, 0, 16384, [32], 1], ["AN", 3, 0, 5], ["AN", 3, 1, 6], ["FU", 1, [0, 1, 2]], ["AN", 1, 0, 5], ["PR", 1, 0, "auto_unroll_max_step$16"], ["PR", 3, 0, "auto_unroll_max_step$64"]]]], "r": [[0.000104064, 0.000104873, 0.000104867], 0, 1.57502, 1674961221], "v": "v0.6"}
{"i": [["[\"05ea4bc9dd6b49bd09addb0a73f992ce\", [8, 16, 128, 128], [8, 16, 128, 128]]", "cuda -keys=cuda,gpu -arch=sm_86 -max_num_threads=1024 -thread_warp_size=32", [-1, 16, 64, 49152, 2147483647, 1024, 8, 32], "llvm -keys=cpu ", 0, []], [[], [["SP", 4, 3, 128, [32], 1], ["AN", 4, 4, 6], ["FSP", 3, 3, 0, 1], ["AN", 3, 4, 6], ["CA", 3, 4, 2], ["CI", 2], ["FU", 4, [0, 1, 2]], ["AN", 4, 0, 5], ["FU", 1, [0, 1, 2]], ["SP", 1, 0, 16384, [32], 1], ["AN", 1, 0, 5], ["AN", 1, 1, 6], ["PR", 1, 0, "auto_unroll_max_step$64"], ["PR", 3, 0, "auto_unroll_max_step$0"]]]], "r": [[6.0493e-05, 6.04967e-05, 6.13565e-05], 0, 2.12465, 1674961223], "v": "v0.6"}
{"i": [["[\"05ea4bc9dd6b49bd09addb0a73f992ce\", [8, 16, 128, 128], [8, 16, 128, 128]]", "cuda -keys=cuda,gpu -arch=sm_86 -max_num_threads=1024 -thread_warp_size=32", [-1, 16, 64, 49152, 2147483647, 1024, 8, 32], "llvm -keys=cpu ", 0, []], [[], [["CI", 2], ["SP", 1, 3, 128, [2], 1], ["AN", 1, 4, 6], ["FU", 4, [0, 1, 2, 3]], ["SP", 4, 0, 2097152, [64], 1], ["AN", 4, 0, 5], ["AN", 4, 1, 6], ["FU", 3, [0, 1, 2]], ["SP", 3, 0, 16384, [4], 1], ["AN", 3, 0, 5], ["AN", 3, 1, 6], ["FU", 1, [0, 1, 2]], ["AN", 1, 0, 5], ["PR", 1, 0, "auto_unroll_max_step$1024"], ["PR", 3, 0, "auto_unroll_max_step$512"]]]], "r": [[9.36336e-05, 9.50843e-05, 9.46549e-05], 0, 1.51317, 1674961224], "v": "v0.6"}
{"i": [["[\"05ea4bc9dd6b49bd09addb0a73f992ce\", [8, 16, 128, 128], [8, 16, 128, 128]]", "cuda -keys=cuda,gpu -arch=sm_86 -max_num_threads=1024 -thread_warp_size=32", [-1, 16, 64, 49152, 2147483647, 1024, 8, 32], "llvm -keys=cpu ", 0, []], [[], [["SP", 4, 3, 128, [2], 1], ["AN", 4, 4, 6], ["FSP", 3, 3, 0, 1], ["AN", 3, 4, 6], ["CA", 3, 4, 2], ["CI", 2], ["FU", 4, [0, 1, 2]], ["AN", 4, 0, 5], ["FU", 1, [0, 1, 2]], ["SP", 1, 0, 16384, [1], 1], ["AN", 1, 0, 5], ["AN", 1, 1, 6], ["PR", 1, 0, "auto_unroll_max_step$64"], ["PR", 3, 0, "auto_unroll_max_step$1024"]]]], "r": [[0.000175596, 0.000179305, 0.00017937], 0, 1.65857, 1674961225], "v": "v0.6"}
{"i": [["[\"05ea4bc9dd6b49bd09addb0a73f992ce\", [8, 16, 128, 128], [8, 16, 128, 128]]", "cuda -keys=cuda,gpu -arch=sm_86 -max_num_threads=1024 -thread_warp_size=32", [-1, 16, 64, 49152, 2147483647, 1024, 8, 32], "llvm -keys=cpu ", 0, []], [[], [["SP", 4, 3, 128, [1], 1], ["AN", 4, 4, 6], ["FSP", 3, 3, 0, 1], ["AN", 3, 4, 6], ["CA", 3, 4, 2], ["CI", 2], ["FU", 4, [0, 1, 2]], ["AN", 4, 0, 5], ["FU", 1, [0, 1, 2]], ["SP", 1, 0, 16384, [64], 1], ["AN", 1, 0, 5], ["AN", 1, 1, 6], ["PR", 1, 0, "auto_unroll_max_step$0"], ["PR", 3, 0, "auto_unroll_max_step$1024"]]]], "r": [[0.000267949, 0.000274252, 0.000274265], 0, 1.71087, 1674961226], "v": "v0.6"}
{"i": [["[\"05ea4bc9dd6b49bd09addb0a73f992ce\", [8, 16, 128, 128], [8, 16, 128, 128]]", "cuda -keys=cuda,gpu -arch=sm_86 -max_num_threads=1024 -thread_warp_size=32", [-1, 16, 64, 49152, 2147483647, 1024, 8, 32], "llvm -keys=cpu ", 0, []], [[], [["SP", 4, 3, 128, [64], 1], ["AN", 4, 4, 6], ["FSP", 3, 3, 0, 1], ["AN", 3, 4, 6], ["CA", 3, 4, 2], ["CI", 2], ["FU", 4, [0, 1, 2]], ["AN", 4, 0, 5], ["FU", 1, [0, 1, 2]], ["SP", 1, 0, 16384, [64], 1], ["AN", 1, 0, 5], ["AN", 1, 1, 6], ["PR", 1, 0, "auto_unroll_max_step$512"], ["PR", 3, 0, "auto_unroll_max_step$0"]]]], "r": [[6.2398e-05, 6.2954e-05, 6.29679e-05], 0, 1.46557, 1674961227], "v": "v0.6"}
{"i": [["[\"05ea4bc9dd6b49bd09addb0a73f992ce\", [8, 16, 128, 128], [8, 16, 128, 128]]", "cuda -keys=cuda,gpu -arch=sm_86 -max_num_threads=1024 -thread_warp_size=32", [-1, 16, 64, 49152, 2147483647, 1024, 8, 32], "llvm -keys=cpu ", 0, []], [[], [["SP", 4, 3, 128, [32], 1], ["AN", 4, 4, 6], ["FSP", 3, 3, 0, 1], ["AN", 3, 4, 6], ["CA", 3, 4, 2], ["CI", 2], ["FU", 4, [0, 1, 2]], ["AN", 4, 0, 5], ["FU", 1, [0, 1, 2]], ["SP", 1, 0, 16384, [64], 1], ["AN", 1, 0, 5], ["AN", 1, 1, 6], ["PR", 1, 0, "auto_unroll_max_step$64"], ["PR", 3, 0, "auto_unroll_max_step$0"]]]], "r": [[6.19416e-05, 6.19102e-05, 6.28674e-05], 0, 2.10866, 1674961229], "v": "v0.6"}
{"i": [["[\"05ea4bc9dd6b49bd09addb0a73f992ce\", [8, 16, 128, 128], [8, 16, 128, 128]]", "cuda -keys=cuda,gpu -arch=sm_86 -max_num_threads=1024 -thread_warp_size=32", [-1, 16, 64, 49152, 2147483647, 1024, 8, 32], "llvm -keys=cpu ", 0, []], [[], [["SP", 4, 3, 128, [64], 1], ["AN", 4, 4, 6], ["FSP", 3, 3, 0, 1], ["AN", 3, 4, 6], ["CA", 3, 4, 2], ["CI", 2], ["FU", 4, [0, 1, 2]], ["AN", 4, 0, 5], ["FU", 1, [0, 1, 2]], ["SP", 1, 0, 16384, [64], 1], ["AN", 1, 0, 5], ["AN", 1, 1, 6], ["PR", 1, 0, "auto_unroll_max_step$512"], ["PR", 3, 0, "auto_unroll_max_step$16"]]]], "r": [[6.24202e-05, 6.294e-05, 6.2964e-05], 0, 1.5657, 1674961230], "v": "v0.6"}
{"i": [["[\"05ea4bc9dd6b49bd09addb0a73f992ce\", [8, 16, 128, 128], [8, 16, 128, 128]]", "cuda -keys=cuda,gpu -arch=sm_86 -max_num_threads=1024 -thread_warp_size=32", [-1, 16, 64, 49152, 2147483647, 1024, 8, 32], "llvm -keys=cpu ", 0, []], [[], [["SP", 4, 3, 128, [64], 1], ["AN", 4, 4, 6], ["FSP", 3, 3, 0, 1], ["AN", 3, 4, 6], ["CA", 3, 4, 2], ["CI", 2], ["FU", 4, [0, 1, 2]], ["AN", 4, 0, 5], ["FU", 1, [0, 1, 2]], ["SP", 1, 0, 16384, [32], 1], ["AN", 1, 0, 5], ["AN", 1, 1, 6], ["PR", 1, 0, "auto_unroll_max_step$1024"], ["PR", 3, 0, "auto_unroll_max_step$0"]]]], "r": [[6.11517e-05, 6.16656e-05, 6.15288e-05], 0, 1.71007, 1674961232], "v": "v0.6"}
{"i": [["[\"05ea4bc9dd6b49bd09addb0a73f992ce\", [8, 16, 128, 128], [8, 16, 128, 128]]", "cuda -keys=cuda,gpu -arch=sm_86 -max_num_threads=1024 -thread_warp_size=32", [-1, 16, 64, 49152, 2147483647, 1024, 8, 32], "llvm -keys=cpu ", 0, []], [[], [["SP", 4, 3, 128, [4], 1], ["AN", 4, 4, 6], ["FSP", 3, 3, 0, 1], ["AN", 3, 4, 6], ["CA", 3, 4, 2], ["CI", 2], ["FU", 4, [0, 1, 2]], ["AN", 4, 0, 5], ["FU", 1, [0, 1, 2]], ["SP", 1, 0, 16384, [32], 1], ["AN", 1, 0, 5], ["AN", 1, 1, 6], ["PR", 1, 0, "auto_unroll_max_step$64"], ["PR", 3, 0, "auto_unroll_max_step$64"]]]], "r": [[8.01524e-05, 8.20771e-05, 8.19109e-05], 0, 1.63631, 1674961233], "v": "v0.6"}
{"i": [["[\"05ea4bc9dd6b49bd09addb0a73f992ce\", [8, 16, 128, 128], [8, 16, 128, 128]]", "cuda -keys=cuda,gpu -arch=sm_86 -max_num_threads=1024 -thread_warp_size=32", [-1, 16, 64, 49152, 2147483647, 1024, 8, 32], "llvm -keys=cpu ", 0, []], [[], [["CI", 2], ["SP", 1, 3, 128, [32], 1], ["AN", 1, 4, 6], ["FU", 4, [0, 1, 2, 3]], ["SP", 4, 0, 2097152, [32], 1], ["AN", 4, 0, 5], ["AN", 4, 1, 6], ["FU", 3, [0, 1, 2]], ["SP", 3, 0, 16384, [32], 1], ["AN", 3, 0, 5], ["AN", 3, 1, 6], ["FU", 1, [0, 1, 2]], ["AN", 1, 0, 5], ["PR", 1, 0, "auto_unroll_max_step$1024"], ["PR", 3, 0, "auto_unroll_max_step$16"]]]], "r": [[0.000103813, 0.00010469, 0.000105039], 0, 1.48196, 1674961234], "v": "v0.6"}
{"i": [["[\"05ea4bc9dd6b49bd09addb0a73f992ce\", [8, 16, 128, 128], [8, 16, 128, 128]]", "cuda -keys=cuda,gpu -arch=sm_86 -max_num_threads=1024 -thread_warp_size=32", [-1, 16, 64, 49152, 2147483647, 1024, 8, 32], "llvm -keys=cpu ", 0, []], [[], [["SP", 4, 3, 128, [32], 1], ["AN", 4, 4, 6], ["FSP", 3, 3, 0, 1], ["AN", 3, 4, 6], ["CA", 3, 4, 2], ["CI", 2], ["FU", 4, [0, 1, 2]], ["AN", 4, 0, 5], ["FU", 1, [0, 1, 2]], ["SP", 1, 0, 16384, [64], 1], ["AN", 1, 0, 5], ["AN", 1, 1, 6], ["PR", 1, 0, "auto_unroll_max_step$1024"], ["PR", 3, 0, "auto_unroll_max_step$16"]]]], "r": [[6.20438e-05, 6.20355e-05, 6.30117e-05], 0, 2.10217, 1674961236], "v": "v0.6"}
{"i": [["[\"05ea4bc9dd6b49bd09addb0a73f992ce\", [8, 16, 128, 128], [8, 16, 128, 128]]", "cuda -keys=cuda,gpu -arch=sm_86 -max_num_threads=1024 -thread_warp_size=32", [-1, 16, 64, 49152, 2147483647, 1024, 8, 32], "llvm -keys=cpu ", 0, []], [[], [["CI", 2], ["SP", 1, 3, 128, [1], 1], ["AN", 1, 4, 6], ["FU", 4, [0, 1, 2, 3]], ["SP", 4, 0, 2097152, [4], 1], ["AN", 4, 0, 5], ["AN", 4, 1, 6], ["FU", 3, [0, 1, 2]], ["SP", 3, 0, 16384, [32], 1], ["AN", 3, 0, 5], ["AN", 3, 1, 6], ["FU", 1, [0, 1, 2]], ["AN", 1, 0, 5], ["PR", 1, 0, "auto_unroll_max_step$0"], ["PR", 3, 0, "auto_unroll_max_step$0"]]]], "r": [[0.000460077, 0.000460124, 0.0004601], 0, 2.09651, 1674961237], "v": "v0.6"}
{"i": [["[\"05ea4bc9dd6b49bd09addb0a73f992ce\", [8, 16, 128, 128], [8, 16, 128, 128]]", "cuda -keys=cuda,gpu -arch=sm_86 -max_num_threads=1024 -thread_warp_size=32", [-1, 16, 64, 49152, 2147483647, 1024, 8, 32], "llvm -keys=cpu ", 0, []], [[], [["SP", 4, 3, 128, [4], 1], ["AN", 4, 4, 6], ["FSP", 3, 3, 0, 1], ["AN", 3, 4, 6], ["CA", 3, 4, 2], ["CI", 2], ["FSP", 1, 3, 0, 1], ["AN", 1, 4, 6], ["CA", 1, 4, 2], ["FU", 4, [0, 1, 2]], ["AN", 4, 0, 5], ["PR", 1, 0, "auto_unroll_max_step$0"], ["PR", 3, 0, "auto_unroll_max_step$16"]]]], "r": [[6.80968e-05, 6.98697e-05, 6.99081e-05], 0, 1.65721, 1674961239], "v": "v0.6"}
{"i": [["[\"05ea4bc9dd6b49bd09addb0a73f992ce\", [8, 16, 128, 128], [8, 16, 128, 128]]", "cuda -keys=cuda,gpu -arch=sm_86 -max_num_threads=1024 -thread_warp_size=32", [-1, 16, 64, 49152, 2147483647, 1024, 8, 32], "llvm -keys=cpu ", 0, []], [[], [["CI", 2], ["FU", 4, [0, 1, 2, 3]], ["SP", 4, 0, 2097152, [2], 1], ["AN", 4, 0, 5], ["AN", 4, 1, 6], ["FU", 3, [0, 1, 2]], ["SP", 3, 0, 16384, [32], 1], ["AN", 3, 0, 5], ["AN", 3, 1, 6], ["FU", 1, [0, 1, 2]], ["SP", 1, 0, 16384, [32], 1], ["AN", 1, 0, 5], ["AN", 1, 1, 6], ["PR", 1, 0, "auto_unroll_max_step$16"], ["PR", 3, 0, "auto_unroll_max_step$1024"]]]], "r": [[0.000793043, 0.000793033, 0.000793003], 0, 2.13286, 1674961240], "v": "v0.6"}
{"i": [["[\"05ea4bc9dd6b49bd09addb0a73f992ce\", [8, 16, 128, 128], [8, 16, 128, 128]]", "cuda -keys=cuda,gpu -arch=sm_86 -max_num_threads=1024 -thread_warp_size=32", [-1, 16, 64, 49152, 2147483647, 1024, 8, 32], "llvm -keys=cpu ", 0, []], [[], [["CI", 2], ["FU", 4, [0, 1, 2, 3]], ["SP", 4, 0, 2097152, [4], 1], ["AN", 4, 0, 5], ["AN", 4, 1, 6], ["FU", 3, [0, 1, 2]], ["SP", 3, 0, 16384, [1], 1], ["AN", 3, 0, 5], ["AN", 3, 1, 6], ["FU", 1, [0, 1, 2]], ["SP", 1, 0, 16384, [16], 1], ["AN", 1, 0, 5], ["AN", 1, 1, 6], ["PR", 1, 0, "auto_unroll_max_step$64"], ["PR", 3, 0, "auto_unroll_max_step$512"]]]], "r": [[0.000499305, 0.000499275, 0.000499317], 0, 2.10396, 1674961242], "v": "v0.6"}
{"i": [["[\"05ea4bc9dd6b49bd09addb0a73f992ce\", [8, 16, 128, 128], [8, 16, 128, 128]]", "cuda -keys=cuda,gpu -arch=sm_86 -max_num_threads=1024 -thread_warp_size=32", [-1, 16, 64, 49152, 2147483647, 1024, 8, 32], "llvm -keys=cpu ", 0, []], [[], [["SP", 4, 3, 128, [4], 1], ["AN", 4, 4, 6], ["FSP", 3, 3, 0, 1], ["AN", 3, 4, 6], ["CA", 3, 4, 2], ["CI", 2], ["FU", 4, [0, 1, 2]], ["AN", 4, 0, 5], ["FU", 1, [0, 1, 2]], ["SP", 1, 0, 16384, [8], 1], ["AN", 1, 0, 5], ["AN", 1, 1, 6], ["PR", 1, 0, "auto_unroll_max_step$1024"], ["PR", 3, 0, "auto_unroll_max_step$16"]]]], "r": [[7.80227e-05, 8.01525e-05, 8.01814e-05], 0, 1.62368, 1674961243], "v": "v0.6"}
{"i": [["[\"05ea4bc9dd6b49bd09addb0a73f992ce\", [8, 16, 128, 128], [8, 16, 128, 128]]", "cuda -keys=cuda,gpu -arch=sm_86 -max_num_threads=1024 -thread_warp_size=32", [-1, 16, 64, 49152, 2147483647, 1024, 8, 32], "llvm -keys=cpu ", 0, []], [[], [["SP", 4, 3, 128, [64], 1], ["AN", 4, 4, 6], ["FSP", 3, 3, 0, 1], ["AN", 3, 4, 6], ["CA", 3, 4, 2], ["CI", 2], ["FU", 4, [0, 1, 2]], ["AN", 4, 0, 5], ["FU", 1, [0, 1, 2]], ["SP", 1, 0, 16384, [64], 1], ["AN", 1, 0, 5], ["AN", 1, 1, 6], ["PR", 1, 0, "auto_unroll_max_step$16"], ["PR", 3, 0, "auto_unroll_max_step$0"]]]], "r": [[6.26048e-05, 6.31731e-05, 6.30937e-05], 0, 1.51946, 1674961245], "v": "v0.6"}
{"i": [["[\"05ea4bc9dd6b49bd09addb0a73f992ce\", [8, 16, 128, 128], [8, 16, 128, 128]]", "cuda -keys=cuda,gpu -arch=sm_86 -max_num_threads=1024 -thread_warp_size=32", [-1, 16, 64, 49152, 2147483647, 1024, 8, 32], "llvm -keys=cpu ", 0, []], [[], [["SP", 4, 3, 128, [2], 1], ["AN", 4, 4, 6], ["FSP", 3, 3, 0, 1], ["AN", 3, 4, 6], ["CA", 3, 4, 2], ["CI", 2], ["FSP", 1, 3, 0, 1], ["AN", 1, 4, 6], ["CA", 1, 4, 2], ["FU", 4, [0, 1, 2]], ["AN", 4, 0, 5], ["PR", 1, 0, "auto_unroll_max_step$16"], ["PR", 3, 0, "auto_unroll_max_step$64"]]]], "r": [[0.0001337, 0.000136741, 0.000136565], 0, 1.70404, 1674961246], "v": "v0.6"}
{"i": [["[\"05ea4bc9dd6b49bd09addb0a73f992ce\", [8, 16, 128, 128], [8, 16, 128, 128]]", "cuda -keys=cuda,gpu -arch=sm_86 -max_num_threads=1024 -thread_warp_size=32", [-1, 16, 64, 49152, 2147483647, 1024, 8, 32], "llvm -keys=cpu ", 0, []], [[], [["CI", 2], ["SP", 1, 3, 128, [32], 1], ["AN", 1, 4, 6], ["FU", 4, [0, 1, 2, 3]], ["SP", 4, 0, 2097152, [32], 1], ["AN", 4, 0, 5], ["AN", 4, 1, 6], ["FU", 3, [0, 1, 2]], ["SP", 3, 0, 16384, [64], 1], ["AN", 3, 0, 5], ["AN", 3, 1, 6], ["FU", 1, [0, 1, 2]], ["AN", 1, 0, 5], ["PR", 1, 0, "auto_unroll_max_step$1024"], ["PR", 3, 0, "auto_unroll_max_step$16"]]]], "r": [[0.000104741, 0.000105557, 0.000105557], 0, 1.54029, 1674961247], "v": "v0.6"}
{"i": [["[\"05ea4bc9dd6b49bd09addb0a73f992ce\", [8, 16, 128, 128], [8, 16, 128, 128]]", "cuda -keys=cuda,gpu -arch=sm_86 -max_num_threads=1024 -thread_warp_size=32", [-1, 16, 64, 49152, 2147483647, 1024, 8, 32], "llvm -keys=cpu ", 0, []], [[], [["CI", 2], ["SP", 1, 3, 128, [4], 1], ["AN", 1, 4, 6], ["FU", 4, [0, 1, 2, 3]], ["SP", 4, 0, 2097152, [32], 1], ["AN", 4, 0, 5], ["AN", 4, 1, 6], ["FU", 3, [0, 1, 2]], ["SP", 3, 0, 16384, [32], 1], ["AN", 3, 0, 5], ["AN", 3, 1, 6], ["FU", 1, [0, 1, 2]], ["AN", 1, 0, 5], ["PR", 1, 0, "auto_unroll_max_step$0"], ["PR", 3, 0, "auto_unroll_max_step$1024"]]]], "r": [[0.000106632, 0.000107669, 0.000107662], 0, 1.53183, 1674961248], "v": "v0.6"}
{"i": [["[\"05ea4bc9dd6b49bd09addb0a73f992ce\", [8, 16, 128, 128], [8, 16, 128, 128]]", "cuda -keys=cuda,gpu -arch=sm_86 -max_num_threads=1024 -thread_warp_size=32", [-1, 16, 64, 49152, 2147483647, 1024, 8, 32], "llvm -keys=cpu ", 0, []], [[], [["CI", 2], ["SP", 1, 3, 128, [64], 1], ["AN", 1, 4, 6], ["FU", 4, [0, 1, 2, 3]], ["SP", 4, 0, 2097152, [32], 1], ["AN", 4, 0, 5], ["AN", 4, 1, 6], ["FU", 3, [0, 1, 2]], ["SP", 3, 0, 16384, [32], 1], ["AN", 3, 0, 5], ["AN", 3, 1, 6], ["FU", 1, [0, 1, 2]], ["AN", 1, 0, 5], ["PR", 1, 0, "auto_unroll_max_step$64"], ["PR", 3, 0, "auto_unroll_max_step$1024"]]]], "r": [[0.000105236, 0.000106368, 0.000106369], 0, 1.49323, 1674961249], "v": "v0.6"}
{"i": [["[\"05ea4bc9dd6b49bd09addb0a73f992ce\", [8, 16, 128, 128], [8, 16, 128, 128]]", "cuda -keys=cuda,gpu -arch=sm_86 -max_num_threads=1024 -thread_warp_size=32", [-1, 16, 64, 49152, 2147483647, 1024, 8, 32], "llvm -keys=cpu ", 0, []], [[], [["CI", 2], ["SP", 1, 3, 128, [2], 1], ["AN", 1, 4, 6], ["FU", 4, [0, 1, 2, 3]], ["SP", 4, 0, 2097152, [32], 1], ["AN", 4, 0, 5], ["AN", 4, 1, 6], ["FU", 3, [0, 1, 2]], ["SP", 3, 0, 16384, [64], 1], ["AN", 3, 0, 5], ["AN", 3, 1, 6], ["FU", 1, [0, 1, 2]], ["AN", 1, 0, 5], ["PR", 1, 0, "auto_unroll_max_step$64"], ["PR", 3, 0, "auto_unroll_max_step$1024"]]]], "r": [[0.000111181, 0.000112503, 0.000112515], 0, 1.49873, 1674961250], "v": "v0.6"}
{"i": [["[\"05ea4bc9dd6b49bd09addb0a73f992ce\", [8, 16, 128, 128], [8, 16, 128, 128]]", "cuda -keys=cuda,gpu -arch=sm_86 -max_num_threads=1024 -thread_warp_size=32", [-1, 16, 64, 49152, 2147483647, 1024, 8, 32], "llvm -keys=cpu ", 0, []], [[], [["CI", 2], ["SP", 1, 3, 128, [32], 1], ["AN", 1, 4, 6], ["FU", 4, [0, 1, 2, 3]], ["SP", 4, 0, 2097152, [32], 1], ["AN", 4, 0, 5], ["AN", 4, 1, 6], ["FU", 3, [0, 1, 2]], ["SP", 3, 0, 16384, [16], 1], ["AN", 3, 0, 5], ["AN", 3, 1, 6], ["FU", 1, [0, 1, 2]], ["AN", 1, 0, 5], ["PR", 1, 0, "auto_unroll_max_step$512"], ["PR", 3, 0, "auto_unroll_max_step$512"]]]], "r": [[0.000103513, 0.000104354, 0.000104302], 0, 1.54071, 1674961252], "v": "v0.6"}
{"i": [["[\"05ea4bc9dd6b49bd09addb0a73f992ce\", [8, 16, 128, 128], [8, 16, 128, 128]]", "cuda -keys=cuda,gpu -arch=sm_86 -max_num_threads=1024 -thread_warp_size=32", [-1, 16, 64, 49152, 2147483647, 1024, 8, 32], "llvm -keys=cpu ", 0, []], [[], [["CI", 2], ["FU", 4, [0, 1, 2, 3]], ["SP", 4, 0, 2097152, [1], 1], ["AN", 4, 0, 5], ["AN", 4, 1, 6], ["FU", 3, [0, 1, 2]], ["SP", 3, 0, 16384, [32], 1], ["AN", 3, 0, 5], ["AN", 3, 1, 6], ["FU", 1, [0, 1, 2]], ["SP", 1, 0, 16384, [64], 1], ["AN", 1, 0, 5], ["AN", 1, 1, 6], ["PR", 1, 0, "auto_unroll_max_step$1024"], ["PR", 3, 0, "auto_unroll_max_step$512"]]]], "r": [[0.00153028, 0.00153036, 0.0015303], 0, 1.48968, 1674961253], "v": "v0.6"}
{"i": [["[\"05ea4bc9dd6b49bd09addb0a73f992ce\", [8, 16, 128, 128], [8, 16, 128, 128]]", "cuda -keys=cuda,gpu -arch=sm_86 -max_num_threads=1024 -thread_warp_size=32", [-1, 16, 64, 49152, 2147483647, 1024, 8, 32], "llvm -keys=cpu ", 0, []], [[], [["CI", 2], ["FU", 4, [0, 1, 2, 3]], ["SP", 4, 0, 2097152, [32], 1], ["AN", 4, 0, 5], ["AN", 4, 1, 6], ["FU", 3, [0, 1, 2]], ["SP", 3, 0, 16384, [32], 1], ["AN", 3, 0, 5], ["AN", 3, 1, 6], ["FU", 1, [0, 1, 2]], ["SP", 1, 0, 16384, [32], 1], ["AN", 1, 0, 5], ["AN", 1, 1, 6], ["PR", 1, 0, "auto_unroll_max_step$16"], ["PR", 3, 0, "auto_unroll_max_step$0"]]]], "r": [[0.000115322, 0.000116136, 0.000116109], 0, 1.52279, 1674961254], "v": "v0.6"}
{"i": [["[\"05ea4bc9dd6b49bd09addb0a73f992ce\", [8, 16, 128, 128], [8, 16, 128, 128]]", "cuda -keys=cuda,gpu -arch=sm_86 -max_num_threads=1024 -thread_warp_size=32", [-1, 16, 64, 49152, 2147483647, 1024, 8, 32], "llvm -keys=cpu ", 0, []], [[], [["SP", 4, 3, 128, [2], 1], ["AN", 4, 4, 6], ["FSP", 3, 3, 0, 1], ["AN", 3, 4, 6], ["CA", 3, 4, 2], ["CI", 2], ["FSP", 1, 3, 0, 1], ["AN", 1, 4, 6], ["CA", 1, 4, 2], ["FU", 4, [0, 1, 2]], ["AN", 4, 0, 5], ["PR", 1, 0, "auto_unroll_max_step$512"], ["PR", 3, 0, "auto_unroll_max_step$64"]]]], "r": [[0.000133873, 0.000137193, 0.000137061], 0, 1.69587, 1674961255], "v": "v0.6"}
{"i": [["[\"05ea4bc9dd6b49bd09addb0a73f992ce\", [8, 16, 128, 128], [8, 16, 128, 128]]", "cuda -keys=cuda,gpu -arch=sm_86 -max_num_threads=1024 -thread_warp_size=32", [-1, 16, 64, 49152, 2147483647, 1024, 8, 32], "llvm -keys=cpu ", 0, []], [[], [["SP", 4, 3, 128, [32], 1], ["AN", 4, 4, 6], ["FSP", 3, 3, 0, 1], ["AN", 3, 4, 6], ["CA", 3, 4, 2], ["CI", 2], ["FU", 4, [0, 1, 2]], ["AN", 4, 0, 5], ["FU", 1, [0, 1, 2]], ["SP", 1, 0, 16384, [64], 1], ["AN", 1, 0, 5], ["AN", 1, 1, 6], ["PR", 1, 0, "auto_unroll_max_step$64"], ["PR", 3, 0, "auto_unroll_max_step$512"]]]], "r": [[6.18289e-05, 6.21992e-05, 6.21836e-05], 0, 1.4768, 1674961256], "v": "v0.6"}
{"i": [["[\"05ea4bc9dd6b49bd09addb0a73f992ce\", [8, 16, 128, 128], [8, 16, 128, 128]]", "cuda -keys=cuda,gpu -arch=sm_86 -max_num_threads=1024 -thread_warp_size=32", [-1, 16, 64, 49152, 2147483647, 1024, 8, 32], "llvm -keys=cpu ", 0, []], [[], [["SP", 4, 3, 128, [16], 1], ["AN", 4, 4, 6], ["FSP", 3, 3, 0, 1], ["AN", 3, 4, 6], ["CA", 3, 4, 2], ["CI", 2], ["FSP", 1, 3, 0, 1], ["AN", 1, 4, 6], ["CA", 1, 4, 2], ["FU", 4, [0, 1, 2]], ["AN", 4, 0, 5], ["PR", 1, 0, "auto_unroll_max_step$64"], ["PR", 3, 0, "auto_unroll_max_step$0"]]]], "r": [[3.66991e-05, 3.72076e-05, 3.72124e-05], 0, 1.52141, 1674961258], "v": "v0.6"}
{"i": [["[\"05ea4bc9dd6b49bd09addb0a73f992ce\", [8, 16, 128, 128], [8, 16, 128, 128]]", "cuda -keys=cuda,gpu -arch=sm_86 -max_num_threads=1024 -thread_warp_size=32", [-1, 16, 64, 49152, 2147483647, 1024, 8, 32], "llvm -keys=cpu ", 0, []], [[], [["CI", 2], ["SP", 1, 3, 128, [64], 1], ["AN", 1, 4, 6], ["FU", 4, [0, 1, 2, 3]], ["SP", 4, 0, 2097152, [1], 1], ["AN", 4, 0, 5], ["AN", 4, 1, 6], ["FU", 3, [0, 1, 2]], ["SP", 3, 0, 16384, [32], 1], ["AN", 3, 0, 5], ["AN", 3, 1, 6], ["FU", 1, [0, 1, 2]], ["AN", 1, 0, 5], ["PR", 1, 0, "auto_unroll_max_step$512"], ["PR", 3, 0, "auto_unroll_max_step$16"]]]], "r": [[0.0015187, 0.00151869, 0.00151866], 0, 1.50843, 1674961259], "v": "v0.6"}
{"i": [["[\"05ea4bc9dd6b49bd09addb0a73f992ce\", [8, 16, 128, 128], [8, 16, 128, 128]]", "cuda -keys=cuda,gpu -arch=sm_86 -max_num_threads=1024 -thread_warp_size=32", [-1, 16, 64, 49152, 2147483647, 1024, 8, 32], "llvm -keys=cpu ", 0, []], [[], [["CI", 2], ["SP", 1, 3, 128, [16], 1], ["AN", 1, 4, 6], ["FU", 4, [0, 1, 2, 3]], ["SP", 4, 0, 2097152, [32], 1], ["AN", 4, 0, 5], ["AN", 4, 1, 6], ["FU", 3, [0, 1, 2]], ["SP", 3, 0, 16384, [32], 1], ["AN", 3, 0, 5], ["AN", 3, 1, 6], ["FU", 1, [0, 1, 2]], ["AN", 1, 0, 5], ["PR", 1, 0, "auto_unroll_max_step$512"], ["PR", 3, 0, "auto_unroll_max_step$0"]]]], "r": [[0.000104716, 0.000105555, 0.000105557], 0, 1.47419, 1674961260], "v": "v0.6"}
{"i": [["[\"05ea4bc9dd6b49bd09addb0a73f992ce\", [8, 16, 128, 128], [8, 16, 128, 128]]", "cuda -keys=cuda,gpu -arch=sm_86 -max_num_threads=1024 -thread_warp_size=32", [-1, 16, 64, 49152, 2147483647, 1024, 8, 32], "llvm -keys=cpu ", 0, []], [[], [["CI", 2], ["SP", 1, 3, 128, [4], 1], ["AN", 1, 4, 6], ["FU", 4, [0, 1, 2, 3]], ["SP", 4, 0, 2097152, [2], 1], ["AN", 4, 0, 5], ["AN", 4, 1, 6], ["FU", 3, [0, 1, 2]], ["SP", 3, 0, 16384, [2], 1], ["AN", 3, 0, 5], ["AN", 3, 1, 6], ["FU", 1, [0, 1, 2]], ["AN", 1, 0, 5], ["PR", 1, 0, "auto_unroll_max_step$0"], ["PR", 3, 0, "auto_unroll_max_step$64"]]]], "r": [[0.000802552, 0.00080258, 0.000802573], 0, 2.1027, 1674961262], "v": "v0.6"}
{"i": [["[\"05ea4bc9dd6b49bd09addb0a73f992ce\", [8, 16, 128, 128], [8, 16, 128, 128]]", "cuda -keys=cuda,gpu -arch=sm_86 -max_num_threads=1024 -thread_warp_size=32", [-1, 16, 64, 49152, 2147483647, 1024, 8, 32], "llvm -keys=cpu ", 0, []], [[], [["CI", 2], ["FU", 4, [0, 1, 2, 3]], ["SP", 4, 0, 2097152, [32], 1], ["AN", 4, 0, 5], ["AN", 4, 1, 6], ["FU", 3, [0, 1, 2]], ["SP", 3, 0, 16384, [32], 1], ["AN", 3, 0, 5], ["AN", 3, 1, 6], ["FU", 1, [0, 1, 2]], ["SP", 1, 0, 16384, [32], 1], ["AN", 1, 0, 5], ["AN", 1, 1, 6], ["PR", 1, 0, "auto_unroll_max_step$1024"], ["PR", 3, 0, "auto_unroll_max_step$1024"]]]], "r": [[0.000115164, 0.000116099, 0.000116179], 0, 1.53836, 1674961263], "v": "v0.6"}
